{"latest news": [{"article_url": "https://www.fark.com/comments/13364810", "article_id": "54bd7186-833a-541c-bc19-98702870273d", "classification": "Military", "country": "US", "source_id": "Fark", "page_rank": 7899, "domain_url": "fark.com", "eng_title": "Where do Russian pontoons \"disappear\" in Kurshchyna\u2753", "entities": {"Person": [], "Organization": [], "Location": ["Sumy Oblast", "Belgorod", "Kursk", "Zaporizhzhia Oblast", "Bryansk"], "Nationality": ["Ukrainian", "Russian"], "Date": ["September 6", "February 24, 2022"], "Event": ["Ramstein-format meeting"], "Money": [], "Law": [], "Quantity": ["45,000", "603,010", "1,260 square kilometers"], "Time": [], "Sports": [], "Politics": [], "Title": [], "Number": ["5", "92", "31", "15-year-old"], "Arms": ["S-300"], "Product": [], "Media": [], "Transportation": [], "Religion": [], "Technology": [], "Space": [], "Medicine": [], "Language": [], "Science": []}, "image_url": "https://www.fark.com/dummyimage/850/1062", "keywords": ["Kursk", "Ukrainian forces", "Russian military", "Zaporizhzhia Oblast", "Ramstein-format meeting"], "language": "en", "pub_date": "2024-08-21 12:00:00+00:00", "summary": "Ukrainian forces have made significant gains in the Kursk region, controlling over 1,260 square kilometers and 92 settlements. The Ukrainian military has also targeted Russian S-300 air defense systems and oil depots, causing significant damage. The Russian military has responded with airstrikes on Ukrainian positions, killing 5 civilians and injuring 31. The conflict has also led to the evacuation of 45,000 residents from Sumy Oblast. Ukrainian forces have also made gains in the Zaporizhzhia Oblast, seizing a children's cafe and killing a 15-year-old boy. The Russian military has also been weakened by the loss of 603,010 troops since February 24, 2022. The conflict continues to escalate, with both sides engaging in intense fighting. Ukrainian forces have also targeted Russian troop groups in Belgorod, Kursk, and Bryansk oblasts. The next Ramstein-format meeting will be held on September 6.", "title": "Where do Russian pontoons \"disappear\" in Kurshchyna\u2753", "sentiment": -1, "medoid_distance": null, "markdown_citation": "[F](https://www.fark.com/comments/13364810)", "provocative": "medium", "reporting_voice": "Objective", "as_string_key": "[1]"}, {"article_url": "https://tsn.ua/politika/putin-nakazav-vitisniti-zsu-z-kurskoyi-oblasti-dzherela-nazvali-termini-2643858.html", "article_id": "e630c689-27c2-5740-8398-3128d349e0d8", "classification": "Politics", "country": "UA", "source_id": "\u0422\u0421\u041d.ua", "page_rank": 9212, "domain_url": "tsn.ua", "eng_title": "Putin Orders Russian Army to Expel Ukrainian Forces from Kursk Region", "entities": {"Person": ["Vladimir Putin", "Viktor Kevlyuk"], "Organization": ["Black Sea Fleet", "810th Brigade", "Centre for Defence Strategies", "155th Marine Brigade"], "Location": ["Kherson", "Pokrovsk", "Zaporizhzhia", "Kursk", "Vugledar", "Donbas", "Toretsk"], "Nationality": ["Russian", "Ukrainian"], "Date": ["October 1", "spring of 2024"], "Event": [], "Money": [], "Law": [], "Quantity": [], "Time": [], "Sports": [], "Politics": [], "Title": ["President"], "Number": [], "Arms": [], "Product": [], "Media": ["The Times"], "Transportation": [], "Religion": [], "Technology": [], "Space": [], "Medicine": [], "Language": [], "Science": []}, "image_url": "https://img.tsn.ua/cached/156/tsn-fc8d4bb0191801bebf97b41f256288af/thumbs/1200x630/2b/3b/f8199635173e4f5361e96076f7cd3b2b.jpeg", "keywords": ["Russia", "Ukraine", "Kursk Region", "Vladimir Putin", "Donbas Front"], "language": "uk", "pub_date": "2024-08-20 09:50:00+00:00", "summary": "Russian President Vladimir Putin has ordered his army to expel Ukrainian forces from the Kursk region. However, he has forbidden the withdrawal of troops from key areas on the Donbas front. According to sources, the Russian military has been instructed to clear the Kursk region by October 1, without redeploying troops from key areas such as Pokrovsk and Toretsk. The article states that Russia is currently attempting to redirect troops from various front lines to the Kursk region, except for Pokrovsk and Toretsk. This suggests that Russia has limited 'free' forces and reserves, and that their limited successes in the Donbas region are more important to them than regaining control of the Kursk region. Viktor Kevlyuk, an expert at the Centre for Defence Strategies, stated that the Russian military is 'smuggling' troops from the front line. Specifically, two brigades were removed from the Zaporizhzhia region, and two airborne assault battalions were removed from the Kherson direction. 'The 810th Brigade of the Black Sea Fleet, which was previously stationed in the Kherson direction, and the 155th Marine Brigade, which fought near Vugledar, have been redeployed to the Kursk region. Even conscripts who were called up in the spring of 2024 are being redeployed,' Kevlyuk said. The article notes that The Times reported in the fall of this year that the Ukrainian army's operation on Russian territory and the capture of many settlements would be a humiliation for the Russian army.", "title": "\u041f\u0443\u0442\u0456\u043d \u043d\u0430\u043a\u0430\u0437\u0430\u0432 \u0432\u0438\u0442\u0456\u0441\u043d\u0438\u0442\u0438 \u0417\u0421\u0423 \u0437 \u041a\u0443\u0440\u0441\u044c\u043a\u043e\u0457 \u043e\u0431\u043b\u0430\u0441\u0442\u0456: \u0434\u0436\u0435\u0440\u0435\u043b\u0430 \u043d\u0430\u0437\u0432\u0430\u043b\u0438 \u0442\u0435\u0440\u043c\u0456\u043d\u0438", "sentiment": -1, "medoid_distance": null, "markdown_citation": "[\u0422\u0421\u041d](https://tsn.ua/politika/putin-nakazav-vitisniti-zsu-z-kurskoyi-oblasti-dzherela-nazvali-termini-2643858.html)", "provocative": "medium", "reporting_voice": "Investigative", "as_string_key": "[2]"}, {"article_url": "https://zn.ua/war/putin-prikazal-vernut-kontrol-nad-kurskoj-oblastju-do-1-oktjabrja-smi.html", "article_id": "b1eaf4df-ee0e-51f9-96f3-8868b447b5ed", "classification": "Military", "country": "UA", "source_id": "ZN.UA \u0414\u0437\u0435\u0440\u043a\u0430\u043b\u043e \u0442\u0438\u0436\u043d\u044f/\u0417\u0435\u0440\u043a\u0430\u043b\u043e \u043d\u0435\u0434\u0435\u043b\u0438", "page_rank": 12244, "domain_url": "zn.ua", "eng_title": "Putin Orders Retake of Kursk Region by October 1, but Fails to Withdraw Troops from Donetsk", "entities": {"Person": ["Putin", "Vladimir Putin"], "Organization": ["Marine Corps", "810th brigade", "155th brigade", "Black Sea Fleet"], "Location": ["Zaporizhzhia", "Donetsk region", "Kherson region", "Kursk"], "Nationality": ["Russian"], "Date": ["October 1", "spring of 2024"], "Event": [], "Money": [], "Law": [], "Quantity": ["1,250 square kilometers"], "Time": [], "Sports": [], "Politics": [], "Title": [], "Number": ["92"], "Arms": [], "Product": [], "Media": [], "Transportation": [], "Religion": [], "Technology": [], "Space": [], "Medicine": [], "Language": [], "Science": []}, "image_url": "https://zn.ua/img/article/6083/47_main-v1724144260.webp", "keywords": ["Kursk Region", "Vladimir Putin", "Donetsk Region", "Russian Troops", "Ukraine"], "language": "ru", "pub_date": "2024-08-20 09:04:06+00:00", "summary": "Russian dictator Vladimir Putin has ordered the military to retake control of the Kursk region by October 1, according to military sources. However, the Russian forces are not to withdraw troops from key areas in the Donetsk region, where their offensive is ongoing. Instead, they plan to create a 'mix' of their units from various regions, excluding the two mentioned areas. For example, they have transferred two brigades from the Zaporizhzhia region and two stormtrooper battalions from the Kherson region to the Kursk region. This includes the 810th brigade of the Black Sea Fleet and the 155th brigade of the Marine Corps, as well as conscripts called up in the spring of 2024. This suggests that Russia lacks sufficient free forces and reserves, and that their successes in the Donetsk region are more important to Putin than controlling the Kursk region. Currently, Ukraine controls 92 settlements and over 1,250 square kilometers of territory in the Kursk region.", "title": "\u041f\u0443\u0442\u0438\u043d \u043f\u0440\u0438\u043a\u0430\u0437\u0430\u043b \u0432\u0435\u0440\u043d\u0443\u0442\u044c \u043a\u043e\u043d\u0442\u0440\u043e\u043b\u044c \u043d\u0430\u0434 \u041a\u0443\u0440\u0441\u043a\u043e\u0439 \u043e\u0431\u043b\u0430\u0441\u0442\u044c\u044e \u0434\u043e 1 \u043e\u043a\u0442\u044f\u0431\u0440\u044f \u2014 \u0421\u041c\u0418", "sentiment": -1, "medoid_distance": null, "markdown_citation": "[ZNU](https://zn.ua/war/putin-prikazal-vernut-kontrol-nad-kurskoj-oblastju-do-1-oktjabrja-smi.html)", "provocative": "medium", "reporting_voice": "Investigative", "as_string_key": "[3]"}, {"article_url": "https://www.msn.com/en-us/news/world/ukraines-assault-on-russian-city-of-kursk-takes-moscow-by-surprise-they-do-not-want-to-fight-us/ar-AA1p66wU", "article_id": "d920d514-95c9-54ee-85e6-5c258e3b0bff", "classification": "Military", "country": "US", "source_id": "MSN", "page_rank": 121, "domain_url": "msn.com", "eng_title": "Ukraine's Assault on Russian City of Kursk Takes Moscow by Surprise: 'They Do Not Want to Fight Us'", "entities": {"Person": ["Zelensky", "Volodymyr Zelensky", "Oleksii Drozdenko"], "Organization": ["military administration", "army", "defense industry"], "Location": ["Kursk", "Sumy"], "Nationality": ["Ukrainian", "Russian"], "Date": ["August 6"], "Event": ["economy"], "Money": [], "Law": [], "Quantity": ["400 square miles"], "Time": [], "Sports": [], "Politics": [], "Title": ["President"], "Number": ["150"], "Arms": [], "Product": [], "Media": [], "Transportation": [], "Religion": [], "Technology": [], "Space": [], "Medicine": [], "Language": [], "Science": []}, "image_url": "https://assets.msn.com/statics/icons/Microsoft_16_SVG.ico", "keywords": ["Ukraine", "Russia", "Kursk", "Assault", "Volodymyr Zelensky"], "language": "en", "pub_date": "2024-08-20 07:59:06+00:00", "summary": "The Ukrainian army has launched a successful assault on the Russian city of Kursk, capturing and killing many Russian soldiers. Oleksii Drozdenko, the head of the military administration in Sumy, said, 'They do not want to fight us,' after seeing the condition of the Russian borders. The attack, which started on August 6, has resulted in the capture of around 150 Russian soldiers every day, with minimal casualties for the Ukrainian side. Ukrainian President Volodymyr Zelensky considers the occupation of Kursk a huge strategic win, allowing their allies to help them more effectively. Zelensky hopes that control over 400 square miles of land in Kursk will encourage their allies to remove restrictions on weapon supply and support Ukraine in the war with Russia. 'Our operation in the Kursk region is still inflicting losses on the Russian army and the Russian state, their defense industry, and their economy,' Zelensky said. Experts believe that Ukraine's success is due to Russia's lack of investment in reinforcements in the Kursk region.", "title": "Ukraine's Assault on Russian City of Kursk Takes Moscow by Surprise: 'They Do Not Want to Fight Us'", "sentiment": -1, "medoid_distance": null, "markdown_citation": "[MSN](https://www.msn.com/en-us/news/world/ukraines-assault-on-russian-city-of-kursk-takes-moscow-by-surprise-they-do-not-want-to-fight-us/ar-AA1p66wU)", "provocative": "high", "reporting_voice": "Investigative", "as_string_key": "[4]"}, {"article_url": "https://cursorinfo.co.il/cis-news/operatsiya-vsu-v-kurskoj-oblasti-smi-uznali-o-novom-prikaze-putina", "article_id": "698d4eb4-60f2-58b9-b8cf-4deb613f60b3", "classification": "Politics", "country": "IL", "source_id": "\u041a\u0443\u0440\u0441\u043e\u0440", "page_rank": 140835, "domain_url": "cursorinfo.co.il", "eng_title": "Russia Orders Military to Expel Ukrainian Forces from Kursk Region by October 1", "entities": {"Person": ["Viktor Kevluk", "Vladimir Putin", "Putin"], "Organization": ["Black Sea Fleet", "Kremlin", "Marine Corps", "Center for Defense Strategies"], "Location": ["Toretsk", "Kursk", "Zap\u043e\u0440\u043e\u0436sk", "Donbas", "Khersonsk", "Pokrovsk"], "Nationality": ["Russian", "Ukrainian"], "Date": ["October 1", "spring of 2024"], "Event": [], "Money": [], "Law": [], "Quantity": [], "Time": [], "Sports": [], "Politics": [], "Title": ["President"], "Number": [], "Arms": ["155th brigade"], "Product": [], "Media": [], "Transportation": [], "Religion": [], "Technology": [], "Space": [], "Medicine": [], "Language": [], "Science": []}, "image_url": "https://cursorinfo.co.il/wp-content/uploads/2024/06/IMG_2502.jpeg", "keywords": ["Russia", "Ukraine", "Kursk Region", "Vladimir Putin", "Donbas Front"], "language": "ru", "pub_date": "2024-08-20 07:54:46+00:00", "summary": "Russian President Vladimir Putin has ordered his military to expel Ukrainian forces from the Kursk region by October 1. According to sources, Putin has instructed the military to 'do whatever it takes' to liberate the region, but without withdrawing forces from key areas on the Donbas front. This includes the Pokrovsk and Toretsk directions, where Russian forces have intensified their assault. In fact, Russia is now attempting to redirect 'a mix' of units from all front lines, except for Pokrovsk and Toretsk, to the Kursk region. This indicates that Russia has limited 'free' forces and reserves, and that their successes in Pokrovsk and Toretsk are more valuable to the Kremlin than regaining control of the Kursk region, as noted by an expert. Additionally, Russia is withdrawing troops from the front lines, including two brigades from the Zap\u043e\u0440\u043e\u0436sk direction and two d\u0435\u0441antno-shurmovoy b\u0430\u0442\u0430\u043b\u044c\u043e\u043d\u044b from the Khersonsk direction. The 810th brigade of the Black Sea Fleet and the 155th brigade of the Marine Corps have been redeployed to the Kursk region, as well as conscripts who were called up in the spring of 2024, according to Viktor Kevluk, an expert at the Center for Defense Strategies. 'It was a great day' for the Russian military, said no one, as they face a daunting task in liberating the Kursk region without compromising their positions on the Donbas front. ", "title": "\u041e\u043f\u0435\u0440\u0430\u0446\u0438\u044f \u0412\u0421\u0423 \u0432 \u043a\u0443\u0440\u0441\u043a\u043e\u0439 \u043e\u0431\u043b\u0430\u0441\u0442\u0438 \u2014 \u0421\u041c\u0418 \u0443\u0437\u043d\u0430\u043b\u0438 \u043e \u043d\u043e\u0432\u043e\u043c \u043f\u0440\u0438\u043a\u0430\u0437\u0435 \u043f\u0443\u0442\u0438\u043d\u0430", "sentiment": -1, "medoid_distance": null, "markdown_citation": "[\u041a](https://cursorinfo.co.il/cis-news/operatsiya-vsu-v-kurskoj-oblasti-smi-uznali-o-novom-prikaze-putina)", "provocative": "medium", "reporting_voice": "Investigative", "as_string_key": "[5]"}, {"article_url": "https://kp.ua/life/a695584-putin-prikazal-vytesnit-vsu-iz-kurskoj-oblasti-do-1-oktjabrja-smi", "article_id": "a162e719-ac9a-53ff-86f4-7336626f1e79", "classification": "Politics", "country": "UA", "source_id": "KP.UA", "page_rank": 16287, "domain_url": "kp.ua", "eng_title": "Putin Orders Ukrainian Forces Out of Kursk Region by October 1", "entities": {"Person": ["Viktor Kevlyuk", "Volodymyr Zelensky", "Vladimir Putin"], "Organization": ["military-political leadership", "Center for Defense Strategies", "desant-storm battalions"], "Location": ["Kherson", "Kursk", "Toretsk", "Zaporizhzhia", "Donbass", "Sudzhya", "Pokrovsk"], "Nationality": ["Ukrainian", "Russian", "Russians"], "Date": ["August 6", "spring of 2024", "August 19", "October 1"], "Event": [], "Money": [], "Law": [], "Quantity": ["1,250 square kilometers"], "Time": [], "Sports": [], "Politics": [], "Title": ["President"], "Number": ["92"], "Arms": [], "Product": [], "Media": [], "Transportation": [], "Religion": [], "Technology": [], "Space": [], "Medicine": [], "Language": [], "Science": []}, "image_url": "https://kp.ua/img/article/6955/84_news_big-v1724138111.png", "keywords": ["Kursk Region", "Ukrainian Forces", "Vladimir Putin", "Donbass Front"], "language": "ru", "pub_date": "2024-08-20 07:15:00+00:00", "summary": "Russian President Vladimir Putin has ordered his military to push Ukrainian forces out of the Kursk region by October 1, but not to withdraw troops from key areas on the Donbass front. According to a source in the military-political leadership, the occupying forces have been instructed to 'definitely' remove Ukrainian forces from the Kursk region, without withdrawing troops from key areas such as Pokrovsk and Toretsk. 'The enemy is pulling troops directly from the front line,' said Viktor Kevlyuk, an expert at the Center for Defense Strategies. 'They have taken two brigades from the Zaporizhzhia region, two desant-storm battalions from the Kherson direction, and even transferred servicemen on short-term service, called up in the spring of 2024.' Kevlyuk noted that the Russians are trying to send a 'mix' of units from all directions of the front, except for Pokrovsk and Toretsk, indicating that the enemy has few 'free' forces and reserves. Ukrainian President Volodymyr Zelensky stated on August 19 that Ukrainian forces control over 1,250 square kilometers of territory and 92 settlements in the Kursk region. Ukrainian forces began their offensive in the Kursk region on August 6, taking control of dozens of settlements, including the city of Sudzhya.", "title": "\u041f\u0443\u0442\u0438\u043d \u043f\u0440\u0438\u043a\u0430\u0437\u0430\u043b \u0432\u044b\u0442\u0435\u0441\u043d\u0438\u0442\u044c \u0412\u0421\u0423 \u0438\u0437 \u041a\u0443\u0440\u0441\u043a\u043e\u0439 \u043e\u0431\u043b\u0430\u0441\u0442\u0438 \u0434\u043e 1 \u043e\u043a\u0442\u044f\u0431\u0440\u044f,", "sentiment": -1, "medoid_distance": null, "markdown_citation": "[KPU](https://kp.ua/life/a695584-putin-prikazal-vytesnit-vsu-iz-kurskoj-oblasti-do-1-oktjabrja-smi)", "provocative": "medium", "reporting_voice": "Investigative", "as_string_key": "[6]"}, {"article_url": "https://www.rbc.ua/rus/news/putin-nakazav-vitisniti-ukrayinski-viyska-1724135586.html", "article_id": "0fd0a4ed-7886-5317-9d3a-636f60a319e1", "classification": "Politics", "country": "UA", "source_id": "\u0420\u0411\u041a-\u0423\u043a\u0440\u0430\u0438\u043d\u0430", "page_rank": 9268, "domain_url": "rbc.ua", "eng_title": "Putin Orders Withdrawal of Ukrainian Forces from Kursk Region by October 1", "entities": {"Person": ["Putin", "Viktor Kevlyuk", "Vladimir Putin"], "Organization": ["155th Marine Brigade", "Kremlin", "Black Sea Fleet", "Center for Defense Strategies"], "Location": ["Kursk", "Kherson", "Pokrovsky", "Toritsky", "Donbas", "Zaporozyhia"], "Nationality": ["Ukrainian", "Russians", "Russian"], "Date": ["October 1"], "Event": [], "Money": [], "Law": [], "Quantity": [], "Time": [], "Sports": [], "Politics": ["Zone of Risk"], "Title": ["President"], "Number": [], "Arms": [], "Product": [], "Media": ["RBC-Ukraine"], "Transportation": [], "Religion": [], "Technology": [], "Space": [], "Medicine": [], "Language": [], "Science": []}, "image_url": "https://www.rbc.ua/static/img/_/g/_gettyimages_1235026329_af791d922e2e6b9ac244955c9d5eabdc_1300x820.jpg", "keywords": ["Putin", "Ukrainian Forces", "Kursk Region", "Donbas Front"], "language": "uk", "pub_date": "2024-08-20 06:33:06+00:00", "summary": "Russian President Vladimir Putin has ordered his military to withdraw Ukrainian forces from the Kursk region by October 1, but not to reduce forces on key areas on the Donbas front. According to a report by RBC-Ukraine, 'Zone of Risk. What to Expect from the Ukrainian Army's Advance in the Kursk Region and How it Will Change the War', a military-political leadership source stated that the occupying forces received instructions from Putin to vacate the Kursk region by October 1. However, their task is to do so in any way possible, without withdrawing forces from key areas where Russia is advancing on Donbas, particularly the Pokrovsky and Toritsky directions. The source noted that the Russian advance on these directions has not slowed down, but rather intensified. In fact, the Russians are now trying to redirect units from all directions of the front, except for the Pokrovsky and Toritsky directions, to the Kursk region. This, in turn, suggests that the enemy has a limited number of 'free' forces and reserves available, and that the limited successes under Pokrovsky and Toritsky are a higher priority for the Kremlin than regaining control over the Kursk region. As reported by the expert of the Center for Defense Strategies, Viktor Kevlyuk, 'The enemy is now mobilizing troops directly from the front line. Specifically, two brigades were taken from the Zaporozyhia region, two airborne assault battalions were taken from the Kherson direction, and the 810th brigade of the Black Sea Fleet, which was previously stationed in the Kherson direction, and the 155th Marine Brigade, which fought under Vugledar, were redeployed to the Kursk region. Even conscripts who were called up in the spring of 2024 are being redeployed.' It is worth noting that as of August 19, President Volodymyr Zelensky stated that our forces control over 1,250 square kilometers of enemy territory and 92 populated areas in the Kursk region.", "title": "\u041f\u0443\u0442\u0456\u043d \u043d\u0430\u043a\u0430\u0437\u0430\u0432 \u0432\u0438\u0442\u0456\u0441\u043d\u0438\u0442\u0438 \u0443\u043a\u0440\u0430\u0457\u043d\u0441\u044c\u043a\u0456 \u0432\u0456\u0439\u0441\u044c\u043a\u0430 \u0437 \u041a\u0443\u0440\u0441\u044c\u043a\u043e\u0457 \u043e\u0431\u043b\u0430\u0441\u0442\u0456 \u0434\u043e 1 \u0436\u043e\u0432\u0442\u043d\u044f,", "sentiment": -1, "medoid_distance": null, "markdown_citation": "[\u0420\u0411\u041a](https://www.rbc.ua/rus/news/putin-nakazav-vitisniti-ukrayinski-viyska-1724135586.html)", "provocative": "medium", "reporting_voice": "Investigative", "as_string_key": "[7]"}, {"article_url": "https://macaudailytimes.com.mo/push-into-russias-kursk-region-is-to-create-a-buffer-zone-zelenskyy.html", "article_id": "0ecba3d9-1200-5c00-ab49-5892d7f0eb76", "classification": "Politics", "country": "MO", "source_id": "MacauDailyTimes", "page_rank": 206818, "domain_url": "macaudailytimes.com.mo", "eng_title": "Push into Russia's Kursk region is to create a buffer zone: Zelenskyy", "entities": {"Person": ["Zelenskyy"], "Organization": ["Analysts"], "Location": ["Kyiv", "Kursk", "Moscow"], "Nationality": ["Western", "Ukrainian", "Russian"], "Date": [], "Event": [], "Money": [], "Law": [], "Quantity": [], "Time": [], "Sports": [], "Politics": [], "Title": ["President"], "Number": [], "Arms": [], "Product": [], "Media": [], "Transportation": [], "Religion": [], "Technology": [], "Space": [], "Medicine": [], "Language": [], "Science": []}, "image_url": "https://i0.wp.com/macaudailytimes.com.mo/wp-content/uploads/2024/08/AP24231471086649.jpg?resize=150%2C150&ssl=1", "keywords": ["Russia", "Ukraine", "Zelenskyy", "Kursk region", "Buffer zone"], "language": "en", "pub_date": "2024-08-20 00:14:18+00:00", "summary": "Ukrainian President Zelenskyy stated that the goal of the operation in the Kursk region is to create a buffer zone on Russian territory. He said, 'it is now our primary task in defensive operations overall: to destroy as much Russian war potential as possible and conduct maximum counteroffensive actions.' Ukraine has destroyed two key bridges in the region, disrupting supply lines and further complicating Moscow's attempts to replenish its forces and evacuate civilians. Analysts say that while Ukraine could try to consolidate its gains inside Russia, it would be risky due to its limited resources and vulnerable supply lines. Zelenskyy has urged Kyiv's allies to lift restrictions on using Western weapons to attack targets deeper in Russia, saying his troops could deprive Moscow 'of any ability to advance and cause destruction' if granted sufficient long-range capabilities.", "title": "Push into Russia's Kursk region is to create a buffer zone: Zelenskyy", "sentiment": -1, "medoid_distance": null, "markdown_citation": "[MDT](https://macaudailytimes.com.mo/push-into-russias-kursk-region-is-to-create-a-buffer-zone-zelenskyy.html)", "provocative": "medium", "reporting_voice": "Explanatory", "as_string_key": "[8]"}, {"article_url": "https://www.mk.ru/politics/2024/08/20/ukrainu-predupredili-o-fatalnom-reshenii-v-kurskoy-oblasti.html", "article_id": "787969ac-9f50-5255-a8f9-80a547e69646", "classification": "Military", "country": "RU", "source_id": "\u041c\u043e\u0441\u043a\u043e\u0432\u0441\u043a\u0438\u0439 \u041a\u043e\u043c\u0441\u043e\u043c\u043e\u043b\u0435\u0446", "page_rank": 3726, "domain_url": "mk.ru", "eng_title": "Ukraine Warned of Potential Disaster in Kursk Region", "entities": {"Person": ["Michael Evans", "Evans"], "Organization": [], "Location": ["Kursk", "Pokrovsk"], "Nationality": ["Russian", "Ukrainian"], "Date": [], "Event": [], "Money": [], "Law": [], "Quantity": [], "Time": [], "Sports": [], "Politics": [], "Title": [], "Number": [], "Arms": ["bombers"], "Product": [], "Media": ["The Times"], "Transportation": [], "Religion": [], "Technology": [], "Space": [], "Medicine": [], "Language": [], "Science": []}, "image_url": "https://static.mk.ru/upload/entities/2024/08/20/05/articles/facebookPicture/b9/ba/50/b2/196d60d0ce16b5ede3e52fe82294555d.jpg", "keywords": ["Ukraine", "Kursk Region", "Russian Forces", "Logistical Issues"], "language": "ru", "pub_date": "2024-08-20 00:00:00+00:00", "summary": "Ukraine has been warned that its advance in the Kursk region may lead to significant losses due to unplanned withdrawal routes and logistical issues. According to Michael Evans, a journalist from The Times, the Ukrainian military's command will face significant challenges in redeploying troops from the Kursk region to other areas of the front where the situation is not going well. 'What will happen when Russian artillery and bombers start shelling Ukrainian supply lines?' Evans asked. He noted that Russian forces continue to make successful gains on the strategic Pokrovsk direction, despite Ukraine's advance in the border area. Evans emphasized that 'for Ukraine, retreating under fire or without a clear strategy could be fatal.'", "title": "\u0423\u043a\u0440\u0430\u0438\u043d\u0443 \u043f\u0440\u0435\u0434\u0443\u043f\u0440\u0435\u0434\u0438\u043b\u0438 \u043e \u0444\u0430\u0442\u0430\u043b\u044c\u043d\u043e\u043c \u0440\u0435\u0448\u0435\u043d\u0438\u0438 \u0432 \u041a\u0443\u0440\u0441\u043a\u043e\u0439 \u043e\u0431\u043b\u0430\u0441\u0442\u0438", "sentiment": -1, "medoid_distance": null, "markdown_citation": "[\u041c\u041a](https://www.mk.ru/politics/2024/08/20/ukrainu-predupredili-o-fatalnom-reshenii-v-kurskoy-oblasti.html)", "provocative": "medium", "reporting_voice": "Investigative", "as_string_key": "[9]"}, {"article_url": "https://ria.ru/20240820/kursk-1967210600.html", "article_id": "8cffc0f5-8477-5cb6-ad16-ce866a4c19df", "classification": "Military", "country": "RU", "source_id": "\u0420\u0418\u0410 \u041d\u043e\u0432\u043e\u0441\u0442\u0438", "page_rank": 1302, "domain_url": "ria.ru", "eng_title": "Kursk Region Invasion: Ukraine Faces Potential 'Omnipresent' Losses", "entities": {"Person": ["Putin", "Vladimir Putin", "Valery Gerasimov", "Michael Evans"], "Organization": ["Russian Ministry of Defense", "Kiev regime"], "Location": ["Kursk", "Kursk region", "Pokrovsk", "Kiev", "state border"], "Nationality": ["Ukrainian", "Russian"], "Date": ["August 6"], "Event": [], "Money": [], "Law": [], "Quantity": [], "Time": ["5:30 am"], "Sports": [], "Politics": [], "Title": ["President"], "Number": ["54", "3,800"], "Arms": ["artillery"], "Product": [], "Media": ["Times"], "Transportation": [], "Religion": [], "Technology": [], "Space": [], "Medicine": [], "Language": [], "Science": []}, "image_url": "https://cdnn21.img.ria.ru/images/07e8/08/13/1967043003_0:251:1280:971_1920x1080_80_0_0_48bd682fc4b68833d16b7b20fbea211f.jpg.webp", "keywords": ["Kursk Region", "Ukraine", "Russia", "Invasion", "Losses"], "language": "ru", "pub_date": "2024-08-19 23:19:50+00:00", "summary": "The Ukrainian invasion of the Kursk region may result in significant losses for Kiev due to unforeseen logistical and withdrawal route problems, writes journalist Michael Evans of Times. 'What if Russian bombers and artillery start targeting supply lines?' he asks. Russia continues to successfully advance on the strategic Pokrovsk direction, despite Ukraine's advance in the border area. It will be extremely difficult for the Ukrainian command to redeploy units from the Kursk region to threatened front-line areas. Ukrainian forces launched an attack on the Kursk region at 5:30 am on August 6, but their advance was halted, according to Russian General Staff Chief Valery Gerasimov. He emphasized that the operation in the Kursk region will be completed with the defeat of the enemy and the breakthrough to the state border. According to the Russian Ministry of Defense, Ukrainian forces have lost up to 3,800 soldiers and 54 tanks during the fighting in the Kursk region. Russian President Vladimir Putin has stated that the Kiev regime has launched a provocation, is conducting indiscriminate fire, including on civilian targets. Putin has promised that the enemy will receive a worthy response, and all goals set by Russia will be achieved.", "title": "\"\u041f\u043e\u0434 \u043e\u0433\u043d\u0435\u043c\": \u041a\u0438\u0435\u0432 \u043f\u0440\u0435\u0434\u0443\u043f\u0440\u0435\u0434\u0438\u043b\u0438 \u043e \u0444\u0430\u0442\u0430\u043b\u044c\u043d\u043e\u043c \u0440\u0435\u0448\u0435\u043d\u0438\u0438 \u0432 \u041a\u0443\u0440\u0441\u043a\u043e\u0439 \u043e\u0431\u043b\u0430\u0441\u0442\u0438", "sentiment": -1, "medoid_distance": null, "markdown_citation": "[\u0420\u0418\u0410](https://ria.ru/20240820/kursk-1967210600.html)", "provocative": "high", "reporting_voice": "Investigative", "as_string_key": "[10]"}], "news knowledge": [{"article_url": "https://www.enidnews.com/cnhi_network/ukrainian-forces-left-a-path-of-destruction-in-the-kursk-operation-ap-visited-a-seized/article_3fb2c853-6bed-567d-8f1f-863fa9f000f8.html&summary=ukrainian%20forces%20left%20a%20path%20of%20destruction%20in%20the%20kursk%20operation.%20ap%20visited%20a%20seized%20russian%20town", "article_id": "d175e227-72c8-53c0-a566-1280b57a5cdd", "classification": "Politics", "country": "US", "source_id": "Enidnews", "page_rank": 55662, "domain_url": "enidnews.com", "eng_title": "Monday, August 19, 2024 E-Paper", "entities": {"Person": ["Volodymyr Zelenskyy", "Zelenskyy"], "Organization": [], "Location": ["eastern Ukraine", "Sudzha", "Kursk", "Moscow"], "Nationality": ["Russian", "Ukrainian"], "Date": [], "Event": [], "Money": [], "Law": [], "Quantity": ["120,000"], "Time": ["two years"], "Sports": [], "Politics": [], "Title": ["President"], "Number": ["100"], "Arms": [], "Product": [], "Media": ["AP"], "Transportation": [], "Religion": [], "Technology": [], "Space": [], "Medicine": [], "Language": [], "Science": []}, "image_url": "https://bloximages.chicago2.vip.townnews.com/enidnews.com/content/tncms/assets/v3/editorial/a/ec/aecae5bd-cdca-5e09-bca5-e23adc84f791/66bfbdc6972a2.image.jpg?crop=1763%2C926%2C0%2C125&resize=1200%2C630&order=crop%2Cresize", "keywords": ["Russia", "Ukraine", "Volodymyr Zelenskyy", "Sudzha", "Kursk operation"], "language": "en", "pub_date": "2024-08-19 00:00:00+00:00", "summary": "Ukrainian forces have made significant gains in their incursion into Russia, capturing the town of Sudzha and pushing deep into Russian territory. According to Ukrainian President Volodymyr Zelenskyy, the town is 'fully under his troops' control.' The operation has led to the evacuation of over 120,000 civilians and the capture of at least 100 Russian troops. While the incursion has been seen as a major morale boost for Ukraine, it has not yet dented Russia's overall strategic advantage. The full scope of the Kursk operation remains unclear, including how long Ukraine plans to hold Russian territory and to what end. Ukrainian officials have said that diverting Russian reserves from the main battlegrounds in eastern Ukraine is a minimum aim of the operation, but Moscow has shown no signs of withdrawing significant numbers of troops. Zelenskyy has said that Ukraine will establish a command office in Sudzha to coordinate aid and military affairs, suggesting that Ukraine may plan to remain in the Kursk region long-term. 'It is widely seen as a major morale boost for a country and an army struggling to fend off steady Russian advances more than two years after Moscow sent troops into Ukraine,' said an AP journalist. 'But, so far, it has not dented Russia's overall strategic advantage.'", "title": "Monday, August 19, 2024 E-Paper", "sentiment": -1, "medoid_distance": null, "markdown_citation": "[E](https://www.enidnews.com/cnhi_network/ukrainian-forces-left-a-path-of-destruction-in-the-kursk-operation-ap-visited-a-seized/article_3fb2c853-6bed-567d-8f1f-863fa9f000f8.html&summary=ukrainian%20forces%20left%20a%20path%20of%20destruction%20in%20the%20kursk%20operation.%20ap%20visited%20a%20seized%20russian%20town)", "provocative": "medium", "reporting_voice": "Objective", "as_string_key": "[1]"}, {"article_url": "https://novosti-n.org/ua/news/RF-perekynula-v-Kursku-oblast-do-5-000-vijskovyh-z-Ukrayiny-ZMI-297924", "article_id": "6a97ae83-754c-56bc-bcd3-8e50743bd5c7", "classification": "Military", "country": "UA", "source_id": "\u041d\u043e\u0432\u043e\u0441\u0442\u0438-N", "page_rank": 180187, "domain_url": "novosti-n.org", "eng_title": "Russia Withdraws Troops from Ukraine, But Faces Larger Challenge Ahead", "entities": {"Person": ["source"], "Organization": [], "Location": ["Sumy region", "Kursk", "Kyiv", "Donetsk region"], "Nationality": ["Russian", "Ukrainian", "Ukrainians", "Western"], "Date": ["2024", "2025"], "Event": [], "Money": [], "Law": [], "Quantity": ["20,000", "5,000", "6,000", "2,000", "4,000"], "Time": [], "Sports": [], "Politics": [], "Title": [], "Number": [], "Arms": [], "Product": [], "Media": ["The Wall Street Journal"], "Transportation": [], "Religion": [], "Technology": [], "Space": [], "Medicine": [], "Language": [], "Science": []}, "image_url": "https://img.novosti-n.org/upload/news/855426.jpg", "keywords": ["Russia", "Ukraine", "Troop Withdrawal", "Kursk Region"], "language": "uk", "pub_date": "2024-08-18 23:00:00+00:00", "summary": "Russia has reportedly withdrawn up to 5,000 troops from Ukraine in an attempt to halt the advance of Ukrainian forces in the Kursk region. According to The Wall Street Journal, citing Ukrainian and Western officials, one brigade was withdrawn from the Donetsk region, the center of the Russian advance, while other units were pulled from less critical areas. However, sources indicate that Russia will need to withdraw even more troops in the future if it hopes to retake its own territory. 'Such a goal would require more forces than are currently available to Kyiv,' said a source. 'It's likely that over 20,000 well-trained personnel would be needed.' Western military estimates suggest that Ukraine has deployed around 6,000 soldiers to the Kursk region, as well as 4,000 personnel for auxiliary tasks in the Sumy region. To avoid weakening the front line, a significant portion of the troops were drawn from a reserve formed with Western support for operations in 2024 and 2025. 'To push the Ukrainians out, Russia would need to send even more troops, and wipe entire cities and villages off the face of the earth with artillery fire, as it has done on a large part of Ukraine,' said a source. Ukrainian forces have reportedly captured around 2,000 Russian soldiers and seized approximately the same amount of territory as Russia has retaken from Ukraine since the beginning of 2024, according to a high-ranking official in Kyiv.", "title": "\u0420\u0424 \u043f\u0435\u0440\u0435\u043a\u0438\u043d\u0443\u043b\u0430 \u0432 \u041a\u0443\u0440\u0441\u044c\u043a\u0443 \u043e\u0431\u043b\u0430\u0441\u0442\u044c \u0434\u043e 5 000 \u0432\u0456\u0439\u0441\u044c\u043a\u043e\u0432\u0438\u0445 \u0437 \u0423\u043a\u0440\u0430\u0457\u043d\u0438, \u2014 \u0417\u041c\u0406", "sentiment": -1, "medoid_distance": null, "markdown_citation": "[\u041dN](https://novosti-n.org/ua/news/RF-perekynula-v-Kursku-oblast-do-5-000-vijskovyh-z-Ukrayiny-ZMI-297924)", "provocative": "medium", "reporting_voice": "Investigative", "as_string_key": "[2]"}, {"article_url": "https://novosti-n.org/news/RF-perebrosyla-v-Kurskuyu-oblast-do-5-000-voennih-yz-Ukrayni-SMY-297924", "article_id": "085600d2-ea40-5002-8b93-5c2a4f190799", "classification": "Military", "country": "UA", "source_id": "\u041d\u043e\u0432\u043e\u0441\u0442\u0438-N", "page_rank": 180187, "domain_url": "novosti-n.org", "eng_title": "Russia Withdraws Troops from Ukraine, Faces Challenges in Retaking Territory", "entities": {"Person": [], "Organization": [], "Location": ["Sumy region", "Donetsk", "Kursk", "Kyiv"], "Nationality": ["Ukrainian", "Western", "Ukrainians", "Russian"], "Date": ["2025", "2024"], "Event": [], "Money": [], "Law": [], "Quantity": ["4,000", "5,000", "6,000", "20,000", "2,000"], "Time": [], "Sports": [], "Politics": [], "Title": [], "Number": [], "Arms": [], "Product": [], "Media": ["The Wall Street Journal"], "Transportation": [], "Religion": [], "Technology": [], "Space": [], "Medicine": [], "Language": [], "Science": []}, "image_url": "https://img.novosti-n.org/upload/news/855426.jpg", "keywords": ["Russia", "Ukraine", "Troop Withdrawal", "Kursk Region"], "language": "ru", "pub_date": "2024-08-18 23:00:00+00:00", "summary": "Russia has reportedly withdrawn up to 5,000 troops from Ukraine to the Kursk region in an attempt to stop the advance of Ukrainian forces. According to The Wall Street Journal, citing Ukrainian and Western officials, one of the brigades was withdrawn from the Donetsk region, the center of the Russian military's advance. However, sources indicate that Russia will need to withdraw more troops from Ukraine in the future if it wants to regain its territory. 'Such a goal would require a lot of forces, more than what is available to Kyiv. It's likely that over 20,000 properly trained soldiers would be needed,' said a source. Western military estimates suggest that Ukraine has deployed up to 6,000 soldiers to the Kursk region, as well as 4,000 troops for auxiliary tasks in the Sumy region. To avoid weakening the front line, a significant portion of the troops were reportedly taken from a reserve formed with Western support for operations in 2024 and 2025. 'To push out the Ukrainians, Russia would need to send even more troops, destroy its own cities and villages with artillery fire, as it does on a large part of Ukraine,' continued the source. Ukrainian officials claim that their forces have taken 2,000 Russian prisoners and captured approximately the same amount of territory as Russia has retaken from Ukraine since the beginning of 2024.", "title": "\u0420\u0424 \u043f\u0435\u0440\u0435\u0431\u0440\u043e\u0441\u0438\u043b\u0430 \u0432 \u041a\u0443\u0440\u0441\u043a\u0443\u044e \u043e\u0431\u043b\u0430\u0441\u0442\u044c \u0434\u043e 5 000 \u0432\u043e\u0435\u043d\u043d\u044b\u0445 \u0438\u0437 \u0423\u043a\u0440\u0430\u0438\u043d\u044b,", "sentiment": -1, "medoid_distance": null, "markdown_citation": "[\u041dN](https://novosti-n.org/news/RF-perebrosyla-v-Kurskuyu-oblast-do-5-000-voennih-yz-Ukrayni-SMY-297924)", "provocative": "medium", "reporting_voice": "Investigative", "as_string_key": "[3]"}, {"article_url": "https://gazeta.ua/articles/life/_analitiki-pripustili-koli-rf-mozhe-sprobuvati-vidbiti-teritoriyu-kurschini-yaku-kontrolyuyut-zsu/1190875", "article_id": "191967dc-1426-5d1f-86c6-9e2b98698d79", "classification": "Military", "country": "UA", "source_id": "Gazeta.ua", "page_rank": 15736, "domain_url": "gazeta.ua", "eng_title": "Russia May Attempt to Retake Kursk Region by End of October, Analysts Say", "entities": {"Person": [], "Organization": [], "Location": ["Kursk"], "Nationality": ["Ukrainians", "Ukrainian", "Western", "Russian"], "Date": ["October"], "Event": [], "Money": [], "Law": [], "Quantity": ["15,000", "6,000"], "Time": ["40 years"], "Sports": [], "Politics": [], "Title": [], "Number": ["70-year-old"], "Arms": ["T-54"], "Product": [], "Media": ["The Times"], "Transportation": [], "Religion": [], "Technology": [], "Space": [], "Medicine": [], "Language": [], "Science": []}, "image_url": "https://gazeta.ua/favicon/favicon.ico", "keywords": ["Russia", "Kursk Region", "Ukraine", "Counterattack", "Armored Equipment"], "language": "uk", "pub_date": "2024-08-18 20:01:13+00:00", "summary": "Analysts believe that Russia may attempt to retake territory in the Kursk region, which is currently controlled by Ukrainian forces, by the end of October. According to The Times, Western analysts agree that Ukraine will not try to hold all the positions they have taken, and that Russia will likely launch a counterattack in the region. 'It is expected that Russia will counterattack under Kursk by the end of October. Western analysts agree that the Ukrainians will not want to try to hold all the positions they have taken,' the article states. The operation in the Kursk region has been a success for Ukraine and a failure for Russia, with Russian forces losing 15,000 units of armored equipment and 6,000 tanks in a matter of weeks, and being forced to deploy 70-year-old T-54 tanks, which were retired over 40 years ago.", "title": "\u0410\u043d\u0430\u043b\u0456\u0442\u0438\u043a\u0438 \u043f\u0440\u0438\u043f\u0443\u0441\u0442\u0438\u043b\u0438, \u043a\u043e\u043b\u0438 \u0420\u0424 \u043c\u043e\u0436\u0435 \u0441\u043f\u0440\u043e\u0431\u0443\u0432\u0430\u0442\u0438 \u0432\u0456\u0434\u0431\u0438\u0442\u0438 \u0442\u0435\u0440\u0438\u0442\u043e\u0440\u0456\u044e \u041a\u0443\u0440\u0449\u0438\u043d\u0438, \u044f\u043a\u0443 \u043a\u043e\u043d\u0442\u0440\u043e\u043b\u044e\u044e\u0442\u044c \u0417\u0421\u0423", "sentiment": -1, "medoid_distance": null, "markdown_citation": "[G](https://gazeta.ua/articles/life/_analitiki-pripustili-koli-rf-mozhe-sprobuvati-vidbiti-teritoriyu-kurschini-yaku-kontrolyuyut-zsu/1190875)", "provocative": "medium", "reporting_voice": "Analytical", "as_string_key": "[4]"}, {"article_url": "https://eng.obozrevatel.com/section-war/news-russia-may-try-to-retake-kursk-in-october-2024-the-times-18-08-2024.html", "article_id": "1d9f4dff-d0c6-5a2e-9aff-9c8e0a77a179", "classification": "Military", "country": "UA", "source_id": "OBOZREVATEL", "page_rank": 8342, "domain_url": "obozrevatel.com", "eng_title": "Russia May Retake Kursk in October 2024", "entities": {"Person": ["Shapps"], "Organization": ["Ukrainian Armed Forces"], "Location": ["world", "Hlushkiv", "Kursk"], "Nationality": ["Western", "British", "Russian"], "Date": ["October"], "Event": [], "Money": [], "Law": [], "Quantity": ["15,000"], "Time": ["winter"], "Sports": [], "Politics": [], "Title": [], "Number": [], "Arms": ["armored vehicles", "6,000 tanks"], "Product": [], "Media": ["The Times"], "Transportation": [], "Religion": [], "Technology": [], "Space": [], "Medicine": [], "Language": [], "Science": []}, "image_url": "https://i2.obozrevatel.com/news/2024/8/18/soldatyi-rf.jpg?size=2010x1050", "keywords": ["Russia", "Ukraine", "Kursk", "Counterattack", "Armed Forces"], "language": "en", "pub_date": "2024-08-18 11:50:00+00:00", "summary": "Ukraine has successfully launched an operation in the Kursk region, taking control of a part of the Russian region. Western analysts believe that Russia will try to retake the area by the end of October. According to The Times, 'Russia is expected to counterattack near Kursk before the onset of winter in late October.' The operation is a 'triumph for Ukraine and a disgrace for the 'second army of the world,' which has lost 15,000 armored vehicles and 6,000 tanks. Former British Defense Secretary Shapps emphasized, 'A democratic country invaded by its autocratic neighbor is a disaster not only for that nation, but for the whole world. Therefore, democracies must stop at nothing to ensure the victory of freedom.' The Ukrainian Armed Forces are approaching the key artery of the region, and the most active fighting is taking place in the Hlushkiv district, where several thousand Russian troops are surrounded.", "title": "Russia may try to retake Kursk in October 2024", "sentiment": -1, "medoid_distance": null, "markdown_citation": "[OBO](https://eng.obozrevatel.com/section-war/news-russia-may-try-to-retake-kursk-in-october-2024-the-times-18-08-2024.html)", "provocative": "medium", "reporting_voice": "Investigative", "as_string_key": "[5]"}, {"article_url": "https://focus.ua/voennye-novosti/663742-rossiya-kontratakuet-vsu-pod-kurskom-v-konce-oktyabrya-the-times", "article_id": "5f5adb6c-040f-540b-80e9-3719148d9067", "classification": "Military", "country": "UA", "source_id": "\u0424\u041e\u041a\u0423\u0421", "page_rank": 14497, "domain_url": "focus.ua", "eng_title": "Russia Counterattacks Under Kursk, Ukraine's Operation May Be Decisive", "entities": {"Person": ["Michael Clarke", "Volodymyr Zelensky", "Tim Shipman"], "Organization": ["national forces"], "Location": ["Chasov Yar", "Moscow", "Kyiv", "Kursk", "Donbas", "Pokrovsk"], "Nationality": ["British", "Ukrainian", "Ukrainians", "Western", "Russian"], "Date": ["October", "August 2024"], "Event": [], "Money": [], "Law": [], "Quantity": [], "Time": ["spring", "winter", "autumn 2025"], "Sports": [], "Politics": [], "Title": ["President"], "Number": [], "Arms": ["Challenger 2"], "Product": [], "Media": ["The Times"], "Transportation": [], "Religion": [], "Technology": [], "Space": [], "Medicine": [], "Language": [], "Science": []}, "image_url": "https://focus.ua/static/storage/thumbs/1200x630/3/c3/22a570c6-89313f09a5424d536af304f673793c33.jpg?v=8111_1", "keywords": ["Russia", "Ukraine", "Kursk", "Counterattack", "Volodymyr Zelensky"], "language": "ru", "pub_date": "2024-08-18 10:55:57+00:00", "summary": "Western analysts believe that the next few months will be crucial. Experts think that the Ukrainian forces are unlikely to want to hold all the territories they have captured. Since August 2024, Ukraine has been conducting active offensive operations in the direction of Kursk, using not only national forces but also equipment provided by Western partners, particularly the UK. This includes the use of Challenger 2 tanks, which has caused a significant reaction from Russia. However, analysts believe that the threat of nuclear escalation, often emphasized by the Kremlin, is currently exaggerated. According to The Times, Ukrainian President Volodymyr Zelensky has suggested that the invasion was intended to facilitate future peace negotiations on Ukrainian terms, but no one thinks that negotiations are possible before spring and, likely, not before autumn 2025. Political commentator Tim Shipman notes, 'So what did Zelensky think? The answer is partly political, partly military.' Michael Clarke, a leading British defense analyst, stated that 'this is a classic military counterattack that tries to ease pressure in other places,' particularly on the Donbas. However, if Kyiv hoped that Moscow would immediately withdraw its troops from Ukraine to regain the Kursk foothold, Russian generals seem to have instead used the absence of four top Ukrainian regiments to advance in the Pokrovsk and Chasov Yar areas, according to the British publication. Military experts believe that the next few months may be decisive. According to analysts, Russia is preparing a counterattack under Kursk, which may begin by the end of October, before winter. Specialists agree that the Ukrainians will not want to try to hold all the captured positions. The Ukrainian operation in the Kursk region is currently a success for Zelensky and a shame for Russian military, writes The Times. Russia has already lost over 15,000 units of armored vehicles and 6,000 tanks, and is forced to use outdated models, such as the T-54, which were scrapped over 40 years ago. Western analysts agree that the success or failure of the Ukrainian operation under Kursk may significantly affect the further course of the war. At the same time, the unity of Western countries in supporting Ukraine remains important, which will be a key factor in countering Russian aggression. Tim Shipman notes that the only British weapon that has not yet been used on Russian territory is also the most powerful - the Storm Shadow. Since this cruise missile is a joint project, its use also requires the consent of the US and France (where the missiles are called Scalp), which fear escalation in relations with Russia. As President Vladimir Zelensky stated on August 17, the operation in the Kursk region is continuing as planned by Ukraine.", "title": "\u0420\u043e\u0441\u0441\u0438\u044f \u043a\u043e\u043d\u0442\u0440\u0430\u0442\u0430\u043a\u0443\u0435\u0442 \u0412\u0421\u0423 \u043f\u043e\u0434 \u041a\u0443\u0440\u0441\u043a\u043e\u043c \u0432 \u043a\u043e\u043d\u0446\u0435 \u043e\u043a\u0442\u044f\u0431\u0440\u044f, \u2014 The Times", "sentiment": -1, "medoid_distance": null, "markdown_citation": "[\u0424\u041e\u041a](https://focus.ua/voennye-novosti/663742-rossiya-kontratakuet-vsu-pod-kurskom-v-konce-oktyabrya-the-times)", "provocative": "medium", "reporting_voice": "Investigative", "as_string_key": "[6]"}, {"article_url": "https://focus.ua/uk/voennye-novosti/663742-rosiya-kontratakuye-zsu-pid-kurskom-naprikinci-zhovtnya-the-times", "article_id": "2ca750d1-a2db-5c6a-9be2-9dc264aee2bc", "classification": "Military", "country": "UA", "source_id": "\u0424\u041e\u041a\u0423\u0421", "page_rank": 14497, "domain_url": "focus.ua", "eng_title": "Russia Counterattacks in Kursk, Ukraine's Success in the Region a 'Shame' for Russian Soldiers", "entities": {"Person": ["Tim Shipman", "Michael Clarke", "President Zelensky"], "Organization": ["national forces", "Kremlin"], "Location": ["Chasiv Yar", "Moscow", "Kursk", "Pokrovsk", "Donbas", "Kyiv"], "Nationality": ["Ukrainian", "Western", "British", "Russian"], "Date": ["August 2024", "October"], "Event": [], "Money": [], "Law": [], "Quantity": [], "Time": ["spring", "autumn 2025", "winter"], "Sports": [], "Politics": [], "Title": [], "Number": [], "Arms": ["Challenger 2"], "Product": [], "Media": ["The Times"], "Transportation": [], "Religion": [], "Technology": [], "Space": [], "Medicine": [], "Language": [], "Science": []}, "image_url": "https://focus.ua/static/storage/thumbs/1200x630/3/c3/22a570c6-89313f09a5424d536af304f673793c33.jpg?v=8111_1", "keywords": ["Russia", "Ukraine", "Kursk", "Counterattack", "Nuclear Escalation"], "language": "uk", "pub_date": "2024-08-18 10:55:57+00:00", "summary": "Western analysts believe that the next few months will be decisive in the conflict between Ukraine and Russia. Experts think that the Ukrainian military will not want to hold onto all the territory they have captured. Since August 2024, Ukraine has been conducting active offensive operations towards Kursk, using both national forces and equipment provided by Western partners, including the UK. This has included the use of Challenger 2 tanks, which has caused a significant reaction from Russia. However, analysts believe that the threat of nuclear escalation, often emphasized by the Kremlin, is currently exaggerated. According to The Times, 'What is President Zelensky thinking? The answer is partly political, partly military. Last week, the Ukrainian president suggested that the invasion was intended to secure the conduct of future peace negotiations on Ukrainian terms, but no one thinks that negotiations are possible before spring and, probably, not before autumn 2025', said political commentator Tim Shipman. Michael Clarke, a leading British defense analyst, stated that 'this is a classic military counterattack that aims to relieve pressure elsewhere, particularly in Donbas.' However, if Kyiv had hoped that Moscow would immediately withdraw its troops from Ukraine to regain the Kursk foothold, Russian generals seem to have instead taken advantage of the absence of four better Ukrainian regiments to advance in the Pokrovsk and Chasiv Yar areas, according to the British publication. Military experts believe that the next few months may be decisive. Analysts estimate that Russia is preparing a counterattack under Kursk, which could begin by the end of October, before winter. Experts agree that the Ukrainians will not want to try to hold onto all the captured positions. The Ukrainian operation in the Kursk region is currently a success for Zelensky and a shame for Russian soldiers, writes The Times. Russia has already lost over 15,000 units of armored equipment and 6,000 tanks, and is forced to use outdated models, such as the T-54, which were written off over 40 years ago. Western analysts agree that the success or failure of the Ukrainian operation under Kursk could significantly impact the course of the war. Meanwhile, the unity of Western countries in supporting Ukraine remains a key factor in countering Russian aggression. Tim Shipman notes that the only British weapon that has not yet been used on Russian territory is also the most powerful - the Storm Shadow, which requires the consent of the US and France (where the missiles are called Scalp) to be used, as they fear escalation in relations with Russia.", "title": "\u0420\u043e\u0441\u0456\u044f \u043a\u043e\u043d\u0442\u0440\u0430\u0442\u0430\u043a\u0443\u0454 \u0417\u0421\u0423 \u043f\u0456\u0434 \u041a\u0443\u0440\u0441\u044c\u043a\u043e\u043c \u043d\u0430\u043f\u0440\u0438\u043a\u0456\u043d\u0446\u0456 \u0436\u043e\u0432\u0442\u043d\u044f, \u2014 The Times", "sentiment": -1, "medoid_distance": null, "markdown_citation": "[\u0424\u041e\u041a](https://focus.ua/uk/voennye-novosti/663742-rosiya-kontratakuye-zsu-pid-kurskom-naprikinci-zhovtnya-the-times)", "provocative": "medium", "reporting_voice": "Investigative", "as_string_key": "[7]"}, {"article_url": "https://war.telegraf.com.ua/war-in-ukraine/2024-08-18/5867728-navit-ne-cherez-misyats-stalo-vidomo-koli-rosiya-mozhe-kontratakuvati-v-kurskiy-oblasti", "article_id": "18b1bff0-2f45-5752-a913-2a15fee1e86f", "classification": "Politics", "country": "UA", "source_id": "\u0422\u0435\u043b\u0435\u0433\u0440\u0430\u0444", "page_rank": 26603, "domain_url": "telegraf.com.ua", "eng_title": "Russia May Counterattack in Kursk Region by Late October", "entities": {"Person": ["Grant Shapps", "Boris Johnson", "Zelensky"], "Organization": ["Russian military", "Democracies", "military"], "Location": ["Kursk"], "Nationality": ["Ukrainian", "British", "Western"], "Date": ["October"], "Event": [], "Money": [], "Law": [], "Quantity": ["6,000", "15,000"], "Time": ["40 years"], "Sports": [], "Politics": [], "Title": ["Home Secretary", "Prime Minister"], "Number": ["70-year-old"], "Arms": ["T-54"], "Product": [], "Media": ["The Telegraph", "The Sunday Times"], "Transportation": [], "Religion": [], "Technology": [], "Space": [], "Medicine": [], "Language": [], "Science": []}, "image_url": "https://telegraf.com.ua/static/storage/thumbs/1200x630/5/f8/4ab2c7b9-bfcf2d77ba5c725091fc21be01481f85.jpg?v=7819_1", "keywords": ["Russia", "Ukraine", "Kursk Region", "Counterattack"], "language": "ru", "pub_date": "2024-08-18 10:47:23+00:00", "summary": "The Ukrainian military continues to operate in the Kursk region of Russia, but Western analysts believe that they will not hold all the occupied territories. According to The Sunday Times, Russia may counterattack in late October. The article states, 'It's a success for Zelensky and a shame for the Russian military, which has already lost 15,000 armored vehicles and 6,000 tanks and has been forced to use old T-54 tanks, a 70-year-old model that was retired over 40 years ago.' The British government is trying to strengthen support for Ukraine, with former Prime Minister Boris Johnson and other high-ranking officials advocating for providing aid to Ukraine. As reported by The Telegraph, former British Home Secretary Grant Shapps stated, 'Democracies should stop at nothing to ensure the victory of freedom. We cannot simply hope that Ukraine will defeat Russia, we must also provide the means.' ", "title": "\u0414\u0430\u0436\u0435 \u043d\u0435 \u0447\u0435\u0440\u0435\u0437 \u043c\u0435\u0441\u044f\u0446: \u0441\u0442\u0430\u043b\u043e \u0438\u0437\u0432\u0435\u0441\u0442\u043d\u043e, \u043a\u043e\u0433\u0434\u0430 \u0420\u043e\u0441\u0441\u0438\u044f \u043c\u043e\u0436\u0435\u0442 \u043a\u043e\u043d\u0442\u0440\u0430\u0442\u0430\u043a\u043e\u0432\u0430\u0442\u044c \u0432 \u041a\u0443\u0440\u0441\u043a\u043e\u0439 \u043e\u0431\u043b\u0430\u0441\u0442\u0438", "sentiment": -1, "medoid_distance": null, "markdown_citation": "[\u0422](https://war.telegraf.com.ua/war-in-ukraine/2024-08-18/5867728-navit-ne-cherez-misyats-stalo-vidomo-koli-rosiya-mozhe-kontratakuvati-v-kurskiy-oblasti)", "provocative": "medium", "reporting_voice": "Analytical", "as_string_key": "[8]"}, {"article_url": "https://www.mk.ru/politics/2024/08/13/na-ukraine-zabili-trevogu-izza-situacii-pod-kurskom.html", "article_id": "e2431736-afcf-591d-ac5d-92909178259d", "classification": "Politics", "country": "RU", "source_id": "\u041c\u043e\u0441\u043a\u043e\u0432\u0441\u043a\u0438\u0439 \u041a\u043e\u043c\u0441\u043e\u043c\u043e\u043b\u0435\u0446", "page_rank": 3779, "domain_url": "mk.ru", "eng_title": "Ukraine's Withdrawal from Kursk Region to Weaken Position Before US Elections", "entities": {"Person": ["Valery Gerasimov", "Vladimir Putin", "Ruslan Bortnik"], "Organization": [], "Location": ["Sudzhansky", "Kursk", "Kiev", "state border"], "Nationality": ["Ukrainian", "Russian", "American"], "Date": ["August 6"], "Event": ["US presidential elections"], "Money": [], "Law": [], "Quantity": [], "Time": [], "Sports": [], "Politics": [], "Title": ["President", "General"], "Number": [], "Arms": [], "Product": [], "Media": [], "Transportation": [], "Religion": [], "Technology": [], "Space": [], "Medicine": [], "Language": [], "Science": []}, "image_url": "https://static.mk.ru/upload/entities/2024/08/13/15/articles/facebookPicture/57/85/d9/a8/dcfb13bcc4ac73487c2e070e5afef961.jpg", "keywords": ["Ukraine", "Kursk Region", "US Elections", "Ruslan Bortnik", "Russia"], "language": "ru", "pub_date": "2024-08-13 12:31:01+00:00", "summary": "Kiev political analyst Ruslan Bortnik believes that Ukraine's withdrawal from the Kursk region will weaken the country's position before the US presidential elections. According to Bortnik, 'This will mean that we have lost significant reserves, the most combat-capable and high-quality ones, we have not achieved a political effect, and during the high phase of the American elections, we will enter a situation where Russia is advancing, even more weakened, with worse prospects.' Bortnik considers the start of hostilities in the Kursk region a very risky move by Kiev, which has put everything at stake. On August 6, Ukrainian forces attempted to capture a territory in the Sudzhansky district of the Kursk region, but were stopped by Russian forces, according to General Valery Gerasimov, who reported to President Vladimir Putin. Gerasimov stated that the operation will end with the defeat of the enemy and the exit to the state border.", "title": "\u041d\u0430 \u0423\u043a\u0440\u0430\u0438\u043d\u0435 \u0437\u0430\u0431\u0438\u043b\u0438 \u0442\u0440\u0435\u0432\u043e\u0433\u0443 \u0438\u0437-\u0437\u0430 \u0441\u0438\u0442\u0443\u0430\u0446\u0438\u0438 \u043f\u043e\u0434 \u041a\u0443\u0440\u0441\u043a\u043e\u043c", "sentiment": -1, "medoid_distance": null, "markdown_citation": "[\u041c\u041a](https://www.mk.ru/politics/2024/08/13/na-ukraine-zabili-trevogu-izza-situacii-pod-kurskom.html)", "provocative": "medium", "reporting_voice": "Analytical", "as_string_key": "[9]"}, {"article_url": "https://www.bild.de/politik/ausland-und-internationales/28-orte-erobert-wie-tief-stoesst-die-ukraine-nach-russland-vor-66b9fe2e125b1f76f85de874", "article_id": "0db1b5fd-329a-538c-adff-1d83a5798ecd", "classification": "Military", "country": "DE", "source_id": "Bild", "page_rank": 1336, "domain_url": "bild.de", "eng_title": "Ukraine's Kursk Offensive: Experts Predict Three Possible Scenarios", "entities": {"Person": ["Andrew Perpetua", "Mick Ryan"], "Organization": ["Lowly Institute", "air force", "FSB"], "Location": ["Kursk", "Sydney"], "Nationality": ["Ukrainian", "German", "Australian", "Russian", "Ukrainian-Russian"], "Date": ["2025", "2024"], "Event": [], "Money": [], "Law": [], "Quantity": ["1000 square kilometers"], "Time": [], "Sports": [], "Politics": [], "Title": ["military analyst"], "Number": ["28"], "Arms": ["artillery"], "Product": [], "Media": ["Twitter", "X"], "Transportation": [], "Religion": [], "Technology": [], "Space": [], "Medicine": [], "Language": [], "Science": []}, "image_url": "https://images.bild.de/66b9fe2e125b1f76f85de874/70bbac9f8515daa7540e2a96bc6065a1,f42a9a85?w=1280", "keywords": ["Ukraine", "Kursk", "Russian Conflict", "Andrew Perpetua", "Mick Ryan"], "language": "de", "pub_date": "2024-08-12 16:59:14+00:00", "summary": "Ukraine's surprise offensive in the Russian region of Kursk has resulted in the control of 28 settlements, with 1000 square kilometers of territory gained. Experts predict three possible scenarios for the further course of the Ukrainian-Russian conflict. The least likely scenario is a further Ukrainian advance within the Kursk region. 'The Ukraine will continue its advance in Kursk,' explained military analyst Andrew Perpetua on social media platform X (Twitter). Reports of a halt to the offensive are 'FSB propaganda,' according to independent expert Andrew Perpetua. The second scenario is that Ukraine will fortify its positions to hold onto the territory it has gained. 'This is the riskiest option, as Ukrainian positions have several small outposts that could be easily cut off,' explained Australian military expert Mick Ryan from the 'Lowly Institute' in Sydney. The third and most likely scenario is a sudden Ukrainian withdrawal as soon as Russia redeploys its air force and artillery. 'It could be sensible for Ukraine to withdraw from the area as soon as Russia reorients its air force and artillery,' said a German military expert. The most favorable scenario for Ukraine would be a sovereign and undefeated withdrawal from Russia, allowing it to maximize the political and strategic benefits of the operation and retain a large stock of experienced combat troops for future operations in 2024 and 2025.", "title": "28 Orte erobert: Wie tief st\u00f6\u00dft die Ukraine nach Russland vor?", "sentiment": -1, "medoid_distance": null, "markdown_citation": "[B](https://www.bild.de/politik/ausland-und-internationales/28-orte-erobert-wie-tief-stoesst-die-ukraine-nach-russland-vor-66b9fe2e125b1f76f85de874)", "provocative": "medium", "reporting_voice": "Analytical", "as_string_key": "[10]"}]}