{"latest news": [{"article_url": "https://tribune.com.pk/story/2491754/mtv-vmas-2024-final-lineup-of-performers-announced-ahead-of-september-11th-broadcast", "article_id": "27e999c8-5c08-59a5-80aa-c2df7566ea5c", "classification": "Entertainment", "country": "PK", "source_id": "The Express Tribune", "page_rank": 4485, "domain_url": "tribune.com.pk", "eng_title": "MTV VMAs 2024: Final lineup of performers announced ahead of September 11th broadcast", "entities": {"Person": ["Karol G", "Anitta", "Bruce Gillmer"], "Organization": ["UBS Arena"], "Location": ["New York"], "Nationality": [], "Date": ["September 11th", "2024"], "Event": ["VMAs", "MTV Video Music Awards", "Video of the Year"], "Money": [], "Law": [], "Quantity": [], "Time": [], "Sports": [], "Politics": [], "Title": [], "Number": ["10"], "Arms": [], "Product": [], "Media": [], "Transportation": [], "Religion": [], "Technology": [], "Space": [], "Medicine": [], "Language": [], "Science": []}, "image_url": "https://i.tribune.com.pk/media/images/MTV-VMAs1724850436-0/MTV-VMAs1724850436-0.png", "keywords": ["MTV VMAs", "Katy Perry", "Taylor Swift", "UBS Arena", "New York"], "language": "en", "pub_date": "2024-08-28 13:07:50+00:00", "summary": "The MTV Video Music Awards (VMAs) 2024 has announced its final lineup of performers, including Anitta, Karol G, LL Cool J, and Shawn Mendes. The event will take place on September 11th at UBS Arena in New York. Katy Perry will receive the prestigious Video Vanguard Award, with Bruce Gillmer praising her as 'a musical powerhouse and true pop culture icon.' Taylor Swift leads the nominations with 10 nods, aiming to make history as the first artist to win Video of the Year three times in a row. Other notable nominees include Post Malone, Ariana Grande, and SZA.", "title": "MTV VMAs 2024: Final lineup of performers announced ahead of September 11th broadcast", "sentiment": 1, "medoid_distance": null, "markdown_citation": "[ET](https://tribune.com.pk/story/2491754/mtv-vmas-2024-final-lineup-of-performers-announced-ahead-of-september-11th-broadcast)", "provocative": "low", "reporting_voice": "Objective", "as_string_key": "[1]"}, {"article_url": "https://www.cosmopolitan.com/entertainment/music/a61985009/vmas-performances-2024", "article_id": "91f9377f-73a0-58ec-bd1c-9404eb375f29", "classification": "Entertainment", "country": "US", "source_id": "Cosmopolitan", "page_rank": 961, "domain_url": "cosmopolitan.com", "eng_title": "Here's A Handy-Dandy List of Everyone Performing at the 2024 MTV VMAs", "entities": {"Person": ["Chappell Roan", "Benson Boone", "Lenny Kravitz", "Megan Thee Stallion", "LISA", "Camila Cabello", "Karol G", "Halsey", "Katy Perry", "Shawn Mendes", "Rauw Alejandro", "LL Cool J", "GloRilla", "Anitta", "Sabrina Carpenter"], "Organization": [], "Location": ["New York"], "Nationality": [], "Date": ["2024", "September 11"], "Event": ["MTV Video Music Awards", "Best Pop", "VMAs"], "Money": [], "Law": [], "Quantity": [], "Time": [], "Sports": [], "Politics": [], "Title": [], "Number": [], "Arms": [], "Product": [], "Media": [], "Transportation": [], "Religion": [], "Technology": [], "Space": [], "Medicine": [], "Language": [], "Science": []}, "image_url": "https://hips.hearstapps.com/hmg-prod/images/untitled-design-2024-08-27t153314-914-66ce2a08ebc88.png?crop=1xw:0.5xh;center,top&resize=1200:*", "keywords": ["MTV VMAs", "Katy Perry", "Megan Thee Stallion", "New York"], "language": "en", "pub_date": "2024-08-28 00:49:07+00:00", "summary": "The 2024 MTV Video Music Awards (VMAs) is set to take place on September 11 at the UBS Arena in New York. The show will feature a star-studded lineup of performers, including Katy Perry, who will receive the Michael Jackson Video Vanguard Award. Other performers include Sabrina Carpenter, Chappell Roan, GloRilla, Benson Boone, LISA, Halsey, Camila Cabello, Shawn Mendes, Karol G, Rauw Alejandro, Anitta, Lenny Kravitz, and LL Cool J. The performers will showcase their talents in various categories, including Best New Artist, Best Pop, and Best K-Pop. Megan Thee Stallion will host the show, and the event is expected to be filled with iconic moments and memorable performances.", "title": "Here's A Handy-Dandy List of Everyone Performing at the 2024 MTV VMAs", "sentiment": 1, "medoid_distance": null, "markdown_citation": "[C](https://www.cosmopolitan.com/entertainment/music/a61985009/vmas-performances-2024)", "provocative": "low", "reporting_voice": "Conversational", "as_string_key": "[2]"}, {"article_url": "https://los40.us/2024/the-complete-list-of-artists-set-to-perform-at-the-2024-mtv-vmas-23984.html", "article_id": "1551ffd0-47c8-56f8-b980-96f48934d7a6", "classification": "Entertainment", "country": "US", "source_id": "los40.us", "page_rank": 999999, "domain_url": "los40.us", "eng_title": "The Complete List of Artists Set to Perform at the 2024 MTV VMAs", "entities": {"Person": ["Katy Perry", "Anitta", "Benson Boone", "Rauw Alejandro", "Lenny Kravitz", "Lisa", "Sabrina Carpenter", "Halsey", "LL Cool J", "Chappell Roan", "Shawn Mendes", "Karol G", "Camila Cabello", "Glorilla"], "Organization": ["MTV"], "Location": ["New York"], "Nationality": [], "Date": ["9/11", "2024", "Tuesday", "September 11"], "Event": ["VMAs"], "Money": [], "Law": [], "Quantity": [], "Time": [], "Sports": [], "Politics": [], "Title": [], "Number": [], "Arms": [], "Product": [], "Media": [], "Transportation": [], "Religion": [], "Technology": [], "Space": [], "Medicine": [], "Language": [], "Science": []}, "image_url": "https://los40.us/wp-content/uploads/2024/08/GettyImages-1639485956-1-e1724788566576.jpg", "keywords": ["MTV VMAs", "Sabrina Carpenter", "Katy Perry", "Halsey", "Shawn Mendes"], "language": "en", "pub_date": "2024-08-27 19:57:03+00:00", "summary": "The 2024 MTV Video Music Awards (VMAs) are set to take place on September 11 at the UBS Arena in New York, celebrating its 40th edition. The initial lineup features Sabrina Carpenter, Rauw Alejandro, Glorilla, Camila Cabello, and Chappell Roan, with additional big names like Karol G, Anitta, Shawn Mendes, and LL Cool J joining the party. The ceremony will honor Katy Perry with the MTV Video Vanguard Award for her 'groundbreaking creative vision.' The event will also feature performances from Halsey, Benson Boone, Lenny Kravitz, and Lisa, among others. The ceremony will have a strong charitable focus, in collaboration with the National Day of Service and Remembrance of 9/11 and Tuesday's Children. Fans can vote on the official MTV website to decide the winners of the night.", "title": "The Complete List of Artists Set to Perform at the 2024 MTV VMAs", "sentiment": 1, "medoid_distance": null, "markdown_citation": "[LO](https://los40.us/2024/the-complete-list-of-artists-set-to-perform-at-the-2024-mtv-vmas-23984.html)", "provocative": "low", "reporting_voice": "Explanatory", "as_string_key": "[3]"}, {"article_url": "https://www.unotv.com/entretenimiento/karol-g-camila-cabello-y-mas-estrellas-latinas-entran-por-la-puerta-grande-de-los-mtv-vmas-2024", "article_id": "19ab0389-ecb1-5bee-ba73-bdd4a515f6bf", "classification": "Entertainment", "country": "BR", "source_id": "Uno TV", "page_rank": 103695, "domain_url": "unotv.com", "eng_title": "MTV VMAs 2024: Karol G, Camila Cabello, and Anitta to Perform", "entities": {"Person": ["Doja Cat", "Latto", "Camila Cabello", "SZA", "Chris Brown", "Ayra Starr", "Giveon", "Tems", "Anitta", "Karol G", "Ariana Grande", "Eminem", "Tyla"], "Organization": ["UBS Arena"], "Location": ["Long Island", "New York"], "Nationality": [], "Date": ["September 11"], "Event": ["MTV VMAs 2024"], "Money": [], "Law": [], "Quantity": [], "Time": [], "Sports": [], "Politics": [], "Title": ["Best New Artist", "Best Afrobeats", "Video of the Year", "Best Collaboration", "Best K-Pop", "Song of the Year", "Artist of the Year"], "Number": [], "Arms": [], "Product": [], "Media": [], "Transportation": [], "Religion": [], "Technology": [], "Space": [], "Medicine": [], "Language": [], "Science": []}, "image_url": "https://cdn.unotv.com/images/2024/08/latinas11-104637.jpg", "keywords": ["MTV VMAs", "Karol G", "Camila Cabello", "Anitta", "Ariana Grande", "Billie Eilish"], "language": "en", "pub_date": "2024-08-27 18:55:32+00:00", "summary": "The MTV VMAs 2024 will feature a diverse lineup of artists, including Karol G, Camila Cabello, and Anitta. The ceremony will take place on September 11 at the UBS Arena in Long Island, New York. The nominees for Video of the Year include Ariana Grande, Billie Eilish, Doja Cat, Eminem, and SZA. Other categories include Artist of the Year, Song of the Year, Best New Artist, and Best Collaboration. The nominees for Best Latino include Anitta, Bad Bunny, Karol G, Myke Towers, and Peso Pluma & Anitta. The nominees for Best K-Pop include Jung Kook feat. Latto, LISA, NCT DREAM, NewJeans, and Stray Kids. The nominees for Best Afrobeats include Ayra Starr ft. Giveon, Burna Boy, Chris Brown feat. Davido & Lojay, Tems, and Tyla.", "title": "Karol G, Camila Cabello y m\u00e1s estrellas latinas entran por la puerta grande de los MTV VMAs 2024", "sentiment": 0, "medoid_distance": null, "markdown_citation": "[UTV](https://www.unotv.com/entretenimiento/karol-g-camila-cabello-y-mas-estrellas-latinas-entran-por-la-puerta-grande-de-los-mtv-vmas-2024)", "provocative": "low", "reporting_voice": "Objective", "as_string_key": "[4]"}, {"article_url": "https://www.hellomagazine.com/celebrities/714917/mtv-video-music-awards-2024-everything-you-need-to-know", "article_id": "ac1fd458-b640-5139-be38-8acd1f4af7ad", "classification": "Entertainment", "country": "US", "source_id": "HELLO!", "page_rank": 3443, "domain_url": "hellomagazine.com", "eng_title": "MTV's VMAs 2024 \u2014 everything you need to know about the hosts, lineup and more", "entities": {"Person": ["Lisa", "Taylor Swift", "Camila Cabello", "Post Malone", "Sabrina Carpenter", "Katy Perry", "Megan Thee Stallion"], "Organization": ["MTV", "Blackpink"], "Location": ["New York"], "Nationality": [], "Date": ["2024", "September 11"], "Event": ["VMAs", "MTV Video Music Awards"], "Money": [], "Law": [], "Quantity": [], "Time": ["8pm", "Eastern Time"], "Sports": [], "Politics": [], "Title": [], "Number": ["10", "nine"], "Arms": [], "Product": [], "Media": ["Paramount+"], "Transportation": [], "Religion": [], "Technology": [], "Space": [], "Medicine": [], "Language": [], "Science": []}, "image_url": "https://images.hellomagazine.com/horizon/landscape/4923ce704d33-vmas-1.jpg?tx=c_fill,w_1200", "keywords": ["MTV VMAs", "Megan Thee Stallion", "Katy Perry", "Taylor Swift"], "language": "en", "pub_date": "2024-08-27 18:33:47+00:00", "summary": "The MTV Video Music Awards (VMAs) 2024 is set to take place on September 11 at New York's UBS Arena, with rapper Megan Thee Stallion hosting the event. The ceremony will feature a star-studded lineup, including Katy Perry, who will receive the Video Vanguard Award, and performers such as Sabrina Carpenter, Camila Cabello, and Blackpink's Lisa. Taylor Swift leads the nominations with 10 total nods, followed by Post Malone with nine nominations. The event will be broadcast on MTV and streamed on Paramount+, starting at 8pm Eastern Time.", "title": "MTV's VMAs 2024 \u2014 everything you need to know about the hosts, lineup and more", "sentiment": 1, "medoid_distance": null, "markdown_citation": "[HEL](https://www.hellomagazine.com/celebrities/714917/mtv-video-music-awards-2024-everything-you-need-to-know)", "provocative": "low", "reporting_voice": "Explanatory", "as_string_key": "[5]"}, {"article_url": "https://odia.ig.com.br/diversao/2024/08/6907072-anitta-shawn-mendes-e-mais-mtv-anuncia-novas-apresentacoes-do-vma-2024.html", "article_id": "49745fc0-fb4d-5416-a90e-cf1410d3dbef", "classification": "Entertainment", "country": "BR", "source_id": "iG", "page_rank": 4411, "domain_url": "ig.com.br", "eng_title": "MTV Announces New Performers for VMA 2024", "entities": {"Person": ["Shawn Mendes", "GloRilla", "Chappell Roan", "LISA", "LL Cool J", "Ariana Grande", "Rauw Alejandro", "Eminem", "Teddy Swims", "Benson Boone", "Camila Cabello", "Anitta", "Karol G", "Sabrina Carpenter", "SZA", "Post Malone", "Lenny Kravitz", "Taylor Swift", "Megan Thee Stallion", "Olivia Rodrigo"], "Organization": ["MTV"], "Location": ["New York"], "Nationality": [], "Date": ["Tuesday", "September 11", "August 30"], "Event": ["Best Feature", "9/11", "9/11 Day", "VMA 2024"], "Money": [], "Law": [], "Quantity": [], "Time": [], "Sports": [], "Politics": [], "Title": ["Artist of the Year"], "Number": ["six", "ten", "four", "nine", "three", "15", "five"], "Arms": [], "Product": [], "Media": [], "Transportation": [], "Religion": [], "Technology": [], "Space": [], "Medicine": [], "Language": [], "Science": []}, "image_url": "https://odia.ig.com.br/_midias/jpg/2024/08/27/1200x750/1_design_sem_nome___2024_08_27t134240_366-33825300.jpg", "keywords": ["MTV", "VMA 2024", "Anitta", "Shawn Mendes", "Katy Perry"], "language": "pt", "pub_date": "2024-08-27 16:55:34+00:00", "summary": "The MTV has announced the new names that will complete the list of performances at the VMA 2024. Anitta, Shawn Mendes, Karol G, and LL Cool J will take the stage on September 11. The ceremony will be held live at the UBS Arena in New York, USA, and will be hosted by Megan Thee Stallion. The artists announced on Tuesday join the previously announced performers: Camila Cabello, Sabrina Carpenter, Benson Boone, Chappell Roan, GloRilla, Halsey, Lenny Kravitz, LISA, and Rauw Alejandro. Katy Perry will receive the coveted Video Vanguard award and will perform a medley of her greatest hits directly from the stage. This year, the MTV will support the 9/11 Day organization and the Tuesday's Children, which care for the families of the 9/11 victims. Taylor Swift leads the nominees with ten nominations, followed by Post Malone with nine, Ariana Grande, Eminem, and Sabrina Carpenter with six each, Megan Thee Stallion and SZA with five each, and LISA, Olivia Rodrigo, and Teddy Swims with four nominations each. Anitta also broke her personal record with three nominations. Fans can already vote for their favorite artists in 15 categories, including Video of the Year, Best Feature, and Artist of the Year, on the website until August 30. The voting for Breakthrough Artist will remain open until the show date.", "title": "Anitta, Shawn Mendes e mais: MTV anuncia novas apresenta\u00e7\u00f5es do VMA 2024", "sentiment": 1, "medoid_distance": null, "markdown_citation": "[G](https://odia.ig.com.br/diversao/2024/08/6907072-anitta-shawn-mendes-e-mais-mtv-anuncia-novas-apresentacoes-do-vma-2024.html)", "provocative": "low", "reporting_voice": "Objective", "as_string_key": "[6]"}, {"article_url": "https://www.zocalo.com.mx/actuaran-anitta-y-karol-g-en-los-mtv-vmas-2024", "article_id": "cfd0a0aa-f509-5fb0-b35b-717a26d1ef55", "classification": "Entertainment", "country": "MX", "source_id": "Peri\u00f3dico Z\u00f3calo", "page_rank": 125758, "domain_url": "zocalo.com.mx", "eng_title": "Anitta and Karol G to Perform at 2024 MTV VMAs", "entities": {"Person": ["DJ Khaled", "LL Cool J", "Camila Cabello", "Benson Boone", "Anitta", "Tiago PZK", "Halsey", "Lenny Kravitz", "Karol G", "Shakira", "Sabrina Carpenter", "Fat Joe", "Chappell Roan", "Lisa", "GloRilla"], "Organization": ["Blackpink"], "Location": ["New York"], "Nationality": ["Colombian", "Brazilian"], "Date": ["September 11", "1991", "2024"], "Event": ["MTV Video Music Awards"], "Money": [], "Law": [], "Quantity": [], "Time": [], "Sports": [], "Politics": [], "Title": ["Best Latin Artist", "Best Rap", "Best Collaboration"], "Number": [], "Arms": [], "Product": ["The Force"], "Media": [], "Transportation": [], "Religion": [], "Technology": [], "Space": [], "Medicine": [], "Language": [], "Science": []}, "image_url": "https://www.zocalo.com.mx/wp-content/uploads/2024/08/Sin-ti\u0301tulo-1-86.jpg", "keywords": ["MTV VMAs", "Anitta", "Karol G", "New York", "UBS Arena"], "language": "es", "pub_date": "2024-08-27 00:00:00+00:00", "summary": "The 2024 MTV Video Music Awards will take place on September 11 in New York's UBS Arena. Brazilian singer Anitta will perform a mix of her hits, including 'Savage Funk' and 'Alegr\u00eda', and will also debut her new single 'Paradise' live. This will be her third consecutive year hosting the event. Anitta, who may have guests like Fat Joe, DJ Khaled, and Tiago PZK on stage, aims to win the award for 'Best Latin Artist' for the second time. Colombian singer Karol G, who won the award for 'Best Collaboration' last year for her song 'TQG' with Shakira, will also perform some 'surprises' during the ceremony. Other performers include Sabrina Carpenter, Chappell Roan, GloRilla, Camila Cabello, Benson Boone, Halsey, Lenny Kravitz, and Lisa from Blackpink. LL Cool J will also return to the event after a 25-year absence, performing songs from his new album 'The Force'. He previously won an award in 1991 for 'Best Rap'.", "title": "Actuar\u00e1n Anitta y Karol G en los MTV VMAs 2024", "sentiment": 1, "medoid_distance": null, "markdown_citation": "[PZ](https://www.zocalo.com.mx/actuaran-anitta-y-karol-g-en-los-mtv-vmas-2024)", "provocative": "low", "reporting_voice": "Objective", "as_string_key": "[7]"}, {"article_url": "https://www.terra.com.br/diversao/musica/coldplay-reune-astros-da-musica-no-inedito-single-we-pray,17483f0e3bf025175c18c5bc50a75b8cohuo9ha2.html", "article_id": "69803e00-2f24-5b5d-b5cb-18e8245c4227", "classification": "Entertainment", "country": "BR", "source_id": "Terra", "page_rank": 3380, "domain_url": "terra.com.br", "eng_title": "Coldplay Releases New Single 'We Pray' and Breaks Rock Tour Revenue Record", "entities": {"Person": ["Maggie Rogers", "Elyanna", "Burna Boy", "TINI", "Taylor Swift", "Little Simz", "Taylor", "Chris Martin"], "Organization": ["Coldplay"], "Location": [], "Nationality": [], "Date": ["23", "Friday", "2016", "October 4, 2024", "2017", "March 2022"], "Event": ["Music Of The Spheres World Tour", "MTV VMA"], "Money": [], "Law": [], "Quantity": ["10 million", "Everglow", "Love Story", "1 million", "9 million"], "Time": [], "Sports": [], "Politics": [], "Title": [], "Number": ["9"], "Arms": [], "Product": ["Moon Music", "TOP 1"], "Media": ["Official Big Top 40", "YouTube", "iTunes"], "Transportation": [], "Religion": [], "Technology": [], "Space": [], "Medicine": [], "Language": [], "Science": []}, "image_url": "https://p2.trrsf.com/image/fget/cf/1200/630/middle/images.terra.com/2024/08/26/899775494-coldplay-anna-lee-1.png", "keywords": ["Coldplay", "New Single", "We Pray", "Moon Music"], "language": "pt", "pub_date": "2024-08-26 16:41:54+00:00", "summary": "Coldplay released their new single 'We Pray' last Friday (23), which features the participation of Little Simz, Burna Boy, Elyanna, and TINI. The song is the second single from their upcoming album 'Moon Music', set to be released on October 4, 2024. The album will be made from 100% recycled plastic bottles (9 per disc). The song is a follow-up to their previous single 'feelslikeimfallinginlove', which was nominated for two MTV VMA's, topped the iTunes charts worldwide, and reached the TOP 1 in the UK airplay chart and the Official Big Top 40. The band's Music Of The Spheres World Tour, which started in March 2022 and has sold over 10 million tickets, is currently at the Ernst Happel Stadium in Vienna. The tour has produced 59% less carbon emissions compared to their previous tour in 2016 and 2017, exceeding their original goal of a 50% reduction. The band has also planted 9 million trees (with an additional 1 million to be planted by the end of the year). Chris Martin, the lead vocalist of Coldplay, paid tribute to Taylor Swift during a show in Vienna, singing her song 'Love Story' with Maggie Rogers. Martin said, 'If this isn't good, please don't put it on YouTube because I don't want to have problems with Taylor.' The band has also dedicated a performance of their song 'Everglow' to Taylor Swift, saying 'This is for Taylor Swift because she left the city.' Coldplay has become the most lucrative rock tour in history, with over $5.1 billion in revenue and 8.8 million tickets sold, according to Billboard Boxscore. They have surpassed Elton John's Farewell Yellow Brick Road tour and the U2 360 tour.", "title": "Coldplay re\u00fane astros da m\u00fasica no in\u00e9dito single 'We Pray'", "sentiment": 1, "medoid_distance": null, "markdown_citation": "[T](https://www.terra.com.br/diversao/musica/coldplay-reune-astros-da-musica-no-inedito-single-we-pray,17483f0e3bf025175c18c5bc50a75b8cohuo9ha2.html)", "provocative": "low", "reporting_voice": "Explanatory", "as_string_key": "[8]"}, {"article_url": "https://laopinion.com/2024/08/26/megan-thee-stallion-conducira-la-entrega-de-los-vmas-de-mtv", "article_id": "a276f923-b7f1-5f18-9102-571a6c5103c8", "classification": "Entertainment", "country": "US", "source_id": "La Opini\u00f3n", "page_rank": 15502, "domain_url": "laopinion.com", "eng_title": "Megan Thee Stallion to Host MTV VMAs and Receive Multiple Nominations", "entities": {"Person": ["SZA", "Megan Jovon Ruth Pete", "Eminem", "Post Malone", "Taylor Swift", "Doja Cat", "Megan Thee Stallion", "Ariana Grande", "Billie Eilish"], "Organization": ["MTV", "Billboard Hot 100"], "Location": ["New York"], "Nationality": [], "Date": ["June", "September 11"], "Event": ["MTV VMAs"], "Money": [], "Law": [], "Quantity": [], "Time": [], "Sports": [], "Politics": [], "Title": [], "Number": ["29-year-old", "10"], "Arms": [], "Product": ["Fortnight"], "Media": [], "Transportation": [], "Religion": [], "Technology": [], "Space": [], "Medicine": [], "Language": [], "Science": []}, "image_url": "https://laopinion.com/wp-content/uploads/sites/3/2024/08/megantheestallion-ap.jpg?w=1200", "keywords": ["Megan Thee Stallion", "MTV VMAs", "Megan", "Billboard Hot 100", "Taylor Swift"], "language": "es", "pub_date": "2024-08-26 15:23:19+00:00", "summary": "Megan Thee Stallion has been chosen to host the MTV VMAs on September 11. She is also nominated for five awards, including Best Collaboration, Best Hip-Hop Video, Best Direction, Best Visual Effects, and Best Art Direction. The 29-year-old artist, whose real name is Megan Jovon Ruth Pete, released her third album, 'Megan', in June, which received positive reviews. One of the singles, 'Hiss', reached number 1 on the Billboard Hot 100 chart. It is expected that she will also perform at the awards ceremony, which will take place at the UBS Arena in New York. Taylor Swift leads the nominations this year with a total of 10. The music videos competing in the Best Video category are 'We Can't Be Friends (Wait For Your Love)' by Ariana Grande, 'Lunch' by Billie Eilish, 'Paint The Town Red' by Doja Cat, 'Houdini' by Eminem, 'Snooze' by SZA, and 'Fortnight' by Swift and Post Malone, according to MTV.", "title": "Megan Thee Stallion conducir\u00e1 la entrega de los VMAs de MTV", "sentiment": 1, "medoid_distance": null, "markdown_citation": "[LO](https://laopinion.com/2024/08/26/megan-thee-stallion-conducira-la-entrega-de-los-vmas-de-mtv)", "provocative": "low", "reporting_voice": "Objective", "as_string_key": "[9]"}], "news knowledge": [{"article_url": "https://www.ghanaweb.com/GhanaHomePage/entertainment/Full-list-of-nominees-for-2024-MTV-VMAs-1946660", "article_id": "e5fdcd7f-97a1-5b76-bc20-f4b7907beb69", "classification": "Entertainment", "country": "GH", "source_id": "GhanaWeb", "page_rank": 8553, "domain_url": "ghanaweb.com", "eng_title": "Full list of nominees for 2024 MTV VMAs", "entities": {"Person": ["Gracie Abrams", "Benson Boone"], "Organization": [], "Location": ["Elmont", "New York"], "Nationality": [], "Date": ["September 11, 2024"], "Event": ["MTV Video Music Awards"], "Money": [], "Law": [], "Quantity": [], "Time": [], "Sports": [], "Politics": [], "Title": ["Artist of the Year"], "Number": [], "Arms": [], "Product": [], "Media": [], "Transportation": [], "Religion": [], "Technology": [], "Space": [], "Medicine": [], "Language": [], "Science": []}, "image_url": "https://cdn.ghanaweb.com/imagelib/pics/865/86583223.jpg", "keywords": ["MTV VMAs", "Ariana Grande", "Billie Eilish", "Doja Cat", "Eminem"], "language": "en", "pub_date": "2024-08-20 15:02:41+00:00", "summary": "The 2024 MTV Video Music Awards nominees have been announced. The ceremony will take place on September 11, 2024, at the UBS Arena in Elmont, New York. The nominees include Ariana Grande, Billie Eilish, Doja Cat, Eminem, and SZA for Video of the Year, and Taylor Swift for Artist of the Year. Other nominees include Benson Boone, Chappell Roan, Gracie Abrams, and Teddy Swims for Best New Artist. The nominees for Best Collaboration include Drake ft. Sexyy Red & SZA, GloRilla, Megan Thee Stallion, and Taylor Swift ft. Post Malone. The nominees for Best Pop include Camila Cabello, Dua Lipa, Olivia Rodrigo, Sabrina Carpenter, and Taylor Swift. The nominees for Best Hip-Pop include Drake ft. Sexyy Red & SZA, Eminem, GloRilla, Megan Thee Stallion, and Travis Scott ft. Playboi Carti. The nominees for Best R&B include Alicia Keys, Muni Long, SZA, Tyla, and USHER, Summer Walker, 21 Savage. The nominees for Best Alternative include Benson Boone, Bleachers, Hozier, Imagine Dragons, and Linkin Park. The nominees for Best Rock include Bon Jovi, Coldplay, Green Day, Kings of Leon, and Lenny Kravitz. The nominees for Best Afrobeats include Ayra Starr ft. Giveon, Burna Boy, Chris Brown ft. Davido & Lojay, Tems, and Tyla. The nominees for Best Latin include Anitta, Bad Bunny, KAROL G, Myke Towers, and Peso Pluma & Anitta. The nominees for Best K-Pop include Jung Kook ft. Latto, LISA, NCT Dream, NewJeans, and Stray Kids. The nominees for Video for Good include Alexander Stewart, Billie Eilish, Coldplay, Joyner Lucas & Jelly Roll, and RAYE. The nominees for Best Direction include Ariana Grande, Bleachers, Eminem, Megan Thee Stallion, and Taylor Swift. The nominees for Best Cinematography include Ariana Grande, Charli xcx, Dua Lipa, Olivia Rodrigo, and Taylor Swift. The nominees for Best Editing include Anitta, Ariana Grande, Eminem, LISA, and Taylor Swift. The nominees for Best Choreography include Bleachers, Dua Lipa, LISA, Rauw Alejandro, and Tate McRae. The nominees for Best Visual Effects include Ariana Grande, Eminem, Justin Timberlake, Megan Thee Stallion, and Olivia Rodrigo. The nominees for Best Art Direction include Charli xcx, LISA, Megan Thee Stallion, Olivia Rodrigo, and Taylor Swift. ", "title": "Full list of nominees for 2024 MTV VMAs", "sentiment": 0, "medoid_distance": null, "markdown_citation": "[GW](https://www.ghanaweb.com/GhanaHomePage/entertainment/Full-list-of-nominees-for-2024-MTV-VMAs-1946660)", "provocative": "low", "reporting_voice": "Objective", "as_string_key": "[1]"}, {"article_url": "https://www.rionegro.com.ar/cultura/coldplay-anuncio-la-fecha-de-su-nuevo-tema-junto-a-tini-3746989", "article_id": "6d2a602e-5fe9-5d6f-b5ea-10a22b24cd69", "classification": "Entertainment", "country": "AR", "source_id": "Diario R\u00edo Negro", "page_rank": 51118, "domain_url": "rionegro.com.ar", "eng_title": "Coldplay Announces New Single 'WE PRAY' with TINI, Elyanna, and More", "entities": {"Person": ["Burna Boy", "Elyanna", "TINI", "Little Simz"], "Organization": ["Coldplay"], "Location": ["Munich"], "Nationality": [], "Date": ["August 23", "October 4, 2024", "20", "September 6", "2016/17"], "Event": ["Music Of The Spheres World Tour", "Glastonbury 2024"], "Money": [], "Law": [], "Quantity": ["8 million", "9 million trees"], "Time": [], "Sports": [], "Politics": [], "Title": [], "Number": [], "Arms": [], "Product": ["Moon Music"], "Media": ["UK radio chart"], "Transportation": [], "Religion": [], "Technology": [], "Space": [], "Medicine": [], "Language": [], "Science": ["CO2e"]}, "image_url": "https://www.rionegro.com.ar/wp-content/uploads/2024/08/Coldplay-Main-press-photo-Credit_-Anna-Lee-Highres-e1723815889583.jpg?w=1200&h=630&crop=1", "keywords": ["Coldplay", "New Single", "WE PRAY", "Moon Music"], "language": "es", "pub_date": "2024-08-16 16:00:00+00:00", "summary": "Coldplay has announced the release of their new single 'WE PRAY' on August 23. The song features Little Simz, Burna Boy, Elyanna, and TINI. The single was first performed live at Glastonbury 2024 and is available for pre-order in eco-friendly formats. There are five versions of the song: the original, a TINI version, an Elyanna version, a mystery version, and a live version from Glastonbury. The TINI and Elyanna versions will be released on September 6 and 20, respectively. 'WE PRAY' is the second single from their upcoming album 'Moon Music', which will be released on October 4, 2024. The album is made from 100% recycled plastic bottles and is available for pre-order. This follows their previous single 'feelslikeimfallinginlove', which was nominated for two MTV VMA awards and reached number one on the UK radio chart. Coldplay's Music Of The Spheres World Tour, which started in 2022 and has sold over 8 million tickets, is ending tonight in Munich. The tour has produced a 59% reduction in CO2e emissions compared to their 2016/17 stadium tour, exceeding their goal of a 50% reduction. They have also planted 9 million trees, one for each ticket sold.", "title": "Coldplay anunci\u00f3 la fecha de su nuevo tema junto a Tini", "sentiment": 1, "medoid_distance": null, "markdown_citation": "[DRN](https://www.rionegro.com.ar/cultura/coldplay-anuncio-la-fecha-de-su-nuevo-tema-junto-a-tini-3746989)", "provocative": "low", "reporting_voice": "Objective", "as_string_key": "[2]"}, {"article_url": "https://www.correiobraziliense.com.br/diversao-e-arte/2024/08/6912323-coldplay-lanca-versao-de-8216feelslikeimfallinginlove-8217-com-artista-brasileiro.html", "article_id": "8d51f32c-d8bc-553e-9192-82ee67d11358", "classification": "Entertainment", "country": "BR", "source_id": "Correio Braziliense", "page_rank": 9173, "domain_url": "correiobraziliense.com.br", "eng_title": "Coldplay Collaborates with Zerb on New Version of 'feelslikeimfallinginlove'", "entities": {"Person": ["Chris Martin", "Zerb", "Raman Djafari", "Jonny Buckland"], "Organization": ["Coldplay"], "Location": ["Helsinki", "D\u00fcsseldorf"], "Nationality": ["Brazilian"], "Date": ["October 4, 2024", "July"], "Event": [], "Money": [], "Law": [], "Quantity": [], "Time": [], "Sports": [], "Politics": [], "Title": [], "Number": ["15"], "Arms": [], "Product": ["Moon Music"], "Media": [], "Transportation": [], "Religion": [], "Technology": [], "Space": [], "Medicine": [], "Language": [], "Science": []}, "image_url": "https://midias.correiobraziliense.com.br/_midias/png/2024/08/02/coldplay_anna_lee-39252069.png", "keywords": ["Coldplay", "Zerb", "feelslikeimfallinginlove", "Moon Music"], "language": "pt", "pub_date": "2024-08-02 17:56:29+00:00", "summary": "Coldplay has released a new version of their hit song 'feelslikeimfallinginlove' in collaboration with Brazilian DJ and producer Zerb. The song, which features vibrant touches from the band's latest single, was created with Zerb in the Coldplay's backstage studio during their shows in D\u00fcsseldorf last week. The official music video, featuring Chris Martin and Jonny Buckland, was filmed in Helsinki streets earlier this week. Zerb also shared a behind-the-scenes look at the studio session in D\u00fcsseldorf. 'feelslikeimfallinginlove' is the first single from Coldplay's upcoming album 'Moon Music', set to be released on October 4, 2024. The album will be made from 100% recycled plastic bottles, with nine bottles per disc. Coldplay previously released a lyric video for the song in July, directed by Raman Djafari and featuring a team of 15 animators from around the world.", "title": "Coldplay lan\u00e7a vers\u00e3o de \u2018feelslikeimfallinginlove' com artista brasileiro", "sentiment": 1, "medoid_distance": null, "markdown_citation": "[CB](https://www.correiobraziliense.com.br/diversao-e-arte/2024/08/6912323-coldplay-lanca-versao-de-8216feelslikeimfallinginlove-8217-com-artista-brasileiro.html)", "provocative": "low", "reporting_voice": "Explanatory", "as_string_key": "[3]"}, {"article_url": "https://lado.mx/noticia.php?id=16382378", "article_id": "f3a76596-546e-5a71-aa54-ae080b3d5182", "classification": "Entertainment", "country": "MX", "source_id": "Lado.mx", "page_rank": 544851, "domain_url": "lado.mx", "eng_title": "Coldplay and Zerb Release Remix of 'feelslikeimfallinginlove'", "entities": {"Person": ["Zerb", "Christian Fandrey", "Chris Martin"], "Organization": ["Coldplay"], "Location": ["Olympiastadion", "Helsinki", "Dusseldorf"], "Nationality": ["Brazilian"], "Date": ["October 4, 2024"], "Event": [], "Money": [], "Law": [], "Quantity": [], "Time": [], "Sports": [], "Politics": [], "Title": [], "Number": ["nine"], "Arms": [], "Product": ["EcoCD", "EcoRecord", "Moon Music"], "Media": ["Quadrat\u00edn M\u00e9xico"], "Transportation": [], "Religion": [], "Technology": [], "Space": [], "Medicine": [], "Language": [], "Science": []}, "image_url": "https://www.youtube.com/embed/HNUSAQDz4jA?feature=oembed", "keywords": ["Coldplay", "Zerb", "Remix", "feelslikeimfallinginlove"], "language": "es", "pub_date": "2024-08-02 17:21:09+00:00", "summary": "Coldplay and Brazilian artist Zerb have released a remix of their song 'feelslikeimfallinginlove', which was created behind the scenes of their shows at the Dusseldorf stadium last week. The music video, featuring Chris Martin and dancer Christian Fandrey, was filmed in the streets of Helsinki this week, between Coldplay's four sold-out shows at the Olympiastadion. 'feelslikeimfallinginlove' is the first single from Coldplay's upcoming tenth album, 'Moon Music', which will be released on October 4, 2024. The album will set new sustainability standards, as each vinyl record is made from nine recycled plastic bottles. The song is available for pre-order on EcoCD, EcoRecord, and digital formats. As reported by Quadrat\u00edn M\u00e9xico, Zerb also feels like he's falling in love with Coldplay's music.", "title": "Zerb tambi\u00e9n se siente como si se estuviera enamorando como Coldplay Quadrat\u00edn M\u00e9xico", "sentiment": 1, "medoid_distance": null, "markdown_citation": "[L](https://lado.mx/noticia.php?id=16382378)", "provocative": "low", "reporting_voice": "Objective", "as_string_key": "[4]"}, {"article_url": "https://spettacoli.tiscali.it/news/articoli/coldplay-online-lyric-video-feelslikeimfallinginlove", "article_id": "28078689-4126-58e8-b27f-50b7fb8a9e08", "classification": "Entertainment", "country": "IT", "source_id": "Tiscali", "page_rank": 5134, "domain_url": "tiscali.it", "eng_title": "Coldplay Releases Official Lyric Video for 'feelslikeimfallinginlove'", "entities": {"Person": ["Raman Djafari"], "Organization": ["EcoCD", "Coldplay", "Blinkink"], "Location": [], "Nationality": [], "Date": ["October 4, 2024"], "Event": [], "Money": [], "Law": [], "Quantity": [], "Time": ["five years"], "Sports": [], "Politics": [], "Title": [], "Number": ["nine", "15"], "Arms": [], "Product": ["A Film For The Future", "Moon Music", "EcoRecord LP", "Music of the Spheres", "FFTF2024", "LP"], "Media": ["Everyday Life"], "Transportation": [], "Religion": [], "Technology": ["digital"], "Space": [], "Medicine": [], "Language": [], "Science": []}, "image_url": "https://simg.tiscali.it/media/24/07/22/rs_225_italpress_spettacoli_20240722_0002.jpg", "keywords": ["Coldplay", "Lyric Video", "feelslikeimfallinginlove", "A Film For The Future"], "language": "it", "pub_date": "2024-07-22 18:08:00+00:00", "summary": "Coldplay has released the official lyric video for their latest single, 'feelslikeimfallinginlove'. The video was created by renowned director Raman Djafari through Blinkink, and features a team of 15 animators from around the world. The concept of the video focuses on a couple's journey to find each other, told in three chapters: desire, search, and discovery. The video is also a preview of 'A Film For The Future', a project that the band has been teasing for five years. The album's booklet, Everyday Life, includes a photo of an old car with the FFTF2024 license plate and a billboard for the next album, Music of the Spheres. 'feelslikeimfallinginlove' is the first single from the band's upcoming tenth album, Moon Music, set to be released on October 4, 2024. The album will set new sustainability standards, with each LP made from 100% recycled plastic bottles (nine bottles per disc). Pre-orders are available on EcoCD, EcoRecord LP, and digital.", "title": "Coldplay, online il lyric video \"feelslikeimfallinginlove\"", "sentiment": 1, "medoid_distance": null, "markdown_citation": "[T](https://spettacoli.tiscali.it/news/articoli/coldplay-online-lyric-video-feelslikeimfallinginlove)", "provocative": "low", "reporting_voice": "Objective", "as_string_key": "[5]"}, {"article_url": "https://www.correiobraziliense.com.br/diversao-e-arte/2024/07/6903795-coldplay-lanca-lyric-video-do-single-8220feelslikeimfallinginlove-8221.html", "article_id": "77d8e6d7-06d5-586a-917e-9d492204835e", "classification": "Entertainment", "country": "BR", "source_id": "Correio Braziliense", "page_rank": 9052, "domain_url": "correiobraziliense.com.br", "eng_title": "Coldplay Releases Lyric Video for 'feelslikeimfallinginlove'", "entities": {"Person": ["Ayra Starr", "Raman Djafari", "Chris Martin"], "Organization": ["Chainsmokers", "Coldplay"], "Location": ["Italy"], "Nationality": ["Nigerian"], "Date": ["October 4, 2024"], "Event": [], "Money": [], "Law": [], "Quantity": [], "Time": ["five years"], "Sports": [], "Politics": [], "Title": [], "Number": ["15", "nine"], "Arms": [], "Product": ["Moon Music", "LP"], "Media": ["A Film For The Future"], "Transportation": [], "Religion": [], "Technology": [], "Space": [], "Medicine": [], "Language": [], "Science": []}, "image_url": "https://midias.em.com.br/_midias/png/2024/07/22/215x215/1_coldplay_lanca_lyric_video_do_single_feelslikeimfallinginlove-39051559.png", "keywords": ["Coldplay", "Lyric Video", "Feelslikeimfallinginlove", "Moon Music"], "language": "pt", "pub_date": "2024-07-22 16:05:44+00:00", "summary": "Coldplay has released the lyric video for their latest single, 'feelslikeimfallinginlove'. The video was directed by Raman Djafari and features 15 animators from around the world. The concept of the video revolves around a couple searching for each other and finally finding each other, with three chapters: longing, searching, and meeting. The video also gives a first glimpse of 'A Film For The Future', a project that has been announced by the band for five years. The single is the first from the band's upcoming album, 'Moon Music', which will be released on October 4, 2024. The album will set new sustainability standards, with each LP made from 100% recycled plastic bottles (nine bottles per disc). Coldplay also performed a new song, 'Good Feelings', during a show in Italy, with Chris Martin singing 'We fell in love in the summer/I remember baby, we felt the sun shine through/And we were born for each other.' The song has been rumored to be a collaboration with the Chainsmokers, but the new version will feature vocals from Nigerian singer Ayra Starr.", "title": "Coldplay lan\u00e7a lyric video do single 'feelslikeimfallinginlove'", "sentiment": 1, "medoid_distance": null, "markdown_citation": "[CB](https://www.correiobraziliense.com.br/diversao-e-arte/2024/07/6903795-coldplay-lanca-lyric-video-do-single-8220feelslikeimfallinginlove-8221.html)", "provocative": "low", "reporting_voice": "Objective", "as_string_key": "[6]"}, {"article_url": "https://www.futuro.cl/2024/07/luego-de-un-gran-glastonbury-2024-coldplay-estreno-videoclip-de-feelslikeimfallinginlove", "article_id": "16bd14ab-a638-5a53-ab1d-69dd882b7ff8", "classification": "Entertainment", "country": "CL", "source_id": "Radio Futuro 88.9", "page_rank": 233646, "domain_url": "futuro.cl", "eng_title": "Coldplay Releases Music Video for 'feelslikeimfallinginlove'", "entities": {"Person": ["Ben Mor", "Beyonc\u00e9", "Natasha Ofili"], "Organization": ["White Hands Ensemble", "BBC", "Coldplay", "Dudamel Foundation"], "Location": ["Athens"], "Nationality": [], "Date": ["October 4, 2024"], "Event": ["Glastonbury Festival"], "Money": [], "Law": [], "Quantity": [], "Time": [], "Sports": [], "Politics": [], "Title": [], "Number": [], "Arms": [], "Product": ["Moon Music"], "Media": [], "Transportation": [], "Religion": [], "Technology": [], "Space": [], "Medicine": [], "Language": ["American Sign Language", "Venezuelan Sign Language", "LSV"], "Science": []}, "image_url": "https://www.futuro.cl/wp-content/uploads/2024/07/coldplay-jpg.webp", "keywords": ["Coldplay", "Music Video", "feelslikeimfallinginlove", "Athens"], "language": "es", "pub_date": "2024-07-02 19:59:55+00:00", "summary": "Coldplay has released the music video for their new single 'feelslikeimfallinginlove', filmed in Athens. The video was directed by Ben Mor, who previously worked on the video for 'Hymn For The Weekend' with Beyonc\u00e9. The video features actress, writer, and narrator Natasha Ofili, who also wrote and directed the creative direction. Ofili created her own interpretation of the song in American Sign Language. The video also includes the participation of deaf members of the Venezuelan Sign Language (LSV) choir from the White Hands Ensemble, in collaboration with the Dudamel Foundation. The release follows Coldplay's show at the Glastonbury Festival, which received rave reviews and was broadcast live around the world by the BBC. The song is the first single from their upcoming tenth album, Moon Music, which will be released on October 4, 2024. The album will set new sustainability standards, with each vinyl record made from 100% recycled plastic bottles. ", "title": "Luego de un gran Glastonbury 2024: Coldplay estren\u00f3 videoclip de 'feelslikeimfallinginlove'", "sentiment": 1, "medoid_distance": null, "markdown_citation": "[RF](https://www.futuro.cl/2024/07/luego-de-un-gran-glastonbury-2024-coldplay-estreno-videoclip-de-feelslikeimfallinginlove)", "provocative": "low", "reporting_voice": "Objective", "as_string_key": "[7]"}, {"article_url": "https://lado.mx/noticia.php?id=16165242", "article_id": "3b66797a-6e80-5239-a3b9-129f49f9c64e", "classification": "Entertainment", "country": "MX", "source_id": "Lado.mx", "page_rank": 461768, "domain_url": "lado.mx", "eng_title": "Coldplay's New Single 'feelslikeimfallinginlove' Music Video Features ASL Interpretation", "entities": {"Person": ["Natasha Ofili", "Ofili", "Herodes Atticus"], "Organization": ["White Hands Choir", "Coldplay", "Dudamel Foundation"], "Location": ["Athens", "Barquisimeto", "Ode\u00f3n"], "Nationality": [], "Date": ["October 4, 2024"], "Event": ["Glastonbury Festival"], "Money": [], "Law": [], "Quantity": [], "Time": [], "Sports": [], "Politics": [], "Title": [], "Number": [], "Arms": [], "Product": ["Moon Music"], "Media": ["The Independent", "The Guardian", "The i", "The Times", "The Telegraph"], "Transportation": [], "Religion": [], "Technology": [], "Space": [], "Medicine": [], "Language": ["ASL", "LSV", "Venezuelan Sign Language", "American Sign Language"], "Science": []}, "image_url": "https://vanguardia.com.mx/binrepository/grfpiucweaaoedf_1-9366644_20240702180337.jpg", "keywords": ["Coldplay", "Music Video", "ASL", "Glastonbury Festival", "Moon Music"], "language": "es", "pub_date": "2024-07-02 16:00:18+00:00", "summary": "Coldplay released the music video for their new single 'feelslikeimfallinginlove', which was filmed at the ancient Ode\u00f3n of Herodes Atticus in Athens, Greece. The video features actress, writer, and narrator Natasha Ofili, who also wrote the script and creative direction. The video includes American Sign Language (ASL) interpretation by Ofili, as well as the participation of deaf sign language interpreters from the Venezuelan Sign Language (LSV) section of the White Hands Choir from Barquisimeto, Venezuela, in collaboration with the Dudamel Foundation. The video follows the band's Saturday night show at the Glastonbury Festival, which received five-star reviews from publications such as The Times, The Independent, The Guardian, The i, and The Telegraph. The single is the first from their upcoming tenth album, 'Moon Music', set to be released on October 4, 2024, which will set new sustainability standards, as each vinyl record is made from 100% recycled plastic bottles.", "title": "En video tambi\u00e9n se siente como si Coldplay se estuviera enamorando", "sentiment": 1, "medoid_distance": null, "markdown_citation": "[L](https://lado.mx/noticia.php?id=16165242)", "provocative": "low", "reporting_voice": "Objective", "as_string_key": "[8]"}, {"article_url": "https://www.rainews.it/video/2024/07/i-coldplay-presentano-il-video-del-nuovo-singolo-lamore-puo-davvero-farci-volare-feelslikeimfallinginlove-ac76b82b-357f-4627-aed6-0f8d2ad7dcd9.html", "article_id": "6924927f-f466-5939-8fa9-90e0e090a779", "classification": "Entertainment", "country": "IT", "source_id": "RaiNews", "page_rank": 5153, "domain_url": "rainews.it", "eng_title": "Coldplay Unveils New Single 'feelslikeimfallinginlove' with a Powerful Music Video", "entities": {"Person": ["Natasha Ofili", "Ben Mor", "Beyonc\u00e9"], "Organization": ["EcoCD", "Coro delle Mani Bianche", "Coro de Manos Blancas", "Dudamel Foundation", "El Sistema Venezuela", "Coldplay"], "Location": ["Barquisimeto", "Athens"], "Nationality": [], "Date": ["Saturday", "October 4, 2024"], "Event": ["Glastonbury", "Glastonbury Festival"], "Money": [], "Law": [], "Quantity": [], "Time": [], "Sports": [], "Politics": [], "Title": [], "Number": [], "Arms": [], "Product": ["EcoRecord LP", "Moon Music"], "Media": ["The Guardian", "The Times", "The Independent", "The Telegraph"], "Transportation": [], "Religion": [], "Technology": ["digital"], "Space": [], "Medicine": [], "Language": ["Venezuelan Sign Language", "American Sign Language"], "Science": []}, "image_url": "https://www.rainews.it/cropgd/1200x630/dl/img/2024/07/01/1719864634904_.png", "keywords": ["Coldplay", "Music Video", "New Single", "feelslikeimfallinginlove", "Ben Mor"], "language": "it", "pub_date": "2024-07-01 20:09:00+00:00", "summary": "Coldplay has released the music video for their new single, 'feelslikeimfallinginlove'. The video was shot at the ancient Odeon of Herodes Atticus in Athens, Greece, in front of a invited audience through the band's social media. The director is Ben Mor, who also directed the video for 'Hymn For The Weekend' with Beyonc\u00e9. The video features actress, writer, and narrator Natasha Ofili, who also wrote the story and creative direction of the video. Ofili also performed the song in American Sign Language, which is featured throughout the video. The video also includes members of the Venezuelan Sign Language section of the Coro de Manos Blancas (Coro delle Mani Bianche) of El Sistema Venezuela, a world-renowned artistic ensemble from Barquisimeto, supported by the Dudamel Foundation. The premiere follows the band's headlining concert at the Glastonbury Festival on Saturday night, which received five-star reviews from publications such as The Times, The Independent, The Guardian, and The Telegraph, which described it as 'one of the great sets at Glastonbury'. 'feelslikeimfallinginlove' is the first single from Coldplay's tenth album, Moon Music, set to be released on October 4, 2024. The album, which will set new sustainability standards, with every LP made from 100% recycled plastic bottles (nine bottles per disc), is already available for pre-order on EcoCD, EcoRecord LP, and digital.", "title": "I Coldplay presentano il video del nuovo singolo: l'amore pu\u00f2 davvero farci volare", "sentiment": 1, "medoid_distance": null, "markdown_citation": "[RN](https://www.rainews.it/video/2024/07/i-coldplay-presentano-il-video-del-nuovo-singolo-lamore-puo-davvero-farci-volare-feelslikeimfallinginlove-ac76b82b-357f-4627-aed6-0f8d2ad7dcd9.html)", "provocative": "low", "reporting_voice": "Objective", "as_string_key": "[9]"}, {"article_url": "https://www.nme.com/news/music/coldplay-share-feelslikeimfallinginlove-video-following-glastonbury-headline-performance-3771139", "article_id": "566d92d4-25dc-5bc2-9888-6c105cf76813", "classification": "Entertainment", "country": "US", "source_id": "NME", "page_rank": 1697, "domain_url": "nme.com", "eng_title": "Coldplay share 'feelslikeimfallinginlove' video following Glastonbury headline performance", "entities": {"Person": ["Natasha Ofili", "Chris Martin", "Michael J. Fox"], "Organization": ["El Sistema Venezuela", "Coldplay", "White Hands Choir", "Coro de Manos Blancas"], "Location": [], "Nationality": ["Deaf"], "Date": ["2025", "October 4"], "Event": ["Glastonbury"], "Money": [], "Law": [], "Quantity": [], "Time": [], "Sports": [], "Politics": [], "Title": [], "Number": ["10th"], "Arms": [], "Product": ["Moon Music"], "Media": [], "Transportation": [], "Religion": [], "Technology": [], "Space": [], "Medicine": [], "Language": ["American Sign Language", "ASL", "LSV", "Venezuelan Sign Language"], "Science": []}, "image_url": "https://www.nme.com/wp-content/uploads/2024/07/NMEGlasto24_Coldplay_Pyramid_AFord-621204.jpg", "keywords": ["Coldplay", "Glastonbury", "Music Video", "ASL", "Chris Martin"], "language": "en", "pub_date": "2024-07-01 18:14:00+00:00", "summary": "Coldplay has released the music video for their single 'feelslikeimfallinginlove' following their headlining performance at Glastonbury 2024. The video features American Sign Language (ASL) interpretation by Natasha Ofili and the Deaf members of the Venezuelan Sign Language (LSV) section from El Sistema Venezuela's Coro de Manos Blancas (White Hands Choir). The band's 10th studio album, 'Moon Music', is set for release on October 4. The album may be the last from Coldplay, as the band has hinted they will stop releasing albums in 2025. Frontman Chris Martin has expressed his love for making music, but also the intensity of the process. The band's performance at Glastonbury was well-received, with fans and critics praising their set. Michael J. Fox was a surprise guest during the encore, and fans also reacted to Chris Martin's apparent accent change during the performance.", "title": "Coldplay share 'feelslikeimfallinginlove' video following Glastonbury headline performance", "sentiment": 1, "medoid_distance": null, "markdown_citation": "[NME](https://www.nme.com/news/music/coldplay-share-feelslikeimfallinginlove-video-following-glastonbury-headline-performance-3771139)", "provocative": "low", "reporting_voice": "Objective", "as_string_key": "[10]"}]}