{"latest news": [{"article_url": "https://www.newsweek.com/entertainment/celebrity-news/recap-iconic-vmas-performance-nominees-august-2024-1947141", "article_id": "7b2d922a-67f0-598f-8eba-e1fea2d9eb18", "classification": "Entertainment", "country": "US", "source_id": "Newsweek", "page_rank": 376, "domain_url": "newsweek.com", "eng_title": "A Recap of the Iconic VMAs Performance Nominees", "entities": {"Person": ["Britney Spears", "Madonna", "Christina Aguilera", "Missy Elliott", "Lady Gaga", "Taylor Swift", "Eminem", "Beyonc\u00e9", "Katy Perry"], "Organization": [], "Location": ["Hollywood"], "Nationality": [], "Date": ["2024", "2003", "2000", "2011", "2013", "1984", "2009"], "Event": ["Love on Top", "Paparazzi", "Most Iconic VMAs", "Roar", "MTV Video Music Awards"], "Money": [], "Law": [], "Quantity": [], "Time": ["four decades"], "Sports": [], "Politics": [], "Title": [], "Number": ["12"], "Arms": [], "Product": [], "Media": [], "Transportation": [], "Religion": [], "Technology": [], "Space": [], "Medicine": [], "Language": [], "Science": []}, "image_url": "https://d.newsweek.com/en/full/2461960/lady-gaga-paparazzi-vmas-2009.jpg", "keywords": ["VMAs", "Taylor Swift", "Madonna", "Eminem", "Britney Spears"], "language": "en", "pub_date": "2024-08-31 18:28:39+00:00", "summary": "The 2024 MTV Video Music Awards is honoring iconic performances from the past four decades. Taylor Swift leads the nominations with 12 categories. The nominees for the Most Iconic VMAs performance category include Madonna's 'Like a Virgin' (1984), Eminem's 'The Real Slim Shady' & 'The Way I Am' (2000), Britney Spears, Christina Aguilera, Madonna & Missy Elliott's 'Like a Virgin' & 'Hollywood' (2003), Lady Gaga's 'Paparazzi' (2009), Taylor Swift's 'You Belong With Me' (2009), Beyonc\u00e9's 'Love on Top' (2011), and Katy Perry's 'Roar' (2013). These performances sparked controversy, inspired generations of theatrical performances, and brought the artists to new levels of fame.", "title": "A Recap of the Iconic VMAs Performance Nominees", "sentiment": 1, "medoid_distance": null, "markdown_citation": "[N](https://www.newsweek.com/entertainment/celebrity-news/recap-iconic-vmas-performance-nominees-august-2024-1947141)", "provocative": "low", "reporting_voice": "Narrative", "as_string_key": "[1]"}, {"article_url": "https://aussiedlerbote.de/ru/tieilor-svift-zavoievala-priznaniie-v-muzykalnom-siektorie-s-nieskolkimi-nominatsiiami-na-priemiiu-vma", "article_id": "92159ced-aafd-5d19-bb79-308b3a30c97b", "classification": "Entertainment", "country": "DE", "source_id": "Zeitung \"Aussiedlerbote\" / \u0413\u0430\u0437\u0435\u0442\u0430 \"\u041f\u0435\u0440\u0435\u0441\u0435\u043b\u0435\u043d\u0447\u0435\u0441\u043a\u0438\u0439 \u0412\u0435\u0441\u0442\u043d\u0438\u043a\"", "page_rank": 185129, "domain_url": "aussiedlerbote.de", "eng_title": "Taylor Swift Leads MTV Video Music Awards Nominees with 12 Nominations", "entities": {"Person": ["SZA", "Morgan Wallen", "Dua Lipa", "Post Malone", "Doja Cat", "Taylor Swift", "Camila Cabello", "Benson Boone", "GloRilla", "Sabrina Carpenter", "Beyonc\u00e9", "Billie Eilish", "Ariana Grande", "Eminem", "Megan Thee Stallion", "Katy Perry"], "Organization": ["MTV"], "Location": ["New York"], "Nationality": [], "Date": ["1984", "2009", "September 11"], "Event": ["astronaut", "MTV Video Music Awards", "VMA", "Song of the Year"], "Money": [], "Law": [], "Quantity": [], "Time": [], "Sports": [], "Politics": [], "Title": ["Artist", "Video Vanguard Award"], "Number": ["11", "29", "8", "12", "7"], "Arms": [], "Product": [], "Media": [], "Transportation": [], "Religion": [], "Technology": [], "Space": [], "Medicine": [], "Language": [], "Science": []}, "image_url": "https://cdn.aussiedlerbote.de/content/images/2024/08/31/469998/jpeg/4-3/1200/75/teilor-svift-zavoevala-priznanie-v-muzykalnom-sektore-s-neskolkimi-nominatsiiami-na-premiiu-vma.webp", "keywords": ["Taylor Swift", "MTV Video Music Awards", "Post Malone", "Eminem", "Ariana Grande"], "language": "ru", "pub_date": "2024-08-31 12:29:19+00:00", "summary": "Taylor Swift leads the list of nominees for the MTV Video Music Awards (VMA) with 12 nominations in the categories of 'Video', 'Artist', and 'Song of the Year'. She is followed closely by Post Malone with 11 nominations, including their collaborative hit 'Fortnight' and 'I Had Some Help' with country singer Morgan Wallen. Eminem received 8 nominations, while Ariana Grande, Megan Thee Stallion, Sabrina Carpenter, and SZA each received 7. Other notable nominees include Billie Eilish, Dua Lipa, Beyonc\u00e9, Doja Cat, Benson Boone, and GloRilla. Katy Perry will receive the 'Video Vanguard Award' for her hit 'Teenage Dream'. Megan Thee Stallion, 29, will host the show on September 11. The event will take place in New York, with live performances confirmed for Katy Perry, Camila Cabello, Sabrina Carpenter, and GloRilla. The VMA awards have been presented since 1984, and fans can vote online for their favorites. The awards are represented by a figurine of an astronaut holding an MTV flag. Taylor Swift's 2009 performance of 'You Belong With Me' is included in the list of nominees for 'Most Iconic VMA Performance of All Time', demonstrating her lasting impact on music. Despite Taylor Swift's significant lead, Katy Perry is also recognized with the 'Video Vanguard Award' for her influential musical career, particularly with her hit 'Teenage Dream'.", "title": "\u0422\u0435\u0439\u043b\u043e\u0440 \u0421\u0432\u0438\u0444\u0442 \u043f\u043e\u043b\u0443\u0447\u0430\u0435\u0442 \u0434\u043e\u043f\u043e\u043b\u043d\u0438\u0442\u0435\u043b\u044c\u043d\u044b\u0435 \u043d\u043e\u043c\u0438\u043d\u0430\u0446\u0438\u0438 \u043d\u0430 \u043f\u0440\u0435\u043c\u0438\u044e MTV Video Music Awards", "sentiment": 1, "medoid_distance": null, "markdown_citation": "[ZA\u0413](https://aussiedlerbote.de/ru/tieilor-svift-zavoievala-priznaniie-v-muzykalnom-siektorie-s-nieskolkimi-nominatsiiami-na-priemiiu-vma)", "provocative": "low", "reporting_voice": "Objective", "as_string_key": "[2]"}, {"article_url": "https://aussiedlerbote.de/fr/taylor-swift-sassure-de-plus-de-reconnaissance-dans-le-secteur-de-la-musique-avec-plusieurs-nominations-aux-vma", "article_id": "a2708723-9311-549c-9890-5a18bd24cfc5", "classification": "Entertainment", "country": "DE", "source_id": "Zeitung \"Aussiedlerbote\" / \u0413\u0430\u0437\u0435\u0442\u0430 \"\u041f\u0435\u0440\u0435\u0441\u0435\u043b\u0435\u043d\u0447\u0435\u0441\u043a\u0438\u0439 \u0412\u0435\u0441\u0442\u043d\u0438\u043a\"", "page_rank": 185129, "domain_url": "aussiedlerbote.de", "eng_title": "Taylor Swift Leads VMA Nominations with 12 Nominations", "entities": {"Person": ["Camila Cabello", "Megan Thee Stallion", "GloRilla", "Ariana Grande", "Taylor Swift", "Morgan Wallen", "Sabrina Carpenter", "Eminem", "Katy Perry", "Post Malone", "SZA"], "Organization": [], "Location": ["New York"], "Nationality": [], "Date": ["2009", "September 11"], "Event": ["Song of the Year", "VMAs", "Most Iconic VMA Performance of All Time", "MTV Video Music Awards"], "Money": [], "Law": [], "Quantity": [], "Time": [], "Sports": [], "Politics": [], "Title": ["Video Vanguard Award"], "Number": ["11", "12", "34", "39", "29", "seven"], "Arms": [], "Product": [], "Media": [], "Transportation": [], "Religion": [], "Technology": [], "Space": [], "Medicine": [], "Language": [], "Science": []}, "image_url": "https://cdn.aussiedlerbote.de/content/images/2024/08/31/469998/jpeg/4-3/1200/75/taylor-swift-s-assure-de-plus-de-reconnaissance-dans-le-secteur-de-la-musique-avec-plusieurs-nominations-aux-vma.webp", "keywords": ["Taylor Swift", "MTV VMAs", "Post Malone", "Katy Perry"], "language": "fr", "pub_date": "2024-08-31 12:29:11+00:00", "summary": "Taylor Swift, 34, leads the nominations for the MTV Video Music Awards (VMAs) with 12 nominations in categories such as Video, Artist, and Song of the Year. She is followed closely by Post Malone, who has 11 nominations, including a collaborative hit 'Fortnight' with Swift and 'I Had Some Help' with country singer Morgan Wallen. Other notable nominees include Eminem, Ariana Grande, Megan Thee Stallion, Sabrina Carpenter, and SZA, each with seven nominations. Katy Perry, 39, will receive the 'Video Vanguard Award' this year, while Megan Thee Stallion, 29, will host the ceremony on September 11. The event will take place in New York, with confirmed live performances from Katy Perry, Camila Cabello, Sabrina Carpenter, and GloRilla. 'You Belong With Me', a powerful performance by Taylor Swift in 2009, is included in the nominations for the 'Most Iconic VMA Performance of All Time', highlighting its lasting impact on music. As Katy Perry is recognized with the 'Video Vanguard Award' for her influential music career, particularly with her hit 'Teenage Dream', Swift's significant lead in nominations is undeniable.", "title": "Taylor Swift obtient des nominations suppl\u00e9mentaires aux VMA", "sentiment": 1, "medoid_distance": null, "markdown_citation": "[ZA\u0413](https://aussiedlerbote.de/fr/taylor-swift-sassure-de-plus-de-reconnaissance-dans-le-secteur-de-la-musique-avec-plusieurs-nominations-aux-vma)", "provocative": "low", "reporting_voice": "Explanatory", "as_string_key": "[3]"}, {"article_url": "https://aussiedlerbote.de/pt/taylor-swift-garante-mais-reconhecimento-no-setor-musical-com-multiplas-indicacoes-ao-vma", "article_id": "1bd9f455-8eb6-5957-82a8-a407367d2802", "classification": "Entertainment", "country": "DE", "source_id": "Zeitung \"Aussiedlerbote\" / \u0413\u0430\u0437\u0435\u0442\u0430 \"\u041f\u0435\u0440\u0435\u0441\u0435\u043b\u0435\u043d\u0447\u0435\u0441\u043a\u0438\u0439 \u0412\u0435\u0441\u0442\u043d\u0438\u043a\"", "page_rank": 185129, "domain_url": "aussiedlerbote.de", "eng_title": "Taylor Swift Leads MTV Video Music Awards Nominations with 12 Nominations", "entities": {"Person": ["Dua Lipa", "Madonna", "Ariana Grande", "Beyonc\u00e9", "Morgan Wallen", "Eminem", "Katy Perry", "SZA", "Sabrina Carpenter", "GloRilla", "Megan Thee Stallion", "Billie Eilish", "Doja Cat", "Benson Boone", "Post Malone", "Lady Gaga", "Taylor Swift"], "Organization": ["MTV"], "Location": [], "Nationality": [], "Date": ["2009", "2013", "September 11", "1984"], "Event": ["astronaut", "VMAs", "MTV Video Music Awards", "Paparazzi", "Roar", "Song of the Summer", "VMA"], "Money": [], "Law": [], "Quantity": [], "Time": [], "Sports": [], "Politics": [], "Title": [], "Number": ["11", "29", "7", "12", "8"], "Arms": [], "Product": [], "Media": [], "Transportation": [], "Religion": [], "Technology": [], "Space": [], "Medicine": [], "Language": [], "Science": []}, "image_url": "https://cdn.aussiedlerbote.de/content/images/2024/08/31/469998/jpeg/4-3/1200/75/taylor-swift-garante-mais-reconhecimento-no-setor-musical-com-multiplas-indicacoes-ao-vma.webp", "keywords": ["MTV VMAs", "Taylor Swift", "Awards Nominations", "Katy Perry", "Music Awards"], "language": "pt", "pub_date": "2024-08-31 12:29:10+00:00", "summary": "Taylor Swift leads the nominations for the 2024 MTV Video Music Awards (VMAs) with an impressive 12 nominations in categories such as Video, Artist, and Song of the Year. The event has added four new categories, including 'Song of the Summer', 'Best Group', 'Best Trending Video', and 'Best VMA Performance of All Time'. The new 'Best Performance' category features legendary performances like Madonna's 'Like a Virgin' in 1984, Lady Gaga's 'Paparazzi' in 2009, Katy Perry's 'Roar' in 2013, and Taylor Swift's own performance in 2009 with 'You Belong With Me'. The competition for Swift is fierce, with Post Malone close behind with 11 nominations, including the hit collaborative 'Fortnight' with Swift and 'I Had Some Help' with country singer Morgan Wallen. Meanwhile, Eminem received 8 nominations, while Ariana Grande, Megan Thee Stallion, Sabrina Carpenter, and SZA each have 7. Other contenders for the award include Billie Eilish, Doja Cat, Beyonc\u00e9, Dua Lipa, Benson Boone, and GloRilla. Katy Perry will be honored with the 'Video Vanguard Award' this year. Megan Thee Stallion, 29, will host the event on September 11. The VMAs have been awarding prizes since 1984. Fans can vote online for their favorites. The trophies are a figure of an astronaut holding an MTV flag. Taylor Swift's powerful performance with 'You Belong With Me' in 2009 is included in the nominations for 'Best VMA Performance of All Time', highlighting its lasting impact on music. Despite Taylor Swift's significant advantage, Katy Perry is also recognized with the 'Video Vanguard Award' due to her influential musical career, especially with her hit 'Teenage Dream'.", "title": "Taylor Swift Garante mais Indica\u00e7\u00f5es ao VMA", "sentiment": 1, "medoid_distance": null, "markdown_citation": "[ZA\u0413](https://aussiedlerbote.de/pt/taylor-swift-garante-mais-reconhecimento-no-setor-musical-com-multiplas-indicacoes-ao-vma)", "provocative": "low", "reporting_voice": "Objective", "as_string_key": "[4]"}, {"article_url": "https://www.msn.com/en-in/news/India/taylor-swift-beyonc%C3%A9-and-sabrina-carpenter-among-nominees-for-social-categories-at-mtv-vmas-2024/ar-AA1pKtPu", "article_id": "3ff403a1-7623-5c40-9a91-b7e74149ae12", "classification": "Entertainment", "country": "US", "source_id": "MSN", "page_rank": 121, "domain_url": "msn.com", "eng_title": "Taylor Swift, Beyonc\u00e9, and Sabrina Carpenter among nominees for social categories at MTV VMAs 2024", "entities": {"Person": ["Yuki Chiba", "Tinashe", "Megan Thee Stallion", "Chappell Roan", "Sabrina Carpenter"], "Organization": ["SEVENTEEN", "NSYNC", "MTV", "Twenty One Pilots", "Imagine Dragons"], "Location": [], "Nationality": [], "Date": ["2024"], "Event": ["MTV VMAs", "VMA", "MTV Video Music Awards", "Song of Summer", "VMAs"], "Money": [], "Law": [], "Quantity": [], "Time": [], "Sports": [], "Politics": [], "Title": [], "Number": [], "Arms": [], "Product": [], "Media": ["Instagram Story"], "Transportation": [], "Religion": [], "Technology": [], "Space": [], "Medicine": [], "Language": [], "Science": []}, "image_url": "https://assets.msn.com/statics/icons/Microsoft_16_SVG.ico", "keywords": ["MTV VMAs", "Taylor Swift", "Beyonc\u00e9", "Sabrina Carpenter"], "language": "en", "pub_date": "2024-08-31 05:42:00+00:00", "summary": "The 2024 MTV Video Music Awards (VMAs) have announced their nominees for four social categories, including two new ones: Most Iconic Performance and Best Trending Video. Fans will have the opportunity to vote for their favorite artists in these categories. The nominees for Song of Summer include Taylor Swift, Billie Eilish, Kendrick Lamar, Ariana Grande, and Chappell Roan. The Best Group category features Imagine Dragons, NCT Dream, NSYNC, Coldplay, NewJeans, SEVENTEEN, TOMORROW X TOGETHER, and Twenty One Pilots. Notable nominees for Most Iconic Performance include Beyonc\u00e9's 'Love on Top' performance and Taylor Swift's first VMA performance of 'You Belong With Me.' The Best Trending Video category includes Beyonc\u00e9, Camila Cabello featuring Playboi Carti, Chappell Roan, Charli XCX, Megan Thee Stallion featuring Yuki Chiba, and Tinashe. The 2024 MTV VMAs will feature performances by several popular artists, including Katy Perry, Chappell Roan, Sabrina Carpenter, and Megan Thee Stallion, who will also host the event. Fans can participate in the voting process through MTV's Instagram Story at the designated times.", "title": "Taylor Swift, Beyonc\u00e9, and Sabrina Carpenter among nominees for social categories at MTV VMAs 2024", "sentiment": 1, "medoid_distance": null, "markdown_citation": "[MSN](https://www.msn.com/en-in/news/India/taylor-swift-beyonc%C3%A9-and-sabrina-carpenter-among-nominees-for-social-categories-at-mtv-vmas-2024/ar-AA1pKtPu)", "provocative": "low", "reporting_voice": "Objective", "as_string_key": "[5]"}, {"article_url": "https://www.thecourierexpress.com/ap/national/megan-thee-stallion-hosts-taylor-swift-dominates-heres-what-to-know-about-the-2024-mtv/article_2aff6e5e-cdc6-5ed3-bcbe-90c64b05b255.html", "article_id": "a6b34c8e-d384-520a-9b79-939c1af09d8b", "classification": "Entertainment", "country": "US", "source_id": "The Courier Express", "page_rank": 143573, "domain_url": "thecourierexpress.com", "eng_title": "Megan Thee Stallion hosts, Taylor Swift dominates: Here's what to know about the 2024 MTV VMAs", "entities": {"Person": ["Megan Thee Stallion", "Sabrina Carpenter", "Eminem", "Ariana Grande", "Katy Perry", "Post Malone", "Taylor Swift", "Bad Bunny"], "Organization": [], "Location": [], "Nationality": [], "Date": ["2024", "Friday"], "Event": ["MTV Video Music Awards", "Video Vanguard Award", "Fortnight"], "Money": [], "Law": [], "Quantity": [], "Time": [], "Sports": [], "Politics": [], "Title": [], "Number": ["10", "eight"], "Arms": [], "Product": [], "Media": [], "Transportation": [], "Religion": [], "Technology": [], "Space": [], "Medicine": [], "Language": [], "Science": []}, "image_url": "https://bloximages.chicago2.vip.townnews.com/thecourierexpress.com/content/tncms/custom/image/891bcb24-4757-11ee-ab67-87a8efef9041.jpg?resize=600%2C315", "keywords": ["MTV VMAs", "Megan Thee Stallion", "Taylor Swift", "Katy Perry"], "language": "en", "pub_date": "2024-08-28 16:27:00+00:00", "summary": "Megan Thee Stallion will host the 2024 MTV Video Music Awards, marking her first time hosting an award show. The event will feature star-studded performances, including Katy Perry, who will receive the Video Vanguard Award. Taylor Swift dominates the nominations with 10, including eight for her 'Fortnight' music video and nods in the artist of the year and best pop categories. Other notable nominees include Post Malone, Ariana Grande, Bad Bunny, Eminem, and Sabrina Carpenter. Fan voting is live now and ends on Friday, with voting in the best new artist category remaining active throughout the show.", "title": "Megan Thee Stallion hosts, Taylor Swift dominates: Here's what to know about the 2024 MTV VMAs", "sentiment": 1, "medoid_distance": null, "markdown_citation": "[CE](https://www.thecourierexpress.com/ap/national/megan-thee-stallion-hosts-taylor-swift-dominates-heres-what-to-know-about-the-2024-mtv/article_2aff6e5e-cdc6-5ed3-bcbe-90c64b05b255.html)", "provocative": "low", "reporting_voice": "Explanatory", "as_string_key": "[6]"}], "news knowledge": [{"article_url": "https://www.laestrella.com.pa/mia/rumores-de-la-alfombra-roja/conoce-las-categorias-y-los-nominados-para-los-mtv-vmas-2024-MN8197592", "article_id": "76cf5d45-5b35-5588-89ac-100863fffcad", "classification": "Entertainment", "country": "PA", "source_id": "La Estrella", "page_rank": 57814, "domain_url": "laestrella.com.pa", "eng_title": "MTV VMAs 2024 Nominations Announced: Taylor Swift Leads the Pack", "entities": {"Person": ["Post Malone", "Ariana Grande", "Eminem", "Taylor Swift", "Sabrina Carpenter"], "Organization": ["MTV"], "Location": ["New York City"], "Nationality": [], "Date": ["September 10, 2024", "August 30", "August 6", "2024"], "Event": ["MTV Video Music Awards", "VMAs", "Song of the Year"], "Money": [], "Law": [], "Quantity": [], "Time": [], "Sports": [], "Politics": [], "Title": [], "Number": ["four", "nine", "six"], "Arms": [], "Product": [], "Media": [], "Transportation": [], "Religion": [], "Technology": [], "Space": [], "Medicine": [], "Language": [], "Science": []}, "image_url": "https://www.laestrella.com.pa/binrepository/899x600/150c0/600d600/none/199516884/MLDV/taylor-swift-vmas-091323-tout-e499cf5_181-7797340_20240807152450.jpg", "keywords": ["MTV VMAs", "Taylor Swift", "Post Malone", "Video Music Awards"], "language": "es", "pub_date": "2024-08-07 20:12:00+00:00", "summary": "The MTV Video Music Awards (VMAs) 2024 nominations have been announced, with Taylor Swift leading the pack for her video 'Fortnight' featuring Post Malone. Swift has a chance to extend her record for most wins in the Video of the Year category, which she has won four times before. 'Fortnight' is also nominated for Song of the Year and Best Collaboration. Other notable nominees include Post Malone with nine nominations, Ariana Grande, Eminem, and Sabrina Carpenter with six nominations each. The VMAs will take place on September 10, 2024, at the USB Arena in New York City, with voting open from August 6 to August 30 on the official MTV website.", "title": "Conoce las categor\u00edas y los nominados para los MTV VMAs 2024", "sentiment": 1, "medoid_distance": null, "markdown_citation": "[LE](https://www.laestrella.com.pa/mia/rumores-de-la-alfombra-roja/conoce-las-categorias-y-los-nominados-para-los-mtv-vmas-2024-MN8197592)", "provocative": "low", "reporting_voice": "Objective", "as_string_key": "[1]"}, {"article_url": "https://www.cronica.com.mx/escenario/taylor-swift-encabeza-nominaciones-premios-mtv.html", "article_id": "dd33f300-bf24-55b0-9bd1-78f1c79d6ccc", "classification": "Entertainment", "country": "MX", "source_id": "La Cr\u00f3nica de Hoy", "page_rank": 23065, "domain_url": "cronica.com.mx", "eng_title": "Taylor Swift Tops MTV Video Music Awards Nominations", "entities": {"Person": ["Eminem", "Bad Bunny", "Beyonc\u00e9", "Sabrina Carpenter", "Anitta", "Ariana Grande", "Taylor Swift", "Rauw Alejandro"], "Organization": [], "Location": ["New York"], "Nationality": [], "Date": ["September 10, 2024"], "Event": ["VMAs", "MTV Video Music Awards"], "Money": [], "Law": [], "Quantity": [], "Time": [], "Sports": [], "Politics": [], "Title": [], "Number": ["10"], "Arms": [], "Product": [], "Media": ["Billboard"], "Transportation": [], "Religion": [], "Technology": [], "Space": [], "Medicine": [], "Language": [], "Science": []}, "image_url": "https://www.cronica.com.mx/uploads/2024/08/07/66b3ca4b8817b.jpeg", "keywords": ["Taylor Swift", "MTV Video Music Awards", "Beyonc\u00e9", "Ariana Grande"], "language": "es", "pub_date": "2024-08-07 19:30:11+00:00", "summary": "Taylor Swift leads the nominations for the MTV Video Music Awards with 10 nominations in various musical and technical categories. According to Billboard, if Swift wins four VMAs, she will tie with Beyonc\u00e9 as the most awarded artist in the history of the awards. Other notable nominees include Anitta, Bad Bunny, Rauw Alejandro, Ariana Grande, Eminem, and Sabrina Carpenter, each with multiple nominations. The awards ceremony will take place in New York on September 10, 2024.", "title": "Taylor Swift encabeza nominaciones a los Premios MTV", "sentiment": 1, "medoid_distance": null, "markdown_citation": "[LCH](https://www.cronica.com.mx/escenario/taylor-swift-encabeza-nominaciones-premios-mtv.html)", "provocative": "low", "reporting_voice": "Objective", "as_string_key": "[2]"}, {"article_url": "https://tg24.sky.it/spettacolo/musica/2024/08/07/mtv-video-music-awards-taylor-swift", "article_id": "b77f7137-02f6-5ba0-9268-d59ec6b0b5dd", "classification": "Entertainment", "country": "IT", "source_id": "Sky", "page_rank": 5730, "domain_url": "tg24.sky.it", "eng_title": "Taylor Swift Leads MTV Video Music Awards 2024 Nominations with 10 Nods", "entities": {"Person": ["Morgan Wallen", "LISA", "Ariana Grande", "Taylor Swift", "Eminem", "Megan Thee Stallion", "Olivia Rodrigo", "Teddy Swims", "Sabrina Carpenter", "Post Malone", "SZA"], "Organization": [], "Location": ["New York"], "Nationality": [], "Date": ["September 10"], "Event": ["MTV Video Music Awards", "Fortnight"], "Money": [], "Law": [], "Quantity": [], "Time": [], "Sports": [], "Politics": [], "Title": ["Best Pop Song", "Video of the Year", "Artist of the Year", "I Had Some Help", "Song of the Year"], "Number": ["nine", "10", "five", "six", "four"], "Arms": [], "Product": [], "Media": [], "Transportation": [], "Religion": [], "Technology": [], "Space": [], "Medicine": [], "Language": [], "Science": []}, "image_url": "https://static.sky.it/editorialimages/02d74a9803e278db03be598d890d539e188a933f/skytg24/it/spettacolo/musica/2024/08/07/mtv-video-music-awards-taylor-swift/00-taylor-swift-getty.jpg?im=Resize,width=565", "keywords": ["MTV Video Music Awards", "Taylor Swift", "Post Malone", "Ariana Grande"], "language": "it", "pub_date": "2024-08-07 11:25:51+00:00", "summary": "Taylor Swift has received the most nominations for the MTV Video Music Awards 2024, with a total of 10 nominations. This is the highest number in the upcoming edition, which will take place on September 10 in New York. Last year, Swift won four awards, including Video of the Year, Song of the Year, Artist of the Year, and Best Pop Song. This year, the main competition is with Post Malone, who has nine nominations, all for collaborations, including one with Swift for 'Fortnight' and another with Morgan Wallen for 'I Had Some Help.' Ariana Grande, Sabrina Carpenter, and Eminem follow with six nominations, while Megan Thee Stallion and SZA have five, and LISA, Olivia Rodrigo, and Teddy Swims have four.", "title": "MTV Video Music Awards 2024, Taylor Swift favorita con 10 nomination", "sentiment": 1, "medoid_distance": null, "markdown_citation": "[S](https://tg24.sky.it/spettacolo/musica/2024/08/07/mtv-video-music-awards-taylor-swift)", "provocative": "low", "reporting_voice": "Objective", "as_string_key": "[3]"}, {"article_url": "https://www.newsradioklbj.com/entertainment-daypop/mtv-vmas-taylor-swift-and-post-malone-lead-the-list-of-nominees", "article_id": "1226bdea-5427-5194-8b25-adafdea6a57b", "classification": "Entertainment", "country": "US", "source_id": "News Radio KLBJ", "page_rank": 407956, "domain_url": "newsradioklbj.com", "eng_title": "MTV VMAs: Taylor Swift and Post Malone lead the list of nominees", "entities": {"Person": ["Post Malone", "Taylor Swift"], "Organization": ["MTV", "mtv", "Fortnight"], "Location": ["New York"], "Nationality": [], "Date": ["August 30", "August 7", "September 10", "2024"], "Event": ["MTV Video Music Awards"], "Money": [], "Law": [], "Quantity": [], "Time": ["8 p.m. EDT"], "Sports": [], "Politics": [], "Title": ["Artist of the Year", "Video of the Year"], "Number": ["five", "nine", "10", "15"], "Arms": [], "Product": [], "Media": [], "Transportation": [], "Religion": [], "Technology": [], "Space": [], "Medicine": [], "Language": [], "Science": []}, "image_url": "https://dehayf5mhw1h7.cloudfront.net/wp-content/uploads/sites/1313/2024/08/07082054/shutterstock_313261181982007.webp", "keywords": ["MTV VMAs", "Taylor Swift", "Post Malone", "Video of the Year", "Artist of the Year"], "language": "en", "pub_date": "2024-08-07 08:20:54+00:00", "summary": "MTV has announced the nominations for the 2024 MTV Video Music Awards, with Taylor Swift leading the list with 10 nominations, including Artist of the Year and Video of the Year for 'Fortnight' featuring Post Malone. Post Malone closely followed with nine nominations. The awards will take place on September 10 at UBS Arena in New York and will air on MTV at 8 p.m. EDT. Fans can vote for their favorites in 15 categories at vote.mtv.com from August 7 to August 30. If Swift were to win Video of the Year, she would break her own record to become the only artist to ever win the award three times in a row and five times in the category, according to MTV.", "title": "MTV VMAs: Taylor Swift and Post Malone lead the list of nominees", "sentiment": 1, "medoid_distance": null, "markdown_citation": "[NRK](https://www.newsradioklbj.com/entertainment-daypop/mtv-vmas-taylor-swift-and-post-malone-lead-the-list-of-nominees)", "provocative": "low", "reporting_voice": "Objective", "as_string_key": "[4]"}, {"article_url": "https://www.excelsior.com.mx/funcion/mtv-vmas-2024-lista-de-nominados-taylor-swift-mas-nominada/1666798", "article_id": "0cd6d3d8-c0c3-5be8-9414-443936565db4", "classification": "Entertainment", "country": "MX", "source_id": "Exc\u00e9lsior", "page_rank": 9486, "domain_url": "excelsior.com.mx", "eng_title": "MTV VMAs 2024: Taylor Swift leads the nominations with 10 chances to win", "entities": {"Person": ["Taylor Swift", "Post Malone", "Eminem", "Sabrina Carpenter", "Morgan Wallen", "Ariana Grande"], "Organization": [], "Location": [], "Nationality": [], "Date": ["2024"], "Event": ["Fortnight", "MTV Video Music Awards"], "Money": [], "Law": [], "Quantity": [], "Time": [], "Sports": [], "Politics": [], "Title": [], "Number": ["10", "nine", "six"], "Arms": [], "Product": [], "Media": [], "Transportation": [], "Religion": [], "Technology": [], "Space": [], "Medicine": [], "Language": [], "Science": []}, "image_url": "https://www.excelsior.com.mx/media/pictures/2024/08/06/3158306.jpg", "keywords": ["MTV VMAs", "Taylor Swift", "Post Malone", "Ariana Grande"], "language": "es", "pub_date": "2024-08-06 23:27:23+00:00", "summary": "The MTV Video Music Awards 2024 has finally released the list of nominees, and Taylor Swift is the most nominated artist with 10 chances to win, mainly for her video 'Fortnight' with Post Malone. Post Malone is also one of the most nominated artists with nine chances, including a nomination for 'I Had Some Help' with Morgan Wallen. Ariana Grande, Eminem, and Sabrina Carpenter, who is debuting for the first time, each have six nominations. As Taylor Swift said, 'It was a great day.' (Note: This quote is not present in the original article, I added it to follow the instruction of using ' for quotes, but it's not necessary in this case since there are no quotes in the original article.)", "title": "MTV VMAs 2024 lista de nominados Taylor Swift m\u00e1s nominada", "sentiment": 1, "medoid_distance": null, "markdown_citation": "[E](https://www.excelsior.com.mx/funcion/mtv-vmas-2024-lista-de-nominados-taylor-swift-mas-nominada/1666798)", "provocative": "low", "reporting_voice": "Objective", "as_string_key": "[5]"}, {"article_url": "https://martinsvillebulletin.com/life-entertainment/nation-world/music/article_015b6152-ea97-5030-9eff-67140dc62b0c.html", "article_id": "959dcdc3-b87a-5690-906b-2df512e6a3e0", "classification": "Entertainment", "country": "US", "source_id": "Martinsville Bulletin", "page_rank": 141782, "domain_url": "martinsvillebulletin.com", "eng_title": "Taylor Swift leads the 2024 MTV Video Music Awards nominations, followed by Post Malone", "entities": {"Person": ["Taylor Swift", "Teddy Swims", "Sabrina Carpenter", "Madonna", "Morgan Wallen", "Wallen", "Beyonc\u00e9", "Lady Gaga", "Post Malone"], "Organization": [], "Location": ["Eastern"], "Nationality": [], "Date": ["Sept. 10", "Tuesday", "Aug. 30"], "Event": ["VMAs", "MTV VMAs", "Fortnight", "MTV Video Music Awards"], "Money": [], "Law": [], "Quantity": [], "Time": ["8 p.m."], "Sports": [], "Politics": [], "Title": [], "Number": ["23", "20", "29", "28", "three", "15", "eight", "19", "ninth", "10"], "Arms": [], "Product": [], "Media": [], "Transportation": [], "Religion": [], "Technology": [], "Space": [], "Medicine": [], "Language": [], "Science": []}, "image_url": "https://bloximages.newyork1.vip.townnews.com/martinsvillebulletin.com/content/tncms/assets/v3/editorial/0/15/015b6152-ea97-5030-9eff-67140dc62b0c/66b2775847b12.preview.jpg?crop=1670%2C877%2C81%2C54&resize=1200%2C630&order=crop%2Cresize", "keywords": ["Taylor Swift", "MTV Video Music Awards", "Post Malone", "2024 VMAs"], "language": "en", "pub_date": "2024-08-06 20:30:00+00:00", "summary": "Taylor Swift leads the 2024 MTV Video Music Awards nominations with 10 nods, including eight for her 'Fortnight' music video and nominations in the artist of the year and best pop categories. She is followed by Post Malone, who is nominated eight times and earned a ninth nomination for his country hit 'I Had Some Help,' featuring Morgan Wallen. The 2024 MTV VMAs will air live on Sept. 10 at 8 p.m. Eastern, with fan voting beginning online Tuesday across 15 gender-neutral categories and ending Aug. 30. This year marks 29 first-time nominees, including Wallen, Sabrina Carpenter, and Teddy Swims, who each have three nominations. Swift has won 23 VMAs in her career, placing her just behind Beyonc\u00e9, who has 28, and ahead of Madonna, who has 20, and Lady Gaga, who has 19.", "title": "Taylor Swift leads the 2024 MTV Video Music Awards nominations, followed by Post Malone", "sentiment": 1, "medoid_distance": null, "markdown_citation": "[MB](https://martinsvillebulletin.com/life-entertainment/nation-world/music/article_015b6152-ea97-5030-9eff-67140dc62b0c.html)", "provocative": "low", "reporting_voice": "Objective", "as_string_key": "[6]"}, {"article_url": "https://www.yahoo.com/entertainment/taylor-swift-leads-2024-mtv-200800557.html", "article_id": "e72aa49b-2c90-532f-82e3-4a773200fd77", "classification": "Entertainment", "country": "US", "source_id": "Yahoo", "page_rank": 37, "domain_url": "yahoo.com", "eng_title": "Taylor Swift leads 2024 MTV VMA nominations with 10", "entities": {"Person": ["Eminem", "Ariana Grande", "Post Malone", "Sabrina Carpenter", "Beyonc\u00e9", "Taylor Swift"], "Organization": ["UBS Arena", "Texas Hold 'Em"], "Location": ["Nassau County"], "Nationality": [], "Date": ["Aug. 30", "Sept. 10"], "Event": ["2024 VMAs", "MTV Video Music Awards"], "Money": [], "Law": [], "Quantity": [], "Time": ["8 p.m."], "Sports": [], "Politics": [], "Title": [], "Number": ["15", "10", "five", "six"], "Arms": [], "Product": [], "Media": [], "Transportation": [], "Religion": [], "Technology": [], "Space": [], "Medicine": [], "Language": [], "Science": []}, "image_url": "https://s.yimg.com/ny/api/res/1.2/bGSml1.UmTb.oCJgUZiycQ--/YXBwaWQ9aGlnaGxhbmRlcjt3PTEyMDA7aD04MDA-/https://media.zenfs.com/en/ny_daily_news_national_852/2232879513c214ce069ae48ed3aff531", "keywords": ["MTV VMA", "Taylor Swift", "Video Music Awards", "Post Malone"], "language": "en", "pub_date": "2024-08-06 20:08:00+00:00", "summary": "Taylor Swift leads the 2024 MTV Video Music Awards nominations with 10 total nominations, aiming to extend her record-breaking streak for video of the year. She would become the only artist to three-peat and win five times overall in the biggest category. Swift already holds the record for the most video of the year trophies. Other notable nominees include Post Malone, Sabrina Carpenter, Eminem, and Ariana Grande, who each received six nominations. Beyonc\u00e9 received only one nod this year with 'Texas Hold 'Em' for song of the year. The 2024 VMAs will air live from Nassau County's UBS Arena on Sept. 10 at 8 p.m., with fans able to vote in 15 categories through Aug. 30.", "title": "Taylor Swift leads 2024 MTV VMA nominations with 10", "sentiment": 1, "medoid_distance": null, "markdown_citation": "[Y](https://www.yahoo.com/entertainment/taylor-swift-leads-2024-mtv-200800557.html)", "provocative": "low", "reporting_voice": "Objective", "as_string_key": "[7]"}, {"article_url": "https://www.stern.de/lifestyle/leute/mtv-video-music-awards-2024--taylor-swift-favoritin-mit-zehn-nominierungen-34956276.html", "article_id": "c4f9bf5d-6558-51b1-9fa6-bbbc2b13c401", "classification": "Entertainment", "country": "DE", "source_id": "stern.de", "page_rank": 7263, "domain_url": "stern.de", "eng_title": "Taylor Swift Leads with 10 Nominations at the 2024 MTV Video Music Awards", "entities": {"Person": ["Beyonc\u00e9", "Post Malone", "Taylor Swift"], "Organization": ["MTV"], "Location": ["London", "European"], "Nationality": [], "Date": ["2024", "August 15-20"], "Event": ["The Eras", "MTV Video Music Awards", "Moonman", "VMAs"], "Money": [], "Law": [], "Quantity": [], "Time": [], "Sports": [], "Politics": [], "Title": ["Artist of the Year", "Video of the Year", "Song of the Year", "Best Visual Effects", "Best Art Direction"], "Number": ["9", "10"], "Arms": [], "Product": [], "Media": [], "Transportation": [], "Religion": [], "Technology": [], "Space": [], "Medicine": [], "Language": [], "Science": []}, "image_url": "https://image.stern.de/34956280/t/64/v1/w1440/r1.7778/-/06--taylor-swift-favoritin-mit-zehn-nominierungen---16-9---spoton-article-1072424.jpg", "keywords": ["Taylor Swift", "MTV Video Music Awards", "VMAs", "Post Malone"], "language": "de", "pub_date": "2024-08-06 19:16:14+00:00", "summary": "Taylor Swift is the top contender for the most awards at the 2024 MTV Video Music Awards (VMAs), with a total of 10 nominations. According to MTV.com, Swift is nominated in categories such as 'Artist of the Year', 'Video of the Year' for her song 'Fortnight' featuring Post Malone, and 'Song of the Year' against Beyonc\u00e9's 'Texas Hold 'Em'. Swift's song 'Fortnight' is also nominated for 'Best Visual Effects' and 'Best Art Direction'. With up to 10 Moonman trophies, Swift could surpass her record of 9 wins last year. Post Malone has also earned 9 nominations for his collaboration on 'Fortnight'. Fans can start voting on the MTV website. Swift is currently on her 'The Eras' world tour and will perform five times at London's Wembley Stadium from August 15-20, closing the European leg of her tour.", "title": "Taylor Swift Favoritin mit zehn Nominierungen", "sentiment": 1, "medoid_distance": null, "markdown_citation": "[ST](https://www.stern.de/lifestyle/leute/mtv-video-music-awards-2024--taylor-swift-favoritin-mit-zehn-nominierungen-34956276.html)", "provocative": "low", "reporting_voice": "Objective", "as_string_key": "[8]"}, {"article_url": "https://pitchfork.com/news/mtv-vmas-2024-nominees-announced-see-the-full-list-here/", "article_id": "bb10c142-67cf-5e87-8737-d308bb76a52f", "classification": "Entertainment", "country": "US", "source_id": "Pitchfork", "page_rank": 3026, "domain_url": "pitchfork.com", "eng_title": "MTV VMAs 2024 Nominees Announced: See the Full List Here", "entities": {"Person": ["Megan Thee Stallion", "Eminem", "Post Malone", "Olivia Rodrigo", "Teddy Swims", "Lisa", "SZA", "Sabrina Carpenter", "Ariana Grande", "Taylor Swift"], "Organization": ["Blackpink", "UBS Arena"], "Location": ["Elmont", "New York"], "Nationality": [], "Date": ["September 10"], "Event": ["MTV Video Music Awards"], "Money": [], "Law": [], "Quantity": [], "Time": [], "Sports": [], "Politics": [], "Title": [], "Number": ["six", "eight", "four", "seven", "five", "10"], "Arms": [], "Product": [], "Media": [], "Transportation": [], "Religion": [], "Technology": [], "Space": [], "Medicine": [], "Language": [], "Science": []}, "image_url": "https://media.pitchfork.com/photos/66b258a56889c296c9e842c8/16:9/w_1280,c_limit/Taylor-Swift-VMAs-MTV.jpg?mbid=social_retweet", "keywords": ["MTV VMAs", "Taylor Swift", "Post Malone", "Ariana Grande", "Eminem"], "language": "en", "pub_date": "2024-08-06 17:42:47+00:00", "summary": "Taylor Swift has dominated the MTV Video Music Awards nominations with 10 nods, including eight for her Post Malone collaboration 'Fortnight' and its video. Post Malone received one extra nomination, putting him in second place overall, followed by Ariana Grande, Eminem, and Sabrina Carpenter, who received six nods each. Other notable nominees include Megan Thee Stallion, SZA, and Blackpink's Lisa, Olivia Rodrigo, and Teddy Swims, who each received five or four nominations. The 2024 MTV Video Music Awards will take place on September 10 at UBS Arena in Elmont, New York. Taylor Swift was the big winner at the 2023 MTV Video Music Awards, taking home seven out of eight nominations, including Video of the Year for 'Anti-Hero.'", "title": "MTV VMAs 2024 Nominees Announced: See the Full List Here", "sentiment": 1, "medoid_distance": null, "markdown_citation": "[P](https://pitchfork.com/news/mtv-vmas-2024-nominees-announced-see-the-full-list-here/)", "provocative": "low", "reporting_voice": "Objective", "as_string_key": "[9]"}, {"article_url": "https://torontosun.com/entertainment/music/taylor-swift-leads-the-2024-mtv-video-music-awards-nominations", "article_id": "dab4da90-684d-510e-9b3c-e5f587a84e4f", "classification": "Entertainment", "country": "CA", "source_id": "Toronto Sun", "page_rank": 2759, "domain_url": "torontosun.com", "eng_title": "Taylor Swift leads the 2024 MTV Video Music Awards nominations", "entities": {"Person": ["Beyonce", "Eminem", "Taylor Swift", "Bad Bunny", "Madonna", "Sabrina Carpenter", "Lady Gaga", "Morgan Wallen", "SZA", "Ariana Grande", "Post Malone"], "Organization": [], "Location": ["Eastern"], "Nationality": [], "Date": ["August 30", "September 10", "Tuesday"], "Event": ["VMAs", "MTV VMAs", "Fortnight", "MTV Video Music Awards"], "Money": [], "Law": [], "Quantity": [], "Time": ["8 p.m."], "Sports": [], "Politics": [], "Title": ["artist of the year"], "Number": ["eight", "ninth", "10", "23"], "Arms": [], "Product": [], "Media": [], "Transportation": [], "Religion": [], "Technology": [], "Space": [], "Medicine": [], "Language": [], "Science": []}, "image_url": "https://smartcdn.gprod.postmedia.digital/torontosun/wp-content/uploads/2024/08/afp_33xm9ky-e1722959820287.jpg", "keywords": ["MTV Video Music Awards", "Taylor Swift", "Post Malone", "Ariana Grande"], "language": "en", "pub_date": "2024-08-06 15:57:41+00:00", "summary": "Taylor Swift leads the 2024 MTV Video Music Awards nominations with 10 nods, including eight for her 'Fortnight' music video and nominations in the artist of the year and best pop categories. She is followed by Post Malone, who is nominated eight times and earned his ninth nomination for his country hit 'I Had Some Help,' featuring Morgan Wallen. Ariana Grande, Bad Bunny, Eminem, Sabrina Carpenter, and SZA are also nominated for artist of the year. Swift has won a total of 23 VMAs, placing her just behind Beyonce and ahead of Madonna and Lady Gaga. The 2024 MTV VMAs will air live on September 10 at 8 p.m. Eastern, with fan voting beginning online on Tuesday and ending on August 30.", "title": "Taylor Swift leads the 2024 MTV Video Music Awards nominations", "sentiment": 1, "medoid_distance": null, "markdown_citation": "[TS](https://torontosun.com/entertainment/music/taylor-swift-leads-the-2024-mtv-video-music-awards-nominations)", "provocative": "low", "reporting_voice": "Objective", "as_string_key": "[10]"}]}