{"latest news": [{"article_url": "https://www.investing.com/news/company-news/morgan-stanley-keeps-tesla-stock-target-overweight-rating-on-energy-growth-93CH-3621749", "article_id": "29d623d0-1c77-5f98-9f0c-7b2e86fb0979", "classification": "Finance", "country": "ES", "source_id": "Investing.com", "page_rank": 1314, "domain_url": "investing.com", "eng_title": "Morgan Stanley keeps Tesla stock target, overweight rating on energy growth", "entities": {"Person": [], "Organization": ["Ford", "Tesla", "NYSE", "PP&E", "TSLA", "NASDAQ", "Morgan Stanley"], "Location": [], "Nationality": [], "Date": ["second quarter of 2024", "2030"], "Event": [], "Money": ["$310.00", "$2.5 billion"], "Law": [], "Quantity": ["2.5 billion tonnes"], "Time": ["three months"], "Sports": [], "Politics": [], "Title": [], "Number": [], "Arms": [], "Product": ["Zero Emission Vehicle", "ZEV"], "Media": [], "Transportation": [], "Religion": [], "Technology": ["CO2", "AI"], "Space": [], "Medicine": [], "Language": [], "Science": []}, "image_url": "https://i-invdn-com.investing.com/redesign/images/seo/investing_300X300.png", "keywords": ["Tesla", "Morgan Stanley", "Energy Growth", "Data Centers"], "language": "en", "pub_date": "2024-09-18 16:55:25+00:00", "summary": "Morgan Stanley has maintained its Overweight rating on Tesla (NASDAQ:TSLA) shares with a price target of $310.00, citing the potential indirect benefits to Tesla's energy segment from rising greenhouse gas emissions from global data centers. The firm's analysis suggests that emissions from data centers are expected to grow significantly, with an estimated increase of around 2.5 billion tonnes by 2030. Morgan Stanley points out the irony in the situation where automakers like Ford (NYSE:F) are purchasing Zero Emission Vehicle (ZEV) credits to comply with global CO2 emissions standards, which may end up funding Tesla's expansion of energy-intensive AI data centers. Tesla's AI infrastructure had a reported value of $2.5 billion within its property, plant, and equipment (PP&E) at the end of the second quarter of 2024, marking a 65% increase year-over-year. The company's stock price has shown resilience and potential for growth despite the complexities of the automotive and tech industries' transition to lower-emission technologies, with a 23.27% price total return over the last three months.", "title": "Morgan Stanley keeps Tesla stock target, overweight rating on energy growth", "sentiment": 1, "medoid_distance": null, "markdown_citation": "[I](https://www.investing.com/news/company-news/morgan-stanley-keeps-tesla-stock-target-overweight-rating-on-energy-growth-93CH-3621749)", "provocative": "low", "reporting_voice": "Analytical", "entity_relation_graph": null, "as_string_key": "[1]"}, {"article_url": "https://www.finanztrends.de/tesla-aktie-bernstein-schock", "article_id": "a5b84acb-8082-5e5d-bf6b-9f7ab7a0c697", "classification": "Finance", "country": "DE", "source_id": "Finanztrends.de", "page_rank": 468127, "domain_url": "finanztrends.de", "eng_title": "Tesla Stock Price Reaches 200 Euro, But Bernstein Remains Skeptical", "entities": {"Person": [], "Organization": ["Bernstein", "Tesla"], "Location": [], "Nationality": [], "Date": [], "Event": [], "Money": ["200 Euro", "360 Billion Dollars", "120 Dollars"], "Law": [], "Quantity": [], "Time": [], "Sports": [], "Politics": [], "Title": [], "Number": ["118"], "Arms": [], "Product": [], "Media": [], "Transportation": [], "Religion": [], "Technology": [], "Space": [], "Medicine": [], "Language": [], "Science": []}, "image_url": "https://www.finanztrends.de/wp-content/uploads/2024/09/Tesla-ISIN-2024-09-18-16-55-13.png", "keywords": ["Tesla", "Stock Price", "Bernstein", "Rating", "Price Target"], "language": "de", "pub_date": "2024-09-18 14:55:10+00:00", "summary": "Tesla's stock price has surpassed the 200 Euro mark, reaching 206.50 Euros. However, the company is not immune to negative news. Bernstein has downgraded its rating to 'underperform' and set a price target of 120 Dollars, which would result in a 50% loss for the stock. Bernstein analysts believe the company's value is around 360 Billion Dollars, citing the high price-to-earnings ratio of 118. Analysts are more optimistic, seeing the trend as weak but improving. As Bernstein analyst said, 'the trend is still too weak'.", "title": "Tesla-Aktie: Der Bernstein-Schock!", "sentiment": -1, "medoid_distance": null, "markdown_citation": "[F](https://www.finanztrends.de/tesla-aktie-bernstein-schock)", "provocative": "medium", "reporting_voice": "Investigative", "entity_relation_graph": null, "as_string_key": "[2]"}, {"article_url": "https://finance.yahoo.com/news/tesla-tsla-exceeds-market-returns-214520833.html", "article_id": "d2efa3c2-9f45-5e50-b3f4-31fa91edff38", "classification": "Finance", "country": "US", "source_id": "Yahoo! Finance", "page_rank": 258, "domain_url": "finance.yahoo.com", "eng_title": "Tesla (TSLA) Exceeds Market Returns: Some Facts to Consider", "entities": {"Person": [], "Organization": ["Tesla", "Dow", "TSLA", "Zacks", "S&P 500", "Auto-Tires-Trucks"], "Location": [], "Nationality": [], "Date": [], "Event": [], "Money": ["$25.73 billion", "$2.27", "$0.58", "$227.87", "$98.9 billion"], "Law": [], "Quantity": ["99.9"], "Time": [], "Sports": [], "Politics": [], "Title": [], "Number": ["#1"], "Arms": [], "Product": [], "Media": [], "Transportation": ["Automotive - Domestic"], "Religion": [], "Technology": [], "Space": [], "Medicine": [], "Language": [], "Science": []}, "image_url": "https://media.zenfs.com/en/zacks.com/03fca48475577988aa4e0db94f484b4e", "keywords": ["Tesla", "Stock Market", "S&P 500", "Dow", "Earnings", "Revenue"], "language": "en", "pub_date": "2024-09-17 23:23:38+00:00", "summary": "Tesla (TSLA) closed at $227.87, a 0.48% increase from the previous day's close. This outpaced the S&P 500's 0.03% gain and the Dow's 0.04% loss. Over the past month, Tesla's shares have gained 1.82%, lagging the Auto-Tires-Trucks sector's 1.96% gain but outpacing the S&P 500's 1.54% gain. Analysts expect Tesla to report earnings of $0.58 per share, a 12.12% year-over-year decline, and revenue of $25.73 billion, a 10.18% increase from the previous year. The Zacks Consensus Estimates forecast earnings of $2.27 per share and revenue of $98.9 billion for the entire year, indicating changes of -27.24% and +2.19%, respectively. The Zacks Rank system, which takes estimate changes into account, has a track record of outperforming, with stocks rated #1 producing an average annual return of +25%. Tesla currently has a Zacks Rank of #3 (Hold) and a Forward P/E ratio of 99.9, which is a premium compared to its industry. The PEG ratio is 4.62, higher than the average PEG ratio for the Automotive - Domestic industry.", "title": "Tesla (TSLA) Exceeds Market Returns: Some Facts to Consider", "sentiment": 0, "medoid_distance": null, "markdown_citation": "[YF](https://finance.yahoo.com/news/tesla-tsla-exceeds-market-returns-214520833.html)", "provocative": "low", "reporting_voice": "Objective", "entity_relation_graph": null, "as_string_key": "[3]"}, {"article_url": "https://finance.yahoo.com/news/tsla-amd-pltr-growth-stock-225646628.html", "article_id": "70165075-c163-549d-939b-4c8846c3cb7d", "classification": "Finance", "country": "US", "source_id": "Yahoo! Finance", "page_rank": 258, "domain_url": "finance.yahoo.com", "eng_title": "TSLA, AMD, or PLTR: Which Growth Stock Is the Best Pick?", "entities": {"Person": [], "Organization": ["Wall Street", "Tesla", "PLTR", "AMD", "Palantir", "Advanced Micro Devices", "Nvidia", "TSLA"], "Location": [], "Nationality": [], "Date": ["2022"], "Event": [], "Money": ["$208.98", "$190.25", "$27.08"], "Law": [], "Quantity": [], "Time": [], "Sports": [], "Politics": [], "Title": [], "Number": [], "Arms": [], "Product": ["Artificial Intelligence Platform", "AIP", "MI300X"], "Media": [], "Transportation": [], "Religion": [], "Technology": ["EV", "AI"], "Space": [], "Medicine": [], "Language": [], "Science": []}, "image_url": "https://media.zenfs.com/en/tipranks_452/f728d6945484c43ff762f387f5ea95e6", "keywords": ["Tesla", "AMD", "Palantir", "Growth Stock", "Artificial Intelligence"], "language": "en", "pub_date": "2024-09-17 23:04:26+00:00", "summary": "Wall Street analysts have compared Tesla (TSLA), Advanced Micro Devices (AMD), and Palantir (PLTR) to determine the best growth stock. Tesla has seen a 5% increase in shares over the past month but is still down 9% year-to-date due to slowing EV demand and rising competition. AMD has risen only 3.2% in 2022 compared to Nvidia's 136% rally, but analysts are optimistic about AMD's ability to capture generative AI demand with its MI300X AI chip. Palantir has rallied 111% driven by solid financials and optimism about its Artificial Intelligence Platform (AIP). Analysts are highly bullish about AMD stock, but sidelined on Tesla and Palantir stocks. The average AMD stock price target is $190.25, implying 25.1% upside potential, while the average TSLA and PLTR stock price targets are $208.98 and $27.08 respectively, indicating possible down sides of 8% and 25.4%.", "title": "TSLA, AMD, or PLTR: Which Growth Stock Is the Best Pick?", "sentiment": 0, "medoid_distance": null, "markdown_citation": "[YF](https://finance.yahoo.com/news/tsla-amd-pltr-growth-stock-225646628.html)", "provocative": "medium", "reporting_voice": "Analytical", "entity_relation_graph": null, "as_string_key": "[4]"}, {"article_url": "https://www.nasdaq.com/articles/why-tesla-stock-worth-295-according-wall-streets-newest-bull", "article_id": "f20066fc-b1f1-533c-8926-de3f938714fa", "classification": "Finance", "country": "US", "source_id": "NASDAQ Stock Market", "page_rank": 744, "domain_url": "nasdaq.com", "eng_title": "Why Tesla Stock is Worth $295, According to Wall Street's Newest Bull", "entities": {"Person": ["Edison Yu"], "Organization": ["Tesla", "Deutsche Bank"], "Location": [], "Nationality": [], "Date": ["2025", "2010", "Oct. 10", "Q3 of 2024"], "Event": [], "Money": ["$295", "$13 billion"], "Law": [], "Quantity": [], "Time": [], "Sports": [], "Politics": [], "Title": ["Analyst"], "Number": [], "Arms": [], "Product": [], "Media": [], "Transportation": ["robotaxi"], "Religion": [], "Technology": ["technology platform"], "Space": [], "Medicine": [], "Language": [], "Science": []}, "image_url": "https://www.nasdaq.com/sites/acquia.prod/files/barchart/Elon%2520Musk%252C%2520founder%252C%2520CEO%252C%2520and%2520chief%2520engineer%2520of%2520SpaceX%252C%2520CEO%2520of%2520Tesla%2520by%2520Frederic%2520Legrand%2520-%2520COMEO%2520via%2520Shutterstock.jpg", "keywords": ["Tesla", "Stock Price", "Deutsche Bank", "Battery Storage"], "language": "en", "pub_date": "2024-09-17 17:41:00+00:00", "summary": "Tesla's stock has underperformed the broader markets in the last three years, but has still returned more than 14,000% to shareholders since going public in 2010. Despite slower growth, falling margins, and a challenging macro environment, Deutsche Bank is bullish on Tesla, rating it a 'buy' with a target price of $295. Analyst Edison Yu believes Tesla should be valued as a technology platform, not just an automaker, and is particularly bullish on its battery storage business, which could generate $13 billion in sales by 2025. Tesla is also expected to report double-digit vehicle delivery growth in China in Q3 of 2024 and is on track to unveil its robotaxi on Oct. 10, which could disrupt the multi-billion-dollar ride-hailing market.", "title": "Why Tesla Stock is Worth $295, According to Wall Street's Newest Bull", "sentiment": 1, "medoid_distance": null, "markdown_citation": "[NAS](https://www.nasdaq.com/articles/why-tesla-stock-worth-295-according-wall-streets-newest-bull)", "provocative": "medium", "reporting_voice": "Analytical", "entity_relation_graph": null, "as_string_key": "[5]"}, {"article_url": "https://www.thelincolnianonline.com/2024/09/17/tesla-nasdaqtsla-trading-2-3-higher.html", "article_id": "bc8f7905-9246-5344-b166-191fed3854a6", "classification": "Finance", "country": "US", "source_id": "The Lincolnian", "page_rank": 999999, "domain_url": "thelincolnianonline.com", "eng_title": "Tesla (NASDAQ:TSLA) Trading 2.3% Higher", "entities": {"Person": ["Xiaotong Zhu", "Robyn M. Denholm"], "Organization": ["Atalanta Sosnoff Capital LLC", "NASDAQ", "Tesla, Inc.", "TSLA", "Newbridge Financial Services Group Inc.", "Tesla"], "Location": [], "Nationality": [], "Date": ["Tuesday", "July 25th", "September 6th"], "Event": [], "Money": ["$231.99", "$234.57", "$25.50 billion", "$725.16 billion", "$24.38 billion", "$209.60"], "Law": [], "Quantity": ["2.29", "59.18"], "Time": ["fourth quarter"], "Sports": [], "Politics": [], "Title": ["SVP", "Director"], "Number": ["13", "297", "17", "9", "66,364"], "Arms": [], "Product": [], "Media": [], "Transportation": [], "Religion": [], "Technology": [], "Space": [], "Medicine": [], "Language": [], "Science": []}, "image_url": "https://www.americanbankingnews.com/wp-content/timthumb/timthumb.php?src=https://www.marketbeat.com/logos/tesla-inc-logo-1200x675.png?v=20221020135629&w=240&h=240&zc=2", "keywords": ["Tesla", "NASDAQ", "Stock Price", "Market Capitalization"], "language": "en", "pub_date": "2024-09-17 16:30:45+00:00", "summary": "Tesla, Inc. (NASDAQ:TSLA) shares traded 2.3% higher during mid-day trading on Tuesday, reaching a high of $234.57 and closing at $231.99. The company's market capitalization is $725.16 billion, with a price-to-earnings ratio of 59.18 and a beta of 2.29. Analysts have set a consensus target price of $209.60, with 9 rating the stock 'sell', 17 rating it 'hold', and 13 rating it 'buy'. The company's revenue for the quarter was $25.50 billion, missing analysts' expectations of $24.38 billion. Tesla's return on equity is 10.41% and its net margin is 13.00%. Insider selling has been reported, with SVP Xiaotong Zhu selling 297 shares on September 6th and Director Robyn M. Denholm selling 66,364 shares on July 25th. Institutional investors have also been active, with Atalanta Sosnoff Capital LLC increasing its stake in Tesla by 3.7% in the fourth quarter and Newbridge Financial Services Group Inc. lifting its holdings in shares of Tesla by 7.4% during the same period.", "title": "Tesla (NASDAQ:TSLA) Trading 2.3% Higher", "sentiment": 0, "medoid_distance": null, "markdown_citation": "[L](https://www.thelincolnianonline.com/2024/09/17/tesla-nasdaqtsla-trading-2-3-higher.html)", "provocative": "low", "reporting_voice": "Objective", "entity_relation_graph": null, "as_string_key": "[6]"}, {"article_url": "https://www.themarketsdaily.com/2024/09/17/monetta-financial-services-inc-purchases-new-position-in-tesla-inc-nasdaqtsla.html", "article_id": "0367dcb9-43a4-5495-b2b0-de50b1155c21", "classification": "Finance", "country": "US", "source_id": "The Markets Daily", "page_rank": 999999, "domain_url": "themarketsdaily.com", "eng_title": "Monetta Financial Services Inc. Purchases New Position in Tesla, Inc. (NASDAQ:TSLA)", "entities": {"Person": ["Robyn M. Denholm", "Xiaotong Zhu"], "Organization": ["Tesla, Inc.", "Monetta Financial Services Inc.", "NASDAQ", "Strategic Financial Concepts LLC", "Vanguard Group Inc.", "Tesla"], "Location": [], "Nationality": [], "Date": ["Thursday", "September 6th", "Friday", "July 25th", "September 2024"], "Event": [], "Money": ["$723.25 billion", "$209.60", "$890,000"], "Law": [], "Quantity": ["4,500", "66,364", "57.85", "Hold"], "Time": [], "Sports": [], "Politics": [], "Title": ["SVP", "Director"], "Number": ["297"], "Arms": [], "Product": ["TSLA"], "Media": [], "Transportation": [], "Religion": [], "Technology": [], "Space": [], "Medicine": [], "Language": [], "Science": []}, "image_url": "https://www.americanbankingnews.com/wp-content/timthumb/timthumb.php?src=https://www.marketbeat.com/logos/tesla-inc-logo-1200x675.png?v=20221020135629&w=240&h=240&zc=2", "keywords": ["Tesla", "Monetta Financial Services", "NASDAQ:TSLA", "Robyn M. Denholm", "Xiaotong Zhu"], "language": "en", "pub_date": "2024-09-17 16:06:56+00:00", "summary": "Monetta Financial Services Inc. has acquired a new position in Tesla, Inc. (NASDAQ:TSLA) with 4,500 shares valued at approximately $890,000. Other institutional investors and hedge funds have also modified their holdings of the stock, with Strategic Financial Concepts LLC increasing its position by 21,816.0% and Vanguard Group Inc. increasing its stake by 1.7%. As of September 2024, 66.20% of the stock is owned by hedge funds and other institutional investors. The stock has a market cap of $723.25 billion and a P/E ratio of 57.85. Analysts have given the stock a consensus rating of 'Hold' with a consensus target price of $209.60. In other news, Tesla's Director Robyn M. Denholm sold 66,364 shares of the firm's stock in a transaction dated Thursday, July 25th, and SVP Xiaotong Zhu sold 297 shares of the stock in a transaction on Friday, September 6th.", "title": "Monetta Financial Services Inc. Purchases New Position in Tesla, Inc. (NASDAQ:TSLA)", "sentiment": 0, "medoid_distance": null, "markdown_citation": "[MD](https://www.themarketsdaily.com/2024/09/17/monetta-financial-services-inc-purchases-new-position-in-tesla-inc-nasdaqtsla.html)", "provocative": "low", "reporting_voice": "Objective", "entity_relation_graph": null, "as_string_key": "[7]"}, {"article_url": "https://www.benzinga.com/markets/equities/24/09/40890441/intel-microsoft-meta-platforms-pfizer-tesla-why-these-5-stocks-are-on-investors-radars-today", "article_id": "4a6df873-3be5-5c5b-8bcc-3c43e6f61e34", "classification": "Finance", "country": "US", "source_id": "Benzinga", "page_rank": 1951, "domain_url": "benzinga.com", "eng_title": "Intel, Microsoft, Meta Platforms, Pfizer, Tesla: Why These 5 Stocks Are On Investors' Radars Today", "entities": {"Person": [], "Organization": ["Pfizer", "Microsoft", "Intel", "Tesla", "Facebook", "Meta Platforms"], "Location": ["Florida", "U.S."], "Nationality": [], "Date": ["Monday", "July"], "Event": [], "Money": ["$60 billion", "$431.34", "$30.07", "$0.83", "$226.74", "$3 billion", "$20.91", "$533.28"], "Law": [], "Quantity": [], "Time": [], "Sports": [], "Politics": [], "Title": [], "Number": [], "Arms": [], "Product": ["AI", "semiconductors"], "Media": ["Instagram"], "Transportation": [], "Religion": [], "Technology": [], "Space": [], "Medicine": ["mRNA vaccines"], "Language": [], "Science": []}, "image_url": "https://cdn.benzinga.com/files/images/story/2024/09/16/Stocks-Photo-by-Phongphan-on-Shutterstoc_0.jpeg?width=1200&height=800&fit=crop", "keywords": ["Intel", "Microsoft", "Meta Platforms", "Pfizer", "Tesla"], "language": "en", "pub_date": "2024-09-17 02:50:27+00:00", "summary": "On Monday, major U.S. indices showed mixed results. Intel shares surged by 6.36% to close at $20.91, after reports that the company could receive up to $3 billion in federal funding to produce semiconductors for U.S. military applications. Microsoft shares saw a slight increase of 0.17% to close at $431.34, after announcing a new share repurchase program worth up to $60 billion and declaring a quarterly dividend of $0.83 per share. Meta Platforms shares rose by 1.75% to close at $533.28, after deciding to use U.K. Facebook and Instagram posts to train its AI systems. Pfizer shares increased by 2.73% to close at $30.07, despite concerns from Florida about the safety of mRNA vaccines. Tesla shares dropped by 1.54% to close at $226.74, after electric vehicle registrations in July in the U.S. marked an 18% increase compared to the same month last year.", "title": "Intel, Microsoft, Meta Platforms, Pfizer, Tesla: Why These 5 Stocks Are On Investors' Radars Today", "sentiment": 0, "medoid_distance": null, "markdown_citation": "[B](https://www.benzinga.com/markets/equities/24/09/40890441/intel-microsoft-meta-platforms-pfizer-tesla-why-these-5-stocks-are-on-investors-radars-today)", "provocative": "low", "reporting_voice": "Objective", "entity_relation_graph": null, "as_string_key": "[9]"}, {"article_url": "https://www.nasdaq.com/articles/us-stocks-close-mixed-ahead-fed-policy-meeting-dow-hits-new-record-high", "article_id": "f4f55d9f-ca4b-53e0-9b23-7bd84da764dd", "classification": "Finance", "country": "US", "source_id": "Nasdaq", "page_rank": 740, "domain_url": "nasdaq.com", "eng_title": "U.S. Stocks Close Mixed Ahead Of Fed Policy Meeting; Dow Hits New Record High", "entities": {"Person": [], "Organization": ["Nasdaq", "Tesla", "Dow", "Adobe Inc.", "S&P 500", "Cisco Systems", "Federal Reserve", "Accenture", "Oracle Corporation", "Broadcom", "Meta Platforms"], "Location": [], "Nationality": [], "Date": ["September", "Monday", "August"], "Event": [], "Money": [], "Law": [], "Quantity": ["41,622.08", "7.07 points", "4.7", "11.5", "17,592.13", "5,633.09", "91.85 points", "228.30 points"], "Time": [], "Sports": [], "Politics": [], "Title": [], "Number": [], "Arms": [], "Product": [], "Media": [], "Transportation": [], "Religion": [], "Technology": [], "Space": [], "Medicine": [], "Language": [], "Science": []}, "image_url": "https://www.nasdaq.com/sites/acquia.prod/files/2019-05/0902-Q19%20Total%20Markets%20photos%20and%20gif_CC8.jpg", "keywords": ["Federal Reserve", "Dow", "Stock Market", "Oracle Corporation"], "language": "en", "pub_date": "2024-09-16 20:31:00+00:00", "summary": "U.S. stocks closed mixed on Monday as investors awaited the Federal Reserve's monetary policy announcement later this week. The Dow hit a new record high, closing up 228.30 points or 0.55 percent at 41,622.08, while the Nasdaq closed lower by 91.85 points or 0.52 percent at 17,592.13. The S&P 500 settled at 5,633.09 with a small gain of 7.07 points or 0.13 percent. Oracle Corporation climbed more than 5 percent, and several other stocks such as Meta Platforms, Accenture, and Cisco Systems also closed notably higher. On the other hand, Tesla, Broadcom, and Adobe Inc. ended with sharp to moderate losses. The Federal Reserve Bank of New York released a report showing regional manufacturing grew for the first time in nearly a year in the month of September, with the general business conditions index surging to a positive 11.5 from a negative 4.7 in August.", "title": "U.S. Stocks Close Mixed Ahead Of Fed Policy Meeting; Dow Hits New Record High", "sentiment": 0, "medoid_distance": null, "markdown_citation": "[N](https://www.nasdaq.com/articles/us-stocks-close-mixed-ahead-fed-policy-meeting-dow-hits-new-record-high)", "provocative": "low", "reporting_voice": "Objective", "entity_relation_graph": null, "as_string_key": "[10]"}], "news knowledge": [{"article_url": "https://www.themarketsdaily.com/2024/09/15/tesla-nasdaqtsla-shares-down-0-5.html", "article_id": "fdc12ffd-444e-5a92-ae90-9a3f7104c262", "classification": "Finance", "country": "US", "source_id": "The Markets Daily", "page_rank": 999999, "domain_url": "themarketsdaily.com", "eng_title": "Tesla (NASDAQ:TSLA)  Shares Down 0.5%", "entities": {"Person": ["Xiaotong Zhu", "Robyn M. Denholm"], "Organization": ["TD Cowen", "TSLA", "NASDAQ", "FIDELIS iM LLC", "New Street Research", "HSBC", "Tesla"], "Location": [], "Nationality": [], "Date": ["Friday"], "Event": [], "Money": ["$228.73", "$226.32", "$0.52", "$225.00", "$180.00", "$0.62", "$160.00"], "Law": [], "Quantity": ["66,364"], "Time": [], "Sports": [], "Politics": [], "Title": ["Director", "SVP"], "Number": ["297"], "Arms": [], "Product": [], "Media": [], "Transportation": [], "Religion": [], "Technology": [], "Space": [], "Medicine": [], "Language": [], "Science": []}, "image_url": "https://www.americanbankingnews.com/wp-content/timthumb/timthumb.php?src=https://www.marketbeat.com/logos/tesla-inc-logo-1200x675.png?v=20221020135629&w=240&h=240&zc=2", "keywords": ["Tesla", "Stock Market", "NASDAQ", "Analysts", "Revenue"], "language": "en", "pub_date": "2024-09-15 10:00:51+00:00", "summary": "Tesla's (NASDAQ:TSLA) shares declined by 0.5% on Friday, trading as low as $226.32 and closing at $228.73. Analysts have downgraded the stock, with New Street Research changing its rating from 'buy' to 'neutral' with a target price of $225.00. Other analysts, such as TD Cowen and HSBC, have also adjusted their price targets, with TD Cowen increasing its target from $160.00 to $180.00. Despite this, the company's revenue was up 2.3% compared to the same quarter last year, with the company earning $0.52 EPS, missing analysts' consensus estimates of $0.62. In other news, Director Robyn M. Denholm sold 66,364 shares of Tesla stock, and SVP Xiaotong Zhu sold 297 shares. Company insiders own 25.10% of the company's stock, and hedge funds have made changes to their positions in the stock, with FIDELIS iM LLC buying a new position in shares of Tesla.", "title": "Tesla (NASDAQ:TSLA)  Shares Down 0.5%", "sentiment": -1, "medoid_distance": null, "markdown_citation": "[MD](https://www.themarketsdaily.com/2024/09/15/tesla-nasdaqtsla-shares-down-0-5.html)", "provocative": "low", "reporting_voice": "Objective", "entity_relation_graph": null, "as_string_key": "[1]"}, {"article_url": "https://reporter.am/2024/09/09/tesla-nasdaqtsla-trading-2-6-higher.html", "article_id": "453b8e94-732c-5e48-b8b5-fdb8f625cdc5", "classification": "Finance", "country": "AM", "source_id": "Amber Hunt", "page_rank": 381717, "domain_url": "reporter.am", "eng_title": "Tesla (NASDAQ:TSLA) Trading 2.6% Higher", "entities": {"Person": ["Robyn M. Denholm"], "Organization": ["Argus", "Tesla", "Guggenheim", "TSLA", "NASDAQ"], "Location": [], "Nationality": [], "Date": ["Monday"], "Event": [], "Money": ["$14,597,425.44", "$204.21", "$286.00", "$134.00", "$0.52", "$216.20", "$0.62", "$219.87"], "Law": [], "Quantity": ["66,364"], "Time": [], "Sports": [], "Politics": [], "Title": ["Director"], "Number": [], "Arms": [], "Product": [], "Media": [], "Transportation": [], "Religion": [], "Technology": [], "Space": [], "Medicine": [], "Language": [], "Science": []}, "image_url": "https://www.americanbankingnews.com/wp-content/timthumb/timthumb.php?src=https://www.marketbeat.com/logos/tesla-inc-logo-1200x675.png?v=20221020135629&w=240&h=240&zc=2", "keywords": ["Tesla", "NASDAQ", "Stock Price", "Earnings Report"], "language": "en", "pub_date": "2024-09-09 21:03:07+00:00", "summary": "Shares of Tesla, Inc. (NASDAQ:TSLA) rose 2.6% on Monday, reaching a high of $219.87 and closing at $216.20. Several analysts have commented on the stock, with Guggenheim reiterating a 'sell' rating and setting a $134.00 price target, while Argus restated a 'buy' rating and set a $286.00 target price. The consensus rating is 'Hold' with a target price of $204.21. In its latest quarterly earnings report, Tesla missed the consensus estimate of $0.62 earnings per share, reporting $0.52. The company's revenue was up 2.3% compared to the same quarter last year. Research analysts expect Tesla to post 1.75 EPS for the current year. In other news, Director Robyn M. Denholm sold 66,364 shares of the company's stock, valued at approximately $14,597,425.44.", "title": "Tesla (NASDAQ:TSLA) Trading 2.6% Higher", "sentiment": 0, "medoid_distance": null, "markdown_citation": "[AH](https://reporter.am/2024/09/09/tesla-nasdaqtsla-trading-2-6-higher.html)", "provocative": "low", "reporting_voice": "Objective", "entity_relation_graph": null, "as_string_key": "[2]"}, {"article_url": "https://www.world-today-news.com/us-stocks-closing-report-nonfarm-payrolls-fell-4-5-yahoo-stock-market", "article_id": "285a9293-3f5b-58af-b973-39487f46bdfd", "classification": "Finance", "country": "US", "source_id": "home - world today news", "page_rank": 26533, "domain_url": "world-today-news.com", "eng_title": "'US Stocks' Closing Report: Nonfarm payrolls fell 4.5%", "entities": {"Person": ["Huida"], "Organization": ["Apple", "Tesla", "S&P", "Goldman Sachs"], "Location": ["international market"], "Nationality": [], "Date": ["September", "2023"], "Event": [], "Money": [], "Law": [], "Quantity": [], "Time": ["one week"], "Sports": [], "Politics": [], "Title": ["technical expert"], "Number": [], "Arms": [], "Product": ["iPhone 16"], "Media": ["International Business Times"], "Transportation": [], "Religion": [], "Technology": [], "Space": [], "Medicine": [], "Language": [], "Science": []}, "image_url": "https://i0.wp.com/www.standartnews.com/media/1/2024/09/06/418435/640x360.webp?resize=150%2C150&ssl=1", "keywords": ["US Stocks", "Nonfarm Payrolls", "Tesla", "S&P"], "language": "en", "pub_date": "2024-09-07 02:08:00+00:00", "summary": "US stocks had a poor start to September, with nonfarm payrolls falling 4.5%. Tesla shares plummeted over 8%, while Huida's market value reached a record high in just one week. The S&P recorded its worst week since 2023. According to International Business Times, a Goldman Sachs technical expert who has made the most accurate predictions this year has turned bearish on US stocks, advising investors not to chase highs or lows in the turbulent international market. As Apple prepares to release the iPhone 16, investors are looking to the company as a potential source of hope for the market.", "title": "'US Stocks' Closing Report: Nonfarm payrolls fell 4.5%", "sentiment": -1, "medoid_distance": null, "markdown_citation": "[HO](https://www.world-today-news.com/us-stocks-closing-report-nonfarm-payrolls-fell-4-5-yahoo-stock-market)", "provocative": "medium", "reporting_voice": "Explanatory", "entity_relation_graph": null, "as_string_key": "[3]"}, {"article_url": "https://www.focus.de/finanzen/boerse/vorgaben-fuer-deutsche-boerse-us-maerkte-stoppen-hohe-verluste-tesla-aktie-legt-rasant-zu_id_260284967.html", "article_id": "d3c84829-7763-5fc4-8436-e7c7f18a0169", "classification": "Finance", "country": "DE", "source_id": "FOCUS online", "page_rank": 1592, "domain_url": "focus.de", "eng_title": "US Stock Markets Close with Mixed Results, Tesla's Stock Price Surges", "entities": {"Person": ["Ulrich Stephan"], "Organization": ["DAX", "Deutsche Bank", "Amazon", "Broadcom", "IBM", "MDAX", "Tesla", "Dow Jones Industrial Average", "Bayer", "US Federal Reserve", "Intel", "Travelers", "Dow Jones", "Boeing", "Nasdaq 100"], "Location": [], "Nationality": [], "Date": ["Thursday", "Wednesday", "September 18", "September"], "Event": [], "Money": ["$28 billion", "$687 billion"], "Law": [], "Quantity": ["40,974 points", "41,000-point", "18,921 points", "18,591 points", "25,296 points"], "Time": [], "Sports": [], "Politics": [], "Title": ["Chief Investment Strategist"], "Number": [], "Arms": [], "Product": [], "Media": [], "Transportation": [], "Religion": [], "Technology": [], "Space": [], "Medicine": [], "Language": [], "Science": []}, "image_url": "https://p6.focus.de/img/fotos/id_260284966/elon-musk.jpg?im=Crop%3D%280%2C131%2C3492%2C1745%29%3BResize%3D%281200%2C627%29&impolicy=perceptual&quality=mediumHigh&hash=4739f6268aa7141d3f4d8a5c67aab334e1af71765b4f03edbde2ff21274631df", "keywords": ["US Stock Markets", "Tesla", "Dow Jones", "Nasdaq 100", "Federal Reserve"], "language": "de", "pub_date": "2024-09-05 05:52:10+00:00", "summary": "US stock markets closed with mixed results on Wednesday: while the Dow Jones gained 0.1%, the Nasdaq 100 lost 0.2%. The phase of significant losses seems to be over. The Dow Jones Industrial Average ended the trading day with a gain of 0.1% at 40,974 points, bringing the 41,000-point mark within reach. The technology-heavy Nasdaq 100 lost 0.2% to 18,921 points. The best Dow performers were Travelers, IBM, and Boeing, each gaining around 1%. Intel and Amazon, on the other hand, were weaker. Tesla's stock price surged 4.18%, increasing the company's market value to $687 billion. This represents a gain of $28 billion, equivalent to the market value of Bayer. On Thursday, Broadcom will release its quarterly earnings. The US Federal Reserve may lower interest rates by 0.5% on September 18. Some market observers expect this, citing the weak US jobs report. Ulrich Stephan, Chief Investment Strategist at Deutsche Bank, comments, 'In an immediate reaction to the interest rate term markets, a robust interest rate cut of 0.5% was priced in for the US Federal Reserve meeting in September with a 50% probability.' The DAX continued to decline, closing 0.83% lower at 18,591 points. The MDAX of mid-cap companies fell 0.43% to 25,296 points.", "title": "Vorgaben f\u00fcr deutsche B\u00f6rse: US-M\u00e4rkte stoppen hohe Verluste, Tesla-Aktie legt rasant zu", "sentiment": 0, "medoid_distance": null, "markdown_citation": "[FOC](https://www.focus.de/finanzen/boerse/vorgaben-fuer-deutsche-boerse-us-maerkte-stoppen-hohe-verluste-tesla-aktie-legt-rasant-zu_id_260284967.html)", "provocative": "low", "reporting_voice": "Objective", "entity_relation_graph": null, "as_string_key": "[4]"}, {"article_url": "https://www.focus.de/finanzen/boerse/vorgaben-fuer-deutsche-boerse-tesla-aktie-im-hoehenflug-us-boersen-beenden-phase-hoher-verluste_id_260284967.html", "article_id": "53762509-2aa3-5bd7-aacb-47ce5c0d432d", "classification": "Finance", "country": "DE", "source_id": "FOCUS online", "page_rank": 1592, "domain_url": "focus.de", "eng_title": "US Stock Markets Show Signs of Recovery, Tesla's Market Value Surges", "entities": {"Person": ["Ulrich Stephan"], "Organization": ["Dow Jones Industrial Average", "Deutsche Bank", "Bayer", "DAX", "MDAX", "US Federal Reserve", "Nasdaq 100", "Tesla"], "Location": [], "Nationality": [], "Date": ["September", "Wednesday"], "Event": [], "Money": ["$687 billion", "$28 billion"], "Law": [], "Quantity": [], "Time": [], "Sports": [], "Politics": [], "Title": ["Chief Investment Strategist"], "Number": ["40,974", "18,921", "18,591", "25,296"], "Arms": [], "Product": [], "Media": [], "Transportation": [], "Religion": [], "Technology": [], "Space": [], "Medicine": [], "Language": [], "Science": []}, "image_url": "https://p6.focus.de/img/fotos/id_260284966/elon-musk.jpg?im=Crop%3D%280%2C131%2C3492%2C1745%29%3BResize%3D%281200%2C627%29&impolicy=perceptual&quality=mediumHigh&hash=4739f6268aa7141d3f4d8a5c67aab334e1af71765b4f03edbde2ff21274631df", "keywords": ["US Stock Markets", "Tesla", "Dow Jones", "Nasdaq 100"], "language": "de", "pub_date": "2024-09-05 05:52:10+00:00", "summary": "US stock markets closed with mixed results on Wednesday, with the Dow Jones Industrial Average gaining 0.1% to 40,974, while the Nasdaq 100 lost 0.2% to 18,921. The phase of significant losses appears to be over. Tesla's stock price rose 4.18%, increasing the company's market value to $687 billion. This represents a gain of $28 billion, equivalent to the market value of Bayer. Ulrich Stephan, Chief Investment Strategist at Deutsche Bank, commented, 'In an immediate reaction to the interest rate term market, a robust interest rate cut of 0.5 percentage points was priced in for the US Federal Reserve meeting in September with a 50% probability.' The DAX fell 0.83% to 18,591, while the MDAX lost 0.43% to 25,296.", "title": "Vorgaben f\u00fcr deutsche B\u00f6rse: Tesla-Aktie im H\u00f6henflug, US-B\u00f6rsen beenden Phase hoher Verluste", "sentiment": 1, "medoid_distance": null, "markdown_citation": "[FOC](https://www.focus.de/finanzen/boerse/vorgaben-fuer-deutsche-boerse-tesla-aktie-im-hoehenflug-us-boersen-beenden-phase-hoher-verluste_id_260284967.html)", "provocative": "low", "reporting_voice": "Explanatory", "entity_relation_graph": null, "as_string_key": "[5]"}, {"article_url": "https://www.investopedia.com/watch-these-tesla-price-levels-as-stock-tries-to-jumpstart-rally-8706725", "article_id": "767fd0d3-2075-5f8c-a272-c18fb9c2ac8a", "classification": "Finance", "country": "US", "source_id": "Investopedia", "page_rank": 231, "domain_url": "investopedia.com", "eng_title": "Watch These Tesla Price Levels as Stock Tries to Jumpstart Rally", "entities": {"Person": [], "Organization": ["Tesla"], "Location": [], "Nationality": [], "Date": ["April 2023", "Wednesday"], "Event": [], "Money": ["$152", "$219.41", "$185", "$300", "$265"], "Law": [], "Quantity": [], "Time": [], "Sports": [], "Politics": [], "Title": [], "Number": [], "Arms": [], "Product": ["technology stocks"], "Media": [], "Transportation": [], "Religion": [], "Technology": ["symmetrical triangle"], "Space": [], "Medicine": [], "Language": [], "Science": ["technical analysis"]}, "image_url": "https://www.investopedia.com/thmb/Ut1G3G-8bSBnUPwOsQ16Wt8gDG8=/1500x0/filters:no_upscale():max_bytes(150000):strip_icc()/TSLAChart-9cd03467fe8c4197b8ebd22fcb84d821.gif", "keywords": ["Tesla", "Stock Price", "Technical Analysis", "Rally"], "language": "en", "pub_date": "2024-09-05 02:24:50+00:00", "summary": "Tesla shares jumped 4.2% on Wednesday, closing at $219.41, despite a broader downturn in large-cap technology stocks. According to technical analysis, investors should watch for several key price levels: a breakout above the symmetrical triangle and downtrend line could see shares rally to $265, while further buying could drive a move up to $300. A breakdown below the triangle could see an initial fall to $185, and ongoing weakness may spark a decline to $152, where bargain hunters may look for buying opportunities near the April 2023 swing low.", "title": "Watch These Tesla Price Levels as Stock Tries to Jumpstart Rally", "sentiment": 1, "medoid_distance": null, "markdown_citation": "[I](https://www.investopedia.com/watch-these-tesla-price-levels-as-stock-tries-to-jumpstart-rally-8706725)", "provocative": "low", "reporting_voice": "Explanatory", "entity_relation_graph": null, "as_string_key": "[7]"}, {"article_url": "https://www.nasdaq.com/articles/what-next-after-tesla-stock-dropped-6-day", "article_id": "dd306526-7ddb-571c-a308-5d5394f6d728", "classification": "Finance", "country": "US", "source_id": "Nasdaq", "page_rank": 740, "domain_url": "nasdaq.com", "eng_title": "What Next After Tesla Stock Dropped 6% In A Day", "entities": {"Person": [], "Organization": ["S&P 500", "TSLA", "BMW", "NASDAQ", "Trefis High Quality", "Tesla", "HQ"], "Location": ["Europe"], "Nationality": [], "Date": ["2022", "2023", "July", "2021", "January 2021"], "Event": [], "Money": ["$211", "$235", "$210", "$230"], "Law": [], "Quantity": [], "Time": [], "Sports": [], "Politics": [], "Title": ["Vice President of Finance"], "Number": ["30"], "Arms": [], "Product": ["EV"], "Media": [], "Transportation": [], "Religion": [], "Technology": [], "Space": [], "Medicine": [], "Language": [], "Science": []}, "image_url": "https://www.nasdaq.com/sites/acquia.prod/files/2019-05/0902-Q19%20Total%20Markets%20photos%20and%20gif_CC8.jpg", "keywords": ["Tesla", "Stock Market", "EV Deliveries", "Executive Departures"], "language": "en", "pub_date": "2024-08-27 02:36:00+00:00", "summary": "Tesla stock (NASDAQ;TSLA) declined by 6% in a day, closing at $211 per share. The decline is attributed to BMW beating Tesla in EV deliveries in Europe for July and Tesla's Vice President of Finance resigning from the company. This is the latest in a series of top executive departures, which could be negatively impacting the stock. Looking at a longer time period, TSLA stock has seen a decline of 10% from $235 in early January 2021 to around $210 now, while the S&P 500 has increased by 50% over the same period. However, the decrease in TSLA stock has been far from consistent, with returns of 50% in 2021, -65% in 2022, and 102% in 2023. The Trefis High Quality (HQ) Portfolio, with a collection of 30 stocks, has outperformed the S&P 500 each year over the same period. Tesla's recent performance has been a mixed bag, with a nearly 7% year-over-year decline in automotive revenue and a 42% drop in earnings. However, the company's energy business has been a bright spot, with storage and energy sales doubling from the previous year. We value Tesla stock at $230 per share, which is slightly ahead of the current market price.", "title": "What Next After Tesla Stock Dropped 6% In A Day", "sentiment": -1, "medoid_distance": null, "markdown_citation": "[N](https://www.nasdaq.com/articles/what-next-after-tesla-stock-dropped-6-day)", "provocative": "medium", "reporting_voice": "Analytical", "entity_relation_graph": null, "as_string_key": "[8]"}, {"article_url": "https://www.finanznachrichten.de/nachrichten-2024-08/63079388-maerkte-europa-powell-gibt-gruenes-licht-fuer-boersenrally-nestle-ceo-geht-015.htm", "article_id": "4283f36c-212d-5495-939f-a06418d38e15", "classification": "Finance", "country": "DE", "source_id": "FinanzNachrichten.de", "page_rank": 8812, "domain_url": "finanznachrichten.de", "eng_title": "European Stock Markets Close with Gains, Powell Calls for Monetary Policy Adjustment", "entities": {"Person": ["Jerome Powell", "Mark Schneider", "Patrick Hummel", "Laurent Freixe"], "Organization": ["Infineon", "BMW", "Euro Stoxx 50", "Qimonda", "US Federal Reserve", "Infas Holding", "UBS", "Evotec", "Nestle", "Federal Reserve", "Tesla", "DAX"], "Location": ["EU", "Jackson Hole"], "Nationality": [], "Date": ["September", "Friday", "September 1"], "Event": ["Central Bankers' Forum"], "Money": ["6.80 euros", "753.5 million euros"], "Law": [], "Quantity": ["18,633 points", "4,909 points", "18,893 points"], "Time": [], "Sports": [], "Politics": [], "Title": ["CEO"], "Number": [], "Arms": [], "Product": ["electric vehicles"], "Media": [], "Transportation": [], "Religion": [], "Technology": [], "Space": [], "Medicine": [], "Language": [], "Science": []}, "image_url": "https://finanznachrichten.de/content/g/fb.png", "keywords": ["European Stock Markets", "Jerome Powell", "Monetary Policy Adjustment", "Interest Rate Cut"], "language": "de", "pub_date": "2024-08-23 18:52:00+00:00", "summary": "The European stock markets closed with significant gains on Friday. Federal Reserve Chairman Jerome Powell stated in his highly anticipated speech at the Central Bankers' Forum in Jackson Hole that the time for monetary policy adjustment has arrived. Inflation has decreased significantly, while a strong increase in unemployment should be avoided, according to Powell. The timing and pace of interest rate cuts are data-dependent. The markets are praising a potential first interest rate cut by the US Federal Reserve in September. The DAX closed with a gain of 0.8% at 18,633 points, with the all-time high of 18,893 points within reach. The Euro Stoxx 50 rose by 0.5% to 4,909 points. Nestle's CEO Mark Schneider has been replaced by Laurent Freixe, who will take over as CEO on September 1. The company's shares rose by 0.1%. Infineon has agreed with the insolvency administrator of Qimonda on a settlement, ending a long-standing lawsuit. The company will pay 753.5 million euros, while Infineon will take the formed provisions into account. The shares of Infineon rose by 0.3%. The shares of Infas Holding rose by 62.7% to 6.80 euros after an acquisition offer. BMW has surpassed Tesla as the leading seller of electric vehicles in the EU, according to UBS analyst Patrick Hummel. The shares of BMW rose by 1.5%, while Tesla's shares fell by 1.2%. Evotec's shares rose by 6.7% after a 'buy' recommendation by RBC and recent stock purchases by the company's board members. Hugo Boss's shares rose by 5.2% after Frasers Group reportedly asked the cartel office for permission to increase its stake in the company.", "title": "M\u00c4RKTE EUROPA/Powell gibt gr\u00fcnes Licht f\u00fcr B\u00f6rsenrally - Nestle-CEO geht", "sentiment": 1, "medoid_distance": null, "markdown_citation": "[FN](https://www.finanznachrichten.de/nachrichten-2024-08/63079388-maerkte-europa-powell-gibt-gruenes-licht-fuer-boersenrally-nestle-ceo-geht-015.htm)", "provocative": "low", "reporting_voice": "Objective", "entity_relation_graph": null, "as_string_key": "[9]"}, {"article_url": "https://www.morningstar.com/news/dow-jones/2024072411862/tesla-ends-down-123-sees-largest-percent-decrease-since-september-2020-data-talk-update", "article_id": "2c0307ab-9793-5f00-9ca6-d508296dbc2c", "classification": "Finance", "country": "US", "source_id": "Morningstar,", "page_rank": 2063, "domain_url": "morningstar.com", "eng_title": "Tesla Ends Down 12.3%, Sees Largest Percent Decrease Since September 2020 \u2014 Data Talk Update", "entities": {"Person": [], "Organization": ["Tesla, Inc.", "Tesla", "TSLA"], "Location": [], "Nationality": [], "Date": ["November 2021", "September 2020"], "Event": [], "Money": ["$215.99", "$30.39"], "Law": [], "Quantity": [], "Time": ["four days", "month-to-date"], "Sports": [], "Politics": [], "Title": [], "Number": [], "Arms": [], "Product": [], "Media": [], "Transportation": [], "Religion": [], "Technology": [], "Space": [], "Medicine": [], "Language": [], "Science": []}, "image_url": "https://www.morningstar.com/assets/img/dow-jones.51166f0.png", "keywords": ["Tesla", "Stock Market", "TSLA", "Stock Price"], "language": "en", "pub_date": "2024-07-24 20:27:00+00:00", "summary": "Tesla, Inc. (TSLA) closed at $215.99, down 12.33% or $30.39, marking its largest percent decrease since September 2020. The stock has been down three of the past four days, with a two-day decline of 14.12%. This is the worst two-day stretch since November 2021. Despite being down 13.08% year-to-date, Tesla is up 9.15% month-to-date. The company's stock has fallen 47.32% from its all-time closing high and 21.75% from its 52-week closing high.", "title": "Tesla Ends Down 12.3%, Sees Largest Percent Decrease Since September 2020 \u2014 Data Talk Update", "sentiment": -1, "medoid_distance": null, "markdown_citation": "[M](https://www.morningstar.com/news/dow-jones/2024072411862/tesla-ends-down-123-sees-largest-percent-decrease-since-september-2020-data-talk-update)", "provocative": "low", "reporting_voice": "Objective", "entity_relation_graph": null, "as_string_key": "[10]"}]}